author,body,created_utc,id,link_id,parent_id,score,stickied,subreddit_id
antimantium,"BPC and THC, (possibly also bacopa) are probably overpowering everything else including bromantane, I really wouldn't expect to notice it if I was taking either of the two.  In fact BPC has been known to blunt stimulants long term even after stopping.",1669984315,iym4kd2,t3_zafsrl,t3_zafsrl,5,False,t5_4aoxhu
Rpnot,Why do you bother with 15 min of sublingual which probably is 50% oral 50% sublingual and don’t the try the nasal spray ?,1669981222,iym050s,t3_zafsrl,t3_zafsrl,3,False,t5_4aoxhu
Adifferentdose,How much weed are you smoking? Weed is the strongest supplement you’re taking by leaps and bounds. It will interfere with your entire neurochemistry especially if you’re doing it before bed. If you want to have any clear picture of what anything is doing you need to be thc free for three weeks.,1669999992,iyn2f8o,t3_zafsrl,t3_zafsrl,3,False,t5_4aoxhu
,bromantane only works for me when I'm stressed,1669975449,iylt9ps,t3_zafsrl,t3_zafsrl,2,False,t5_4aoxhu
sirsadalot,Sublingual problems,1670002776,iyn9o82,t3_zafsrl,t3_zafsrl,2,False,t5_4aoxhu
,try adding vitamin b6,1670007634,iynlxtc,t3_zafsrl,t3_zafsrl,2,False,t5_4aoxhu
Greedy-Artichoke-416,Try mixing 100-150mg with bit of refined coconut oil and keep it sublingual for 20 minutes.,1669977220,iylv8j8,t3_zafsrl,t3_zafsrl,2,False,t5_4aoxhu
,Anything 25mg or above makes me feel like shit. Think it’s just doesn’t work for some ppl.,1669977636,iylvpus,t3_zafsrl,t3_zafsrl,3,False,t5_4aoxhu
KillerGnomeStarNews,THC? dumbest shit ever,1670018941,iyodgcs,t3_zafsrl,t3_zafsrl,-3,False,t5_4aoxhu
akflo,"Not what I wanted to hear, but thanks! That's interesting.",1669984949,iym5ks9,t3_zafsrl,t1_iym4kd2,3,False,t5_4aoxhu
Psychological-Egg595,No shit! I have never heard of this but I will say I have used quite a bit of bpc and I don't seem to get the same effects I used to from the exotic pre-work outs I use occasionally and I seem to have an odd caffeine tolerance despite not really using it regularly,1669992411,iymjzy9,t3_zafsrl,t1_iym4kd2,3,False,t5_4aoxhu
adamcegan,BPC-157 can permanently blunt stimulant effects? Seriously?,1670010490,iynsxih,t3_zafsrl,t1_iym4kd2,1,False,t5_4aoxhu
akflo,I only have access to powder. Would making the nasal spray be as easy as mixing it with distilled water?,1669981497,iym0i48,t3_zafsrl,t1_iym050s,1,False,t5_4aoxhu
akflo,"I like to think I don’t smoke a whole lot. I vape about 0.1 - 0.3g in the evening. Thanks for the tip, I’ll get off it soon.",1670043287,iyprbdz,t3_zafsrl,t1_iyn2f8o,2,False,t5_4aoxhu
akflo,"Will do, thanks!",1669981339,iym0alb,t3_zafsrl,t1_iylv8j8,1,False,t5_4aoxhu
akflo,I don’t mind,1670043203,iypr5tz,t3_zafsrl,t1_iyodgcs,1,False,t5_4aoxhu
akflo,Interesting. How long since quitting BPC? Also how long did you take it for and at what dosage?,1670046338,iypw85g,t3_zafsrl,t1_iymjzy9,1,False,t5_4aoxhu
antimantium,"What was the reason for taking quite a bit of BPC? What effects did it give you, or was it treating a problem?",1670022379,iyol1wi,t3_zafsrl,t1_iymjzy9,1,False,t5_4aoxhu
,you have to mix it with caprylic acid and heat it in an oven to dissolve properly,1669982803,iym2bc1,t3_zafsrl,t1_iym0i48,2,False,t5_4aoxhu
Psychological-Egg595,I ran bpc for probably 8-10 weeks a few times. 300-500 mg a day and sometimes at 1 mg a day. I first used it for some elbow issues from training/ bouncing for decades. Then next time I used it (bc it helped so much with healing and pain relief the first time) after a major pec tear at work (bouncing). The last time I used it was probably a year ago and I was beat to shit. Elbow again and pain in the right shoulder blade/shoulder in the side of the pec tear.  It helped every time. However I had less success with it the last run. TBH I was also the biggest I have ever been 6'2 250 and  around 10-12% bodyfat. So I was training hard and not giving my body enough of a break. I ran tb-500 alongside it most times as well... And some gh when I could 😊,1672842977,j2wtvv9,t3_zafsrl,t1_iyol1wi,1,False,t5_4aoxhu
akflo,"Thanks. Is there a step-by-step tutorial on how to make the spray (for someone w/ experience)? I'd like to order it, but I don't know long it will take to get to me and I'm pretty impatient.",1669984016,iym43uv,t3_zafsrl,t1_iym2bc1,3,False,t5_4aoxhu
Dbdbmama,"I used 50:50 c8:c10 product and didnt heat. Settles to bottom. Had to use the mistake purchased powder somehow tho. It Just a matter of potency/waste I imagine. Ill find out either way. Going to try my own not fully dissolved spray. Then compare to sirsadalot's when it arrives.   


Probably better to make a shitty half assed spray at home vs sublingual ROA? Or actually no for some reason?",1669988710,iymcabf,t3_zafsrl,t1_iym2bc1,1,False,t5_4aoxhu
sirsadalot,"Everychem.com, just order there

You saying you're impatient is the ironic part because it's much more convenient just to buy it",1670002833,iyn9tdd,t3_zafsrl,t1_iym43uv,3,False,t5_4aoxhu
Dbdbmama,"fookin nasal spray bottles LOL  
Looks like ill be using this oil/bromantane mixture via my mouth.  
Dont attempt to do the mix w/o heat.   


Its not that I didnt believe you blankXu, its I already mixed it up after trying to find conclusive noted on mixing it. You are correct tho, 100%. Mixing w/o heat is garbage lol but I have a heat plate in the mail and will attempt to add heat and get it dissolved. Might as well at this point.  


The crystals dont break down enough to be ejected from the tip without heating.",1669996383,iymtixo,t3_zafsrl,t1_iymcabf,1,False,t5_4aoxhu
akflo,I was hoping to whip something up over the weekend. I’ll just order it though I’m no fan of international shipping.,1670051466,iyq3420,t3_zafsrl,t1_iyn9tdd,2,False,t5_4aoxhu
