author,body,created_utc,id,link_id,parent_id,score,stickied,subreddit_id
,Using the nasal spray version and am doing one spray every three days in the morning (coinciding with workout days and taking about 45 mins before workout).,1646578352,hzkx11t,t3_t7zrye,t3_t7zrye,3,False,t5_4aoxhu
Paiz44,Following for comments,1646588583,hzll1mw,t3_t7zrye,t3_t7zrye,1,False,t5_4aoxhu
edhlee,"I’ve been dosing daily in the 50mg x 3-4 times per day (powder) or with the nasal spray maybe 2-3 times per day. I agree, I don’t feel anything acutely but also assume effects are cumulative… so have been doing this for a few months now. I assume taking a break makes sense, not just for tolerance reasons, but I haven’t done that yet as I’m using it to help reduce other things that I’ve been probably over-doing.",1646635437,hzoc6ur,t3_t7zrye,t3_t7zrye,1,False,t5_4aoxhu
EchoingSimplicity,Why once every three days? What benefits have you noticed?,1646582262,hzl5lsy,t3_t7zrye,t1_hzkx11t,1,False,t5_4aoxhu
,"Because I'm trying to keep tolerance of the motivation effects to a minimum. I'm using the spray as a helpful push for exercise, once every three days. 

Benefits seem to be a nice sense of calm and motivation. For me it's primarily about the help for exercise than the nootropic effects.",1646594047,hzlyfro,t3_t7zrye,t1_hzl5lsy,3,False,t5_4aoxhu
EchoingSimplicity,Isn't there supposed to be no tolerance build up for bromantane?,1646594574,hzlzp67,t3_t7zrye,t1_hzlyfro,2,False,t5_4aoxhu
1Reaper2,"It would be depending on dosage and on individual factors that govern dopamine receptor sensitivity. Its not necessarily a tolerance to the medication itself. 

So somebody with low levels of dopamine would likely already have very sensitive receptors, a small increase would not likely cause much down regulation if any at all.

In a case of somebody with high levels of dopamine due to natural production or using other dopaminergics concurrently, then yes they would likely experience more down regulation of the receptor.",1646597948,hzm7qbl,t3_t7zrye,t1_hzlzp67,4,False,t5_4aoxhu
,The motivation push is what I don't want to get tolerant to. The nootropics effect are separate.,1646648658,hzosjcl,t3_t7zrye,t1_hzlzp67,1,False,t5_4aoxhu
EYEi,"I have had good results for a few days that then the effect of bromantane stopped even when tripling the dose. I have asked ppl that said their results have been consistent for months. What do you think could be a reason for this huge variance of results. I have ADHD, so I was surprised to read ur comment about high dopamine producers possibly developing tolerance. Any help info in how this can be fixed would be really 👍",1647635492,i176hc5,t3_t7zrye,t1_hzm7qbl,2,False,t5_4aoxhu
1Reaper2,"Does the effect return if you cycle it?

I don’t know being completely honest. It could be a myriad of things. If using bromantane increases L-dopa production then it may be subject to the same issues with tolerance developed to L-dopa. In this situation it is best to cycle the compound on and off. 

You could concurrently run 9-me-bc to resensitise dopamine receptors but considering it is a research chemical with no long term data, this would be a potentially hazardous option. There are theories that the compound can be toxic or carcinogenic. I do not consider the toxicity of the compound to be a strong possibility, but I do not know enough about its potential as a carcinogen to refute that theory. 

Try cycling it for now, or use a very low dose and use something else concurrently like selegiline. Or use your ADHD diagnosis to use first line stimulants, modafinil or armodafinil.",1647636024,i177tpg,t3_t7zrye,t1_i176hc5,1,False,t5_4aoxhu
EYEi,"Thanks for taking the time.
I did as you suggested and did not take Bromantane for 3 days, after which the effects returned for the most part.
I have always been a bit puzzled on how something that strengthen dopamine signaling like bromantane can have no tolerance as a lot of ppl claim from experience, since even though the mechanism seems different from stimulants, must non the less result in more dopamine signaling at the receptor. So, if that is the case, I wonder if someone is sensitive enough to the substance that the effect of bromantane causes an increase of dopamine sudden enough to cause downregulation of receptors?

 I have access to prescription stimulants, and they do OK but I prefer to not rely on it in the long term. It would take a longer post to explain all my thoughts behind that. But in short, I prefer the effects of Bromantane, which also does things for me that Adderall doesn't.",1648351210,i29tt02,t3_t7zrye,t1_i177tpg,2,False,t5_4aoxhu
1Reaper2,"No problem.

You should look into other strategies to increase dopamine synthesis in that case. 

There is the MAO-B inhibitor I spoke of, Selegiline, or Rasagiline. 

High protein diet. Consistent exercise. There is a few ways to do it.

The resistance to Bromantane does not make sense to me either. However, my L-dopa theory might be right and that is well known.

So programme days off each week and don’t take as high of a dose. Go 5 days on and 2 days off each week. Personally I have only really used 10-20mg at a time. 

The high protein diet & exercise will further increase dopamine synthesis. The increase in tyrosine from your dietary protein will increase the substrate used to make dopamine. So you will further benefit from Bromantane usage.

The MAO-B inhibition helps keep it in the synapse instead of it being transported out and degraded. Its effects are mild so it would compound well without increasing L-dopa tolerance but also allowing you to increase dopamine activity.",1648368236,i2ahlsu,t3_t7zrye,t1_i29tt02,1,False,t5_4aoxhu
