author,created_utc,domain,id,is_self,num_comments,over_18,permalink,retrieved_on,score,selftext,stickied,subreddit_id,title,url
Intrepid_Ratio_7405,1657979809,self.NooTopics,w0h9oq,True,16,False,/r/NooTopics/comments/w0h9oq/ph94b_a_novel_gabaa_pam/,1709901542,8,"Not exactly a nootropic, maybe, but anxiety is pretty anti nootropic so..

From wikipedia:

”The pheromone androstenol has been found to act as a potent positive allosteric modulator of the GABAA receptor, and it has been proposed that this action may mediate its pheromone effects.[14] It produces anxiolytic-like effects in animals.[14] Androstadienol, androstadienone, and androstenone, all of which are also pheromones, have been found to be converted into androstenol, and as such, it may be responsible for their pheromone effects.[14] As fasedienol is very closely related structurally to androstadienol, it might be converted into androstenol similarly and hence potentiation of the GABAA receptor could contribute to its mechanism of action”

Will buy it soon as i can afford it, has anyone tried it?",False,t5_4aoxhu,PH94B a novel GABAA PAM,https://www.reddit.com/r/NooTopics/comments/w0h9oq/ph94b_a_novel_gabaa_pam/
Bierak,1657847616,fda.gov,vzbsci,False,0,False,/r/NooTopics/comments/vzbsci/blue_brain_boost_owners_sentenced_to_jail_for/,1709901542,4,,False,t5_4aoxhu,Blue Brain Boost owners sentenced to jail for selling Nootropics (untested),https://www.fda.gov/inspections-compliance-enforcement-and-criminal-investigations/press-releases/fort-collins-couple-sentenced-federal-prison-illegally-selling-unapproved-drugs
