author,body,created_utc,id,link_id,parent_id,score,stickied,subreddit_id
sirsadalot,"Glutamate is not inherently toxic lol and if you had none you'd be retarded. You can have toxic levels of glutamate but to suggest that everyone with PTSD is experiencing that, especially into the future. Is a reach.",1690632387,jtxk1fw,t3_15cowd6,t3_15cowd6,6,False,t5_4aoxhu
Fancy-Category,"NAC can help reduce excess glutamate. I take 2-3 times a day on an empty stomach. Taurine can improve the GABAergic system, which I take also 2 times a day, empty stomach.",1690634153,jtxno1o,t3_15cowd6,t3_15cowd6,3,False,t5_4aoxhu
Myloux,"I second NAC for lowering glutamate. However, know that increasing GABA can also indirectly lower it since GABA acts like the ""brakes"" in a neuron, preventing it from becoming overexcited. I recommend looking into the following which I have personally tried (and AI has helped me sum up):

&#x200B;

**NAC (N-acetyl cysteine):** NAC is an amino acid and antioxidant that can modulate glutamate levels and enhance the synthesis of glutathione, a key antioxidant in your body. It's used for a variety of health issues including mood disorders, brain health, and inflammation. Some research has suggested that NAC may help to reduce the excitotoxicity caused by too much glutamate.

**Inositol:** Sometimes referred to as vitamin B8, inositol plays an important role in neurotransmitter signaling and can influence the action of glutamate. Some studies suggest that inositol supplementation may help in reducing anxiety and panic disorders, conditions often associated with an imbalance between GABA and glutamate.

**Magnesium:** This essential mineral acts as a natural NMDA receptor antagonist, which can block the effects of excess glutamate and potentially prevent its excitotoxic effects.

**Taurine:** This amino acid can act as an inhibitory neurotransmitter in your brain, where it can trigger GABA receptors much like GABA itself. It also has a protective effect against glutamate excitotoxicity.

**L-Theanine:** Found in tea, especially in green tea, L-Theanine can increase levels of GABA and other calming brain chemicals. It also reduces levels of chemicals associated with stress and anxiety.

**Lamictal (Lamotrigine):** While not a supplement but a medication, Lamictal is often used in the treatment of epilepsy and bipolar disorder. It is thought to work by reducing the release of glutamate in the brain, thereby dampening the overactive nerve impulses that can lead to seizures and mood episodes.",1690652263,jtyvnca,t3_15cowd6,t3_15cowd6,3,False,t5_4aoxhu
Riprock666,"memantine can mitigate glutamate toxicity... but needs to be started super low dose (1mg) and titrated up to perhaps 5mg per day... it is super long lasting in your body (about 80 hours). I have never done more than 5mg/day and I took 2 weeks to titrate up to that... I rarely use for longer than 3-4 weeks at a time...  It will make coffee feel like amphetmine (for some people) I'm exagerating of course... but it can make stimulants more pwoerful... higher doses can give you brain fog....  dont start at 10mg... you might even get 2 days worth of brain fog from 2.5mg.  after that you will feel pleasantly confident and easily stimulated.... These effects dont always last... I'm of course primarily speaking for myself, and others may share my personal experience.. for some people it doesn't work well... like many drugs each personal experience can be a little different.",1690659991,jtzedcc,t3_15cowd6,t3_15cowd6,2,False,t5_4aoxhu
SandyBad,typo?,1690628705,jtxdfu0,t3_15cowd6,t3_15cowd6,1,False,t5_4aoxhu
-Moonshield-,"Stop eating sugar / lower your carbs and increase fats. Easiest way to do that.

This method has been proven to help and sometimes cure epilepsy which is exactly just that. Glutamate excitotoxicity.",1690659273,jtzcku3,t3_15cowd6,t3_15cowd6,1,False,t5_4aoxhu
Friedrich_Ux,NAC helps normalize glutamate release and quells oxidative stress especially in combination with Glycine.,1690729406,ju2wbr1,t3_15cowd6,t3_15cowd6,1,False,t5_4aoxhu
VillageInevitable,"Im pleased you posted this (not that you are suffering) I'm on this same path if investigating excess glutamate.

I've suffered from anxiety, depression, intrusive thoughts, brain fog and ADHD since a very young age. Most recently, i have developed Fibromyalgia, poor working memory. And I think a lot of my issues are linked in some way with excess glutamate. Along with the known issuse that high glutamate causes such as anxiety, ocd, adhad and fibromyalgia I have a couple of additional items to add to the mix  :

- Alcohol: lot my symptoms go away when drinking alcohol, due to glutamate suppression and increased gaba. Paradoxically, the symptoms come come back 10 fold during glutamate rebound, sometimes causing panic attacks.... I can no longer drink alcohol 

- Diet Glutamate/Glutamine rich foods (MSG, Bone broth, etc) and inhibitors. These seem to trigger me mentally. I remember consuming a load of l-Glutamine and then having near psychosis, similar with bone broth 

What are your thoughts on these?",1691244296,juwdra5,t3_15cowd6,t3_15cowd6,1,False,t5_4aoxhu
Riprock666,Glutamate is not toxic in the sense that you get sick from having too much glutamate... but it is toxic for your neurons... it will kill neurons... this could possibly lead towards dementia or some other sort of brain debilitating disease...  a low constant dull brain fog is an example...,1690660256,jtzf1ao,t3_15cowd6,t1_jtxk1fw,2,False,t5_4aoxhu
Megatron_McLargeHuge,"The glutamate excitotoxicity hypothesis in neurological disorders isn't about global glutamate levels. The idea is weakened neurons are more susceptible to spikes in extracellular glutamate. Spikes can be caused by reuptake failure or a cascade effect where damaged neurons and astrocytes dump stored glutamate, harming their neighbors.

This is a well established process in ischemia, but more hypothetical in chronic diseases. It's the motivation for trying NMDAr antagonists in AD.",1690732276,ju332jp,t3_15cowd6,t1_jtxk1fw,2,False,t5_4aoxhu
No-Computer-374,Yes .  Too much glutamate is harmful.  And I also have ptsd,1690638592,jtxxhbf,t3_15cowd6,t1_jtxk1fw,1,False,t5_4aoxhu
Pure_Nourishment,u/sirsadalot Wouldn't Agmatine or Neboglamine be good for glutamate regulation?,1690682683,ju0tfvb,t3_15cowd6,t1_jtxk1fw,1,False,t5_4aoxhu
No-Computer-374,Thanks I will try these,1690638694,jtxxpts,t3_15cowd6,t1_jtxno1o,1,False,t5_4aoxhu
Riprock666,agreed yes start with NAC,1690660048,jtzeiak,t3_15cowd6,t1_jtxno1o,1,False,t5_4aoxhu
No-Computer-374,Thankful .  I will try these . What is the cause of GABA reduction?,1690655821,jtz4did,t3_15cowd6,t1_jtyvnca,3,False,t5_4aoxhu
ConsequenceLatter978,Glycine ?,1690876089,jubcwvt,t3_15cowd6,t1_jtyvnca,2,False,t5_4aoxhu
Riprock666,">Lamictal (Lamotrigine)

Great stack... yes agreed.. try supps before drugs...",1690660103,jtzen8j,t3_15cowd6,t1_jtyvnca,0,False,t5_4aoxhu
No-Computer-374,Thanks for the explanation about its dosage and side effects.  I have to convince the doctor to prescribe it for me,1690671410,ju05dz5,t3_15cowd6,t1_jtzedcc,1,False,t5_4aoxhu
No-Computer-374,Yeah . One,1690638708,jtxxr4z,t3_15cowd6,t1_jtxdfu0,1,False,t5_4aoxhu
No-Computer-374,Thanks. But with these symptoms it is difficult,1690671539,ju05o0w,t3_15cowd6,t1_jtzcku3,1,False,t5_4aoxhu
No-Computer-374,I heard the most advice about nac.  Thankful .  I will also try glycine,1690850138,jua37g7,t3_15cowd6,t1_ju2wbr1,1,False,t5_4aoxhu
No-Computer-374,"I have your symptoms too. I havent drink alcohol, but I heard that it increases gaba. About diet It doesn't take a sudden effect to understand.  But I don't think it will be so effective.  What has helped you?",1691260049,juxhhzg,t3_15cowd6,t1_juwdra5,1,False,t5_4aoxhu
Loose_Work_6138,Benzo did this to me.,1690672305,ju07ccl,t3_15cowd6,t1_jtzf1ao,2,False,t5_4aoxhu
No-Computer-374,Yes .  Fibromyalgia is caused by limbic damage (maybe not so much) and limbic sensitization.,1690672827,ju08ilh,t3_15cowd6,t1_jtzf1ao,1,False,t5_4aoxhu
sirsadalot,I said in my message that you can have toxic levels. FYI your neurons need glutamate to survive and develop properly as well. I don't think you're getting the difference,1690721286,ju2f8d3,t3_15cowd6,t1_jtzf1ao,1,False,t5_4aoxhu
sirsadalot,"I never said it wasn't regional with most disorders, but it's not just ""weakened neurons"" either, as you can cause excitotoxicity in healthy neurons as well with a high enough concentration",1690735836,ju3bkl7,t3_15cowd6,t1_ju332jp,1,False,t5_4aoxhu
sirsadalot,Agmatine is debatable if it's optimal for a non depressed person but Neboglamine definitely,1690721222,ju2f42r,t3_15cowd6,t1_ju0tfvb,3,False,t5_4aoxhu
No-Computer-374,ok thanks for guidance🙏,1690672437,ju07mqd,t3_15cowd6,t1_jtzeiak,1,False,t5_4aoxhu
Myloux,"It’s like going to the doctor and asking why you have a headache or how you can bite your own teeth – it’s almost impossible to find a single answer, let alone any :) There are so many possibilities. But stress and trauma definitely have a role to play, so for now, do the things that are in your control:

1. Avoid stressful actions such as receiving information-overload by being on the phone.

2. Perform relaxing activities such meditating or going for a walk.

3. Possibly take supplements that increase GABA, inhibit the firing of glutamate, and/or modulate the relationship between the two.",1690656344,jtz5n1w,t3_15cowd6,t1_jtz4did,1,False,t5_4aoxhu
Myloux,"Glycine doesn’t necessarily increase or lower glutamate levels directly because it’s role as a co-agonist at the NMDA receptors can modulate the sensitivity of these receptors to glutamate.

So, it could influence those levels, but it’s not that straight forward. It would depend on other factors like the overall balance of neurotransmitters and your brain chemistry. This makes it possible to even increase glutamate even though it is already too high due to a dysfunction in the system, such as receptor modulation :)",1690878667,jubg6id,t3_15cowd6,t1_jubcwvt,1,False,t5_4aoxhu
No-Computer-374,Ok 🙏,1690672930,ju08r10,t3_15cowd6,t1_jtzen8j,1,False,t5_4aoxhu
Myloux,yea..?,1690661378,jtzht13,t3_15cowd6,t1_jtzen8j,1,False,t5_4aoxhu
Riprock666,Cosmic nootropic carries it... no script required,1690671470,ju05ir4,t3_15cowd6,t1_ju05dz5,1,False,t5_4aoxhu
SandyBad,through the phone?,1690644822,jtyca77,t3_15cowd6,t1_jtxxr4z,1,False,t5_4aoxhu
-Moonshield-,You won't know until you try. Be tuff.,1690675739,ju0et9n,t3_15cowd6,t1_ju05o0w,1,False,t5_4aoxhu
VillageInevitable,"Im still looking 12 years on, and I've not had much success I'm afraid

Tried most of the obvious ones, NAC, lemon balm, L-theanine, Glycine, magnesium, ala, zinc, b1 (high quality) 

Restricted diets helps a bit",1691274129,juyfhpq,t3_15cowd6,t1_juxhhzg,1,False,t5_4aoxhu
Megatron_McLargeHuge,"Yes, but as you said, that wouldn't persist in OP's case. However there might be some long term sensitizing effect in fibromyalgia that would make NMDAr antagonists worth exploring.",1690736280,ju3cn8g,t3_15cowd6,t1_ju3bkl7,1,False,t5_4aoxhu
Pure_Nourishment,Ah okay. As someone struggling with depression myself I've been using Agmatine with some success. Problem was that after a while I started becoming a bit too numb or dull. Currently trying to lower my dose and combine with bromantane to get a little pep in my step. Worked well yesterday.,1690723447,ju2jd3c,t3_15cowd6,t1_ju2f42r,1,False,t5_4aoxhu
No-Computer-374,"For a long time, I did not know what my illness was.  Ignorant doctors.And I have become very addicted to phone.  And maybe that's why my symptoms got worse.  I hope the supplements  and strating relaxing activitis help",1690672007,ju06ouo,t3_15cowd6,t1_jtz5n1w,2,False,t5_4aoxhu
No-Computer-374,"In my country, these drugs are not allowed without a doctor's prescription",1690671662,ju05xpa,t3_15cowd6,t1_ju05ir4,1,False,t5_4aoxhu
No-Computer-374,"Oh, I understand now, yes",1690672530,ju07u3u,t3_15cowd6,t1_jtyca77,1,False,t5_4aoxhu
Riprock666,refering to the constant dopamine spike we all get from constantly scrolling through TikTok videos,1690660345,jtzf9i2,t3_15cowd6,t1_jtyca77,1,False,t5_4aoxhu
No-Computer-374,Yeah tnx.  I have to try,1690850332,jua3nnd,t3_15cowd6,t1_ju0et9n,1,False,t5_4aoxhu
No-Computer-374,"How did you spend your days in these years?  I have been like this for 5 years.  I had zero progress.  I don't know whether these expensive supplements can be trusted or not.  I preferred to improve my diet
I went to a neurologist.  He took a color map of the brain and said that the alpha waves of your brain are low.  He wrote rtms and hypnotherapy that I haven't gone to yet",1691291544,juzgmxy,t3_15cowd6,t1_juyfhpq,1,False,t5_4aoxhu
sirsadalot,Nmdar recognition site gets sensitized via tolerance to dissociatives unfortunately. Tropisetron seems to simultaneously improve excitotoxicity and has been used successfully for fibromyalgia pain. I think that might be better,1690737421,ju3fe6k,t3_15cowd6,t1_ju3cn8g,1,False,t5_4aoxhu
Riprock666,"same in USA, but... that hasn't stopped people from ordering and self administering safely",1690671717,ju06232,t3_15cowd6,t1_ju05xpa,2,False,t5_4aoxhu
Megatron_McLargeHuge,That's an interesting one for sure. Methylene blue is another candidate.,1690738514,ju3i1v4,t3_15cowd6,t1_ju3fe6k,1,False,t5_4aoxhu
No-Computer-374,I have asked several times to take medicine from the pharmacy without a doctor's prescription.  But they strongly resist giving nerve drugs.  Im in middle east,1690672295,ju07bim,t3_15cowd6,t1_ju06232,1,False,t5_4aoxhu
