author,body,created_utc,id,link_id,parent_id,score,stickied,subreddit_id
sirsadalot,"Hopefully one day we can push for a legal avenue for people who want to sell nootropics over the counter. There's really no valid reason to ban Piracetam, just an authoritative push for maintaining the current pharmaceutical system. Pharmaceutical companies could make money selling these things over the counter. As long as it fits Corneliu's guidelines for safety I don't see a moral problem with it. Obviously the FDA would like their power moves to be seen as them being ethical but that's not really the case.

As for Phenibut and Tianeptine, I'm not as quick to defend them. But it's unfair to put everything on a level playing field.",1697323045,k4wjbtl,t3_177xv35,t3_177xv35,14,False,t5_4aoxhu
mrmczebra,I just wanted to thank you for doing this work for the benefit of the community so we can be informed.,1697322132,k4wh6v3,t3_177xv35,t3_177xv35,5,False,t5_4aoxhu
HankHill2160,"It's just amusing to me how people are getting in trouble for selling piracetam. It just makes me think of the places where it's legal to buy cocaine and meth, like what?? (Not that I personally agree with it or not)

I wish there was a way to kick the FDA's ass and have them fuck off. I always fear that they're going to start messing with sirsadalot.

Is there ever anything we can do to mitigate further growth of the FDA's control and power?",1697393887,k50aaqx,t3_177xv35,t3_177xv35,4,False,t5_4aoxhu
Bierak,"Basically all of this has to with one men behind the attack against supplements and nootropics: Pieter D Cohen:

https://www.menshealth.com/health/a36945827/toxic-supplement-hunter-pieter-cohen-md/

Here you can read his crussade against Piracetam. This was published in 2020, so one year before the Piracetam ban started.
https://www.ncbi.nlm.nih.gov/pmc/articles/PMC6902196/

This men has an obsessive and personal affair against nootropics. He was responsible for placing piracetam in the category of toxic and dangerous drug by the FDA.
It will be a relief for freedom and human progress when this guy stops bothering us with his sick obsession (for whatever reasons he disappears, but he leaves soon!)",1697536030,k58k1z8,t3_177xv35,t3_177xv35,3,False,t5_4aoxhu
Kootlefoosh,In response to post by /u/gintrux,1697314101,k4vxdf9,t3_177xv35,t3_177xv35,2,False,t5_4aoxhu
gintrux,"That is interesting… interesting how racetams have been included there and things like prl-853 haven’t. Does this imply FDA now certifies prl-853?

Although selling phenibut and tianeptine is a bit shady though… the former one is well known to have addictive properties and latter is kind of mu-opioid agonist… of course I can understand everything has it’s place and a role.

Overall, cannot side with FDA on this, should have issued something analogous to cease and desist…",1697316019,k4w27gk,t3_177xv35,t3_177xv35,2,False,t5_4aoxhu
Thankkratom2,Allegedly they weren’t censoring it on reddit. I talked with one of the r/nootropics mods.,1697314450,k4vy8rd,t3_177xv35,t3_177xv35,1,False,t5_4aoxhu
0vermind74,"I'm getting really heated and upset about this. It has nothing to do with /u/misteryouaresodumb specifically, but the fact that according to the first document, it states that,

“these drugs are **prescription drugs** due to their toxicity and potential for harmful effect” and “Central Bioscience and Eftang sold these **prescription drugs** without a prescription from a practitioner license to administer such drugs.” 

Wtf? Specifically, they are staying that anything can be classified as a prescription drug if it has the potential for toxicity or harmful affect. Is this really a law? That could be just about any nootropic. Yes, more government control and charging vendors with misdemeanors is definitely the answer.",1699754273,k8vh8np,t3_177xv35,t3_177xv35,1,False,t5_4aoxhu
Exact_Ad2286,"I bang 3 grams of tia a day and I sure don't have a substance use problem! S/ but tbh I don't care if people use either of those, there's worse even domestically if people seek them out as options.",1697673889,k5h8086,t3_177xv35,t1_k4wjbtl,2,False,t5_4aoxhu
tapestry0fm0lecules,Yes thank you,1697411678,k51l8i1,t3_177xv35,t1_k4wh6v3,1,False,t5_4aoxhu
tapestry0fm0lecules,Anarchy I think is the only way,1697411870,k51loo7,t3_177xv35,t1_k50aaqx,2,False,t5_4aoxhu
CryptoEscape,Stop voting for politicians that appoint (executive) and approve (Senate) former pharma executives in charge of the FDA….oh wait that’s literally every politician,1697421581,k528bek,t3_177xv35,t1_k50aaqx,2,False,t5_4aoxhu
BroScienceAlchemist,"The FDA explicitly began going after racetams a few years ago. The most I can speculate is that piracetam is being studied as a possible medical treatment for neurodegenerative diseases, and could be profitable if it becomes an FDA approved treatment. There are not many approved treatments for Alzheimers. I didn't look too closely into it, but the quality of studies has been poor. The clampdown has been indirect by pressuring payment processors, who push vendors into smaller markets. Ceretropic had to shut down because they could not get payment processors to work with them, and the market of consumers that will use crypto is too small to sustain the scale they had grown into.

Phenibut was always just a matter of time as GABAnergic drugs get heavy scrutiny, and its addictive properties make it very undesirable as a nootropic. The long half-life also makes it much more addiction-prone than GHB, which requires active redosing 24/7. However, the compulsion to keep redosing GHB is much stronger due to its much stronger effects.

Nootropics Depot's plea agreement is one year of probation with no fines, as they are more interested in signaling to other vendors that they will take legal action.",1697318332,k4w81ng,t3_177xv35,t1_k4w27gk,2,False,t5_4aoxhu
0vermind74,"The mu-opioid receptor made me think, well, but what about Kratom? Where is the line? I thought the line was scheduling drugs and clarifying analogs. Ok that's fine, I can understand scheduling and the regulation of analogs, but none of the stuff they are attacking are scheduled. It's like one branch of the FDA knows that they can't get things scheduled that they would like to, so they set their sights on other ways to pass penalties or punishments. Specifically the document said that these are “prescription drugs due to their toxicity and potential for harmful effect” and that he sold them without a prescription or prescribers license.",1699754553,k8vhuqw,t3_177xv35,t1_k4w27gk,2,False,t5_4aoxhu
BorgoDorgo3950,"I wouldn't really trust any of their mods. They banned my old account for mentioning sirsadalot once. I asked why I was banned, then they proceeded to make fun of me and  I got banned from a few other subreddits that they moderated as well. I wasn't even active in any of the subs so I was banned without reason. 🤷‍♂️",1697393748,k509x7s,t3_177xv35,t1_k4vy8rd,7,False,t5_4aoxhu
gintrux,somehow my account is even banned there for diverting attention from ND products basically,1697315613,k4w16jf,t3_177xv35,t1_k4vy8rd,6,False,t5_4aoxhu
sirsadalot,"I like to think about things from the perspective of ""what do we want to be viewed as to the public"". If you tie addictive drugs into what could be a harmless, borderline supplement-like interest, then you're spoiling the cause. I like to follow Corneliu's guidelines for nootropics, and I don't think it's right to sell anything that could get someone addicted, even if I do believe in people having the power to make their own decisions.",1697698039,k5iipg0,t3_177xv35,t1_k5h8086,2,False,t5_4aoxhu
gintrux,"The phenibut and tianeptine does have scientific research showing addiction liability, and those studies were published during the time ND were selling them, so they knew about it. I think that’s the true reason the government attacked. Because in the plea agreement, they demand asset forfeiture only from the sales of tianeptine. And they did not demand asset forfeiture from any other compound sales.",1699780356,k8wpfrj,t3_177xv35,t1_k8vhuqw,1,False,t5_4aoxhu
Exact_Ad2286,"That's true. Also I found this whole case weird, I also follow rc/substance subs so I see he had afanils/racetams and I'm like he's really getting popped over that? It's ridiculous, those are as abusable as caffeine imo.",1697698432,k5ij8hg,t3_177xv35,t1_k5iipg0,2,False,t5_4aoxhu
Exact_Ad2286,"I also don't mean to drag more discussion of substances like that into it, it's just what the guy currently has is harmless in the grand scheme of things to me. If they're gonna pursue him are they going to pursue gas stations for largely making income off purchases of energy drinks and  moist snuff? That's what the FDA views as the number one contributing factor to substance use issues in the USA let alone subversion from government offices? Really?",1697698577,k5ijfhj,t3_177xv35,t1_k5iipg0,2,False,t5_4aoxhu
0vermind74,"Do you know if they sent them a cease and desist about Tianeptine? Even so, why don't they schedule Tianeptine first? I don't necessarily have anything against that, there is a concerning amount of addiction, and subreddits dedicated to people that are very seriously addicted to it. Transparency is a very important topic to me, and it's one our government absolutely sucks at. I'm fine if things are spelled out. You may not agree with something that is spelled out and the restrictions enacted, but you know the lines and you choose to cross them or not cross them. Nonetheless, I still come back to their definitions and descriptions. Seems wrong to me.",1701328023,kbdj4h2,t3_177xv35,t1_k8wpfrj,1,False,t5_4aoxhu
