author,body,created_utc,id,link_id,parent_id,score,stickied,subreddit_id
sirsadalot,There's added polysorbate 80 (structure protection) and sodium benzoate and/ or potassium sorbate (bacterial protection) but still recommend storing any peptide in a refrigerated space upon receiving it. Especially if you aren't keeping it in a temperature controlled space.,1702579371,kdcsle1,t3_18icrzw,t3_18icrzw,4,False,t5_4aoxhu
Reasonable_Dot_1831,Definitely not when they are reconstructed,1702573911,kdcdhw5,t3_18icrzw,t3_18icrzw,1,False,t5_4aoxhu
krgrunst,Thanks for your reply!  I am keeping them in the fridge,1702579413,kdcspe5,t3_18icrzw,t1_kdcsle1,1,False,t5_4aoxhu
ScootieSkip,"Do you plan on releasing the Androstadienone – Spray Solution, it smelt hella good to be honest 😄",1702678489,kdj4rgt,t3_18icrzw,t1_kdcsle1,1,False,t5_4aoxhu
krgrunst,They come already in liquid.  No reconstitution is required,1702575047,kdcgmyu,t3_18icrzw,t1_kdcdhw5,1,False,t5_4aoxhu
Reasonable_Dot_1831,"Yeah ok, they do not sell BPC-157, they sell BPC-157 Acetate. It's a more stable version.",1702575298,kdchbje,t3_18icrzw,t1_kdcgmyu,2,False,t5_4aoxhu
krgrunst,Do you know if it’s a similar situation with the Ipamorelin?,1702575389,kdchkkt,t3_18icrzw,t1_kdchbje,1,False,t5_4aoxhu
