author,body,created_utc,id,link_id,parent_id,score,stickied,subreddit_id
Upset_Scientist3994,"Here is about CNTF something.

https://mybiohack.com/blog/cntf-what-it-is-and-how-to-increase-it

Aspirin what some people use low dose in order to benefit microcirculation of blood seems to be one of known remedies to upregulate CNTF.",1706036269,kj8fhwk,t3_196ssgm,t3_196ssgm,1,False,t5_4aoxhu
computerstuffs,What aspirin dose would you suggest for this?,1706043375,kj914lk,t3_196ssgm,t1_kj8fhwk,1,False,t5_4aoxhu
Upset_Scientist3994,"There is no idea on that. My bet also that there is some many more CNTF upregulators, but they are not just being researched so nobody knows.",1706617763,kk8ziy9,t3_196ssgm,t1_kj914lk,1,False,t5_4aoxhu
