author,created_utc,domain,id,is_self,num_comments,over_18,permalink,retrieved_on,score,selftext,stickied,subreddit_id,title,url
IllCommunication-973,1685989349,self.NooTopics,141nf4y,True,13,False,/r/NooTopics/comments/141nf4y/tak653_dosage_question/,1709901399,6,"I am not well versed in liquid verse powder conversions. Can someone help me figure out how to administer TAK-653 to get a dose of 5 mg? Also, how much is a spray of Bromatine? I feel dumb asking this question, but I really want to be somewhat accurate in my doses :)

&#x200B;

Thanks Ya'll",False,t5_4aoxhu,TAK-653 Dosage question,https://www.reddit.com/r/NooTopics/comments/141nf4y/tak653_dosage_question/
CryptographerThis174,1685728456,self.NooTopics,13yjmob,True,3,False,/r/NooTopics/comments/13yjmob/private_sale_of_isrib/,1709901399,4,"Would anybody be able to sell me some ISRIB. I got a concussion twice when I had been 9 and 10. My parahippocampal place area was a bit messed up as a result. Anybody who's able to get it off of New Mind; I'm not since I'm not of any affiliation to a University or anything. 

I'm willing to pay 10 dollars extra for anybody who does ship it. We can work out payment through Chat or whatever works best.",False,t5_4aoxhu,Private Sale of ISRIB,https://www.reddit.com/r/NooTopics/comments/13yjmob/private_sale_of_isrib/
