author,body,created_utc,id,link_id,parent_id,score,stickied,subreddit_id
Friedrich_Ux,Potassium and choline status both need to be optimal for racetams to convey full benefits.,1648858695,i31v2u3,t3_tu5jt4,t3_tu5jt4,3,False,t5_4aoxhu
The-Swiss-Chad,Tolerance maybe?,1648913352,i348fdt,t3_tu5jt4,t3_tu5jt4,1,False,t5_4aoxhu
infrareddit-1,I don’t know. I used it for ten years without noticeable diminishment in effectiveness.,1648936607,i35mq5c,t3_tu5jt4,t3_tu5jt4,1,False,t5_4aoxhu
Infinite_Employ3379,"Same problem with me but Fasoracetam instead of Piracetam. May have happened with phenylpiracetam too.

At least the anxiolytic part.

I want to know why exactly. Same thing with Agmatine after taking something else.",1648944491,i362sm5,t3_tu5jt4,t3_tu5jt4,1,False,t5_4aoxhu
TheReviewNinja,"Eh, I tried adding potassium chloride salt to my diet, but that didn't work for me.",1648866246,i329uij,t3_tu5jt4,t1_i31v2u3,1,False,t5_4aoxhu
PickleMicheal,Try drinking coconut water and using electrolytes from time to time for more potassium. Maybe changing source of choline could help aswell?,1648890725,i338byg,t3_tu5jt4,t1_i329uij,1,False,t5_4aoxhu
