author,body,created_utc,id,link_id,parent_id,score,stickied,subreddit_id
infrareddit-1,"I do take mine sublingually, but I don’t know if it improves absorption.",1696346691,k3altlp,t3_16ys960,t3_16ys960,4,False,t5_4aoxhu
NoSeaworthiness8089,"Rectally is recommend and best. All of the studies and literatures administered it that way. 

Best way to do it is to get your dose in the dropper and With your legs in the air, use a little bit of the liquid as lube and insert the dropper and squeeze it in.

Also, it’s recommended that you stick it in and out a few times to make sure that you really get the liquid in and none of it gets wasted",1696371133,k3cj1kj,t3_16ys960,t3_16ys960,8,False,t5_4aoxhu
Efik_Pail,"Hello,
Tak-653 can be taken sublingually but it's not necessary, the solution can be directly swallowed.",1696343194,k3acfxd,t3_16ys960,t3_16ys960,2,False,t5_4aoxhu
l0cknessmonsta,I do .5ml held underneath my tongue for 5 minutes then swallow.,1696368597,k3cc4yv,t3_16ys960,t3_16ys960,2,False,t5_4aoxhu
taktician-653,"TAK-653 can be taken sublingually or orally. Due to its high oral bioavailability, there is not much of a material advantage to sublingual administration",1696378179,k3d0dwf,t3_16ys960,t3_16ys960,2,False,t5_4aoxhu
IllogicalBias,what are you even asking lol... Sublingually obviously,1696366000,k3c4j21,t3_16ys960,t3_16ys960,0,False,t5_4aoxhu
,[deleted],1696370768,k3ci32o,t3_16ys960,t3_16ys960,1,False,t5_4aoxhu
limitless1370,Boofing is the best 😂 let it sit under the tongue for 30 mins and swallow,1696444656,k3gr2qb,t3_16ys960,t3_16ys960,1,False,t5_4aoxhu
TheMuMPiTz,How much is a good dose to start with?,1696350085,k3av5jf,t3_16ys960,t1_k3altlp,1,False,t5_4aoxhu
Efik_Pail,"2mg (0,5ml) would be the ""standard"" dose.",1696360714,k3boxm2,t3_16ys960,t1_k3av5jf,2,False,t5_4aoxhu
TheMuMPiTz,Thanks. One time a day?,1696361105,k3bq33i,t3_16ys960,t1_k3boxm2,1,False,t5_4aoxhu
Efik_Pail,"It may depend on your chemistry and the length of your day.

You may try one dose a day first and it may be enough but I tend to take one dose a 6AM with my cofee and a second half dose (1mg/ 0.25ml) at about 2PM of I have a long and intense work day.",1696361469,k3br5bn,t3_16ys960,t1_k3bq33i,2,False,t5_4aoxhu
TheMuMPiTz,I'll try with one dose once it arrives and then see. What does it do for you if I may ask?,1696364891,k3c16pe,t3_16ys960,t1_k3br5bn,1,False,t5_4aoxhu
Efik_Pail,"It helps me focus and seems to help problem solving, especially on complex tasks. It's something you may not even feel at all but that you'll notice after some times while working.",1696367628,k3c9d8f,t3_16ys960,t1_k3c16pe,2,False,t5_4aoxhu
