author,body,created_utc,id,link_id,parent_id,score,stickied,subreddit_id
MerkoniumJones,"Congratulations. Can I ask if you got prescribed Modafinil by a doctor, or if you’re getting these wonders from stuff ordered online?",1650118658,i4yk44l,t3_u4qn31,t3_u4qn31,2,False,t5_4aoxhu
The-Swiss-Chad,"Good to hear. Glad your doing better now. Just DYR in depth before taking things (a mistake I see often). A few nootropics are also not without risk as you may know and are addictive, build tolerance may reduce cognition at higher dosages or cause toxicity etc.",1650217257,i53twls,t3_u4qn31,t3_u4qn31,2,False,t5_4aoxhu
Research_Cookie,"So again, what do you use now? Just Moda or concentra too? Or piracetam?",1650162673,i519ujp,t3_u4qn31,t3_u4qn31,1,False,t5_4aoxhu
HankHill2160,What is avanzaten?,1653499717,i9ykp8d,t3_u4qn31,t3_u4qn31,1,False,t5_4aoxhu
Delicious_Unit9998,Concerta and modafinil for the times when I really need to get shit done,1650213345,i53kdei,t3_u4qn31,t1_i519ujp,1,False,t5_4aoxhu
