author,body,created_utc,id,link_id,parent_id,score,stickied,subreddit_id
SavedByGhosts,"Any thought on ISRIB for this stack? Not sure if I'm adding another synthetic compound, much less an experimental one. But it sounds like it might be good candidate for stress, memory and neuroprotective effects. 

Definitely need to research everything I can about it and gain an understanding of why one might prefer it in a stack like mine before I even begin considering being an early candidate 🤔. But it sounds very good on paper, unless I need to go for the injection route (sublingual or liquid IN only).

I think it's as far as I'll go with nootropics and ISRIB is a little bit outside of my comfort zone, but it's definitely in the realm of what I'm seeking. It's surprisingly common in Europe like other unusual experimental nootropics from our post-soviet neighbors, as well as Russia and China.

Edit: wording",1695313472,k1l0odc,t3_16oh9km,t3_16oh9km,3,False,t5_4aoxhu
harry_lawson,"You left something out, tut tut.",1695307373,k1kj9rd,t3_16oh9km,t3_16oh9km,2,False,t5_4aoxhu
e59e59,What's your source for NALC? (Both research and vendor source I suppose?) Never heard of it. Also thought ALCAR only occurs as (o-)acetyl-carnitine and not n-acetyl?,1695307740,k1kka80,t3_16oh9km,t3_16oh9km,2,False,t5_4aoxhu
btc912,you should notice decreasing benefit from the liftmode thp/sleep stack. it also has a long anti-dopaminergic half life,1695325178,k1ly475,t3_16oh9km,t3_16oh9km,2,False,t5_4aoxhu
thejaywalker70,Seems excessively dopaminergic but otherwise pretty good. Selegeline scares me lol,1695327313,k1m4ck5,t3_16oh9km,t3_16oh9km,2,False,t5_4aoxhu
,Have you tried Breathwork for these issues? there’s a Breathwork modality for each issue your wanting to fix,1695495420,k1w1fpe,t3_16oh9km,t3_16oh9km,2,False,t5_4aoxhu
Sispants,"Have you thought about simplifying things and just talking to a doctor about trying Wellbutrin? 

It is used to treat quite literally everything you listed that you are trying to address, and also used to help people quit smoking if you are interested in moving away from the nicotine habit. It will be cheaper than all of that (if you have health insurance), and if you are having side effects or something doesn’t feel right you know exactly where it stems from bc you’re are taking only one thing.",1695350229,k1nr19a,t3_16oh9km,t3_16oh9km,1,False,t5_4aoxhu
hammerforce9,Way too much melatonin. Not good to use this hormone at all but 2-3mg is 20-30x the amount a typical healthy body produces,1695439797,k1t4jmr,t3_16oh9km,t3_16oh9km,1,False,t5_4aoxhu
SavedByGhosts,"Thanks, definitely nicotine but if there's something important please tell me 🥴",1695308167,k1klgpn,t3_16oh9km,t1_k1kj9rd,1,False,t5_4aoxhu
e59e59,"And regarding your stack:


Cut the melatonin dose by 10. Works better.


Switch ROA of bromantane to IN.


Drop selegiline if you have sleep issues...lol, and maybe don't take ALCAR every day since it has quite the half life and disturbs sleep for a lot of people.


Anticholinergic antihistamines are not great.",1695308062,k1kl69q,t3_16oh9km,t1_k1kka80,2,False,t5_4aoxhu
SavedByGhosts,"Sorry, it was the N-acetyl-cysteine variant (zion pharma/aniracetam.eu) 🙏. I know it's a variant of nac and used it before for phlegm, just my mind being goofy. N-acetyl-l-cysteine-ethyl-ester. 

Supposedly more potent than NAC, and definitely still potent in terms of anti-phlegm and foul egg smell 🤢.

Edit: vendor",1695308262,k1klq85,t3_16oh9km,t1_k1kka80,1,False,t5_4aoxhu
SavedByGhosts,"For sure, at the moment it has net positive benefits because of the lack of insomnia and it hasn't been as as nearly hard as seroquel or mirtazapine have been during the day, I will titrate down once I start using the powders individually instead of the sleep caps 👍. Right now it's just a blessing so it's all good.",1695325356,k1lymp6,t3_16oh9km,t1_k1ly475,1,False,t5_4aoxhu
SavedByGhosts,"I've had a few brushes with more potent stimulants and this isn't it in that regard, I'm on day 2 of selegiline. It's gonna get more potent, so I am definitely lowering the dose if it becomes a proper euphoriant or if I notice disassociation and delusion in any way. This form of stimulation is almost outside of my comfort zone, think I might lower the dose or just wait and see. 

I'm gonna squash that euphoria when I see it and do something about it, I've been spared of stimulant abuse so far and I want to keep it that way. Only tried amphetamines in some rare moments of impulsivity with dissapointing effects, I don't really like that vibe but I can see why people like it. Those are probably powerful for me in therapeutic doses but I'm not taking my chances. 

Selegiline feels cleaner than bupropion and I'm kind of worried about the long-term effects of the metabolites. To be really honest, what I'm doing isn't normal at all in psychiatry in my country but low dose selegiline and weaker stimulants for depression also isn't (except for bupropion and maybe effexor counts).

I'm gonna be really careful because I am incredibly calm and concentrated, zero intrusive thoughts, no zoning out like I often do and no impulsivity towards non-productive activities so it's easier to control my habits, it's definitely working much better than I intended and I don't want to become someone else. 

Might be placebo right now but might not be in a week. I notice how I write these long replies without any thought, usually I tend to overthink and throw a tl:dr at the bottom to feel less insecure about my engagement. 

Not all too concerned though in the end, at this point I think schizophrenia and mania can't be unlocked so easily anymore, not with how I used psychedelics and ketamine in my early twenties, and my chronic cannabis use. But I know how drugs of abuse trigger psychotic symptoms and mania and I'm trying to get my head around how to navigate this, with the knowledge that bupropion and low dose stimulants are the things that have worked at the core of my problems.

Edit: All my cannabis cravings are gone after selegiline on day 2 but I am going to bed so I went for some and I am back to normal again, I think I was somewhat overreacting because I simply wasn't being under much influence from cannabis and it does affect my mental capacity. I feel a little  embarrassed now. 😂",1695331190,k1mfhw8,t3_16oh9km,t1_k1m4ck5,1,False,t5_4aoxhu
SavedByGhosts,"It sometimes works very well, I make an effort to meditate and practice breathwork but it's been hard to make them feel natural and if I have panic attacks it's best to vape or have a downer, thankfully it rarely ever happens so no RC anxiolytics or antipsychotics any longer. 

But I'm trying, mindfulness has been the best for me so far and talk therapy and as I get healthier I have a goal of a meditation routine I can hold, breathwork etc.

Many thanks for the tips because I'm branching out at the moment with incense, adaptogen smoothie, more cycling, getting help on general and improving my habits etc and very responsive to advice.",1695495935,k1w2sna,t3_16oh9km,t1_k1w1fpe,1,False,t5_4aoxhu
Sispants,Disregard. Just saw your comment where you said you that it was your antidepressant of choice but it wasn’t working like it used to.,1695350310,k1nr818,t3_16oh9km,t1_k1nr19a,1,False,t5_4aoxhu
harry_lawson,"It's a big one. You might want to just look into some of the adaptogens, rhodiola rosea has a good track record for reducing stress and fatigue.

Edit: also long term antihistamine use is bad.",1695308452,k1km9px,t3_16oh9km,t1_k1klgpn,3,False,t5_4aoxhu
SavedByGhosts,"Bupropion is my antidepressant of choice and almost fixed my depression for a long time, but it's not working anymore. I also used phenibut for more difficult days and both helped me make a lot of progress with myself, but it wasn't sustainable enough. 

Didn't have any noticeable side effects from them, but the combo hasn't been good for my memory in retrospect, especially with cannabis and antihistamines. 

NDRIs the only class of ADs that have worked for me and it only amounts to bupropion for me, so I am exploring other options by using low dose selegiline and bromantane for this, definitely subtle but so was bupropion and I'm excited to see what it will do for the long term while I'm working on myself and my professional life.",1695310610,k1kscyj,t3_16oh9km,t1_k1kl69q,2,False,t5_4aoxhu
SavedByGhosts,"I was considering making a dropper bottle with noopept for intranasal, maybe I'll make a two-in-one with bromantane. Easy to get antibacterial water, I don't innsuflate the powders anymore but I'm considering this. 

Hmm.. Now it sounds like a good way to kickstart brain when I wake up 😅. Hopefully it won't make it addictive and a decent euphoriant, but probably not?

My CBN oil contains melatonin and so does my liftmode sleep caps so I can't dose my melatonin any lower, but I'll be switching to the individual powders from liftmode after my caps are out to reduce the melatonin. Thanks for the tip.",1695309763,k1kpx8e,t3_16oh9km,t1_k1kl69q,1,False,t5_4aoxhu
SavedByGhosts,"Definitely considering an adeptogen smoothie, I have a recipe I'm working on (primarily rhodiola rosea, Korean ginseng and saffron which are the adaptogens I react best to), including oils and fibers, black pepper, frozen spinage, hemp oil, CBG, CBD, quercetin and more. 

Really wanna fully embrace the adaptogen hype train, so far it hasn't been as impressive as nootropics but I'm going slowly in like with all my supps. 

I know antihistamines are pretty bad, definitely nitoced it when I was on seroquel off-label for sleep and anxiety. Mirtazapine was also too much for me, too tired and fatigued all the time when I was on either one. 

But benzos, gabapentinoids and z-drugs are the only other ones that have worked reliably and long-term, I have an addictive personality and doctors are too afraid to prescribe, so this is the least antihistaminic combo that I have come up so far that is reliable, the combo is not hard on energy and cognitive performance when I need to be fully functional.

Definitely dropping the antihistamines when my overall health improves and I'm more stable and functional.",1695309214,k1kods9,t3_16oh9km,t1_k1km9px,1,False,t5_4aoxhu
e59e59,"While the idea is nice, it won't work sadly. Noopept needs to be dissolved in propylene glycol or DMSO and the best choice for bromantane is caprylic acid. Why not just get the spray and dropper solutions from everychem? 


It shouldn't be addictive, but if that's something you struggle with you could get neboglamine from EC as well.


Agmatine is a cheap and effective option for addiction and depression also (as long as your gut and stomach aren't too sensitive)",1695310311,k1kri8c,t3_16oh9km,t1_k1kpx8e,2,False,t5_4aoxhu
harry_lawson,"I think I read some negatives on Quercetin, might want to just have a read around about that. The adaptogens I think are more to help background stuff, not necessarily all that noticeable but can produce a meaningful difference over time.

Good to hear you're aware of the danger of antihistamines, lots of doctors give them out willy nilly and don't properly inform patients. AFAIK most also affect the cholinergic system. Insomnia is a bitch, I hope you find a better treatment that works for you.",1695310371,k1krof7,t3_16oh9km,t1_k1kods9,2,False,t5_4aoxhu
SavedByGhosts,"I always forget my agmatine, but it works. I'll be adding it. 👍

Thanks for the advice, I'm telling you it's not easy to find info on the best solutions/solvents for dropper bottles and the substances I'm using so I just decided to use sterilized water before your advice.",1695311412,k1kuovt,t3_16oh9km,t1_k1kri8c,1,False,t5_4aoxhu
SavedByGhosts,"Neboglamine sounds great. Although I will be affecting my glutamate receptors with NALC, phenibut, agmatine, selegiline too IIRC. I had pretty strong warnings from a specialist about experimenting with my glutamate system, therefore I'm really careful in that department.

Although all of these have been found to have neuroprotective effects so it sounds pretty amazing on paper. 

I'm gonna read some more about it and gain a broader understanding of the glutamate system. 👍",1695314206,k1l2r6q,t3_16oh9km,t1_k1kri8c,1,False,t5_4aoxhu
SavedByGhosts,"I think I've probably given my cholinergic system a run for its money in terms of memory, never had a seizure though or anything like those horror stories from seroquel treatment, maybe because I pretty much never accept more than one dose increase so I think I've made the right choice. 

I think antihistamines should be considered as last resort meds like benzodiazepines to be honest, scary stuff. It's overused in Norwegian psychiatry and others I've met can attest to this. 

From what I've read, quercetin sounds like one of those ingredients typically used to boost adaptogen mixes or other herbal medicine mixes. I think it's worth getting deeper into, but yeah definitely gonna treat it with respect. 👍",1695311105,k1ktsoz,t3_16oh9km,t1_k1krof7,1,False,t5_4aoxhu
