author,body,created_utc,id,link_id,parent_id,score,stickied,subreddit_id
gintrux,"TBG and SkQ1 are my items stocked there.

I didn’t notice SkQ1 is out of stock. Will send sirs a batch asap. TBG is being produced and in 3 weeks I should receive a new batch. I tried optimising the synthesis cost by hiring a university professor to do it but his method to make one expensive starting material couldn’t yield purity higher than 93%, which isn’t acceptable. The new synthesis batch with a serious lab started a week ago and they would have >= 98%, as per the original approach, which is more expensive…",1691510575,jvbd3m3,t3_15llyna,t3_15llyna,5,False,t5_4aoxhu
expanding_crystal,"Never heard of tabernanthalog before, have you tried it? Really interesting",1691510141,jvbbwz6,t3_15llyna,t3_15llyna,2,False,t5_4aoxhu
Megatron_McLargeHuge,Can SkQ1 be taken orally?,1691511190,jvberiy,t3_15llyna,t1_jvbd3m3,2,False,t5_4aoxhu
Pure_Nourishment,TBG is super interesting. Would love to try that. Thanks for the update!,1691522511,jvc9t6r,t3_15llyna,t1_jvbd3m3,1,False,t5_4aoxhu
gintrux,"It did have studies using oral route of administration in animal models, if I remember well",1691512738,jvbiya2,t3_15llyna,t1_jvberiy,1,False,t5_4aoxhu
