author,body,created_utc,id,link_id,parent_id,score,stickied,subreddit_id
,"Great, mood and cognition improvement unlike any other but only after 2 weeks of 3-5g of ethanol extract. Active doses are way larger than people usually use which is why it doesn't work for most people. It made me itch that was the only side effect I noticed.  
[https://pubmed.ncbi.nlm.nih.gov/18758067/](https://pubmed.ncbi.nlm.nih.gov/18758067/)

Strongest NGF inducing substance yet discovered. Up to 6x more NGF compared to control!",1650740497,i5wrhep,t3_u9pclr,t3_u9pclr,2,False,t5_4aoxhu
Discipline_General,"Still on the fence on this one, think I felt a little depressed after my last attempt and didn't feel any benefits",1651144740,i6iqa8t,t3_u9pclr,t3_u9pclr,1,False,t5_4aoxhu
Rascalthewolf,"Perhaps I experienced improvements in mood and cognition, but nothing too remarkable. Maybe a big part of them caused by the placebo effect.

Also experienced a decline in libido, possibly caused by the nocebo effect.",1651944159,i7p5xol,t3_u9pclr,t3_u9pclr,1,False,t5_4aoxhu
