author,body,created_utc,id,link_id,parent_id,score,stickied,subreddit_id
Psilanaut,"I've used Agmatine to help a close family member stop klonopin. Even after taking a short break from Agmatine (2 weeks after the last klonopin dose), there was no rebound.

I've used it for years myself and stopped it with no rebound.",1706966045,koqdksc,t3_1ahuegb,t3_1ahuegb,6,False,t5_4aoxhu
bruhman123534t6,Used to dose like 5 grams of agmatine a day for a while. Stopped because i ran out and noticed no difference,1706966978,koqfdqa,t3_1ahuegb,t3_1ahuegb,4,False,t5_4aoxhu
FrogFister,"tapper it, take less and less each week until microdose amounts to the point you don't need to take anymore. but u can stop if u want.",1706972258,koqqv4v,t3_1ahuegb,t3_1ahuegb,3,False,t5_4aoxhu
Mrjonnyiswierd,Memantine is agmatines bigger much more powerful brother and I heard it can have bad withdrawl. I abuse phenibut and I'm gonna try Memantine and fasoracetam to get back to homeostasis wish me luck 🤞,1706991151,kos506q,t3_1ahuegb,t3_1ahuegb,3,False,t5_4aoxhu
Reasonable_Dot_1831,I took it 2 years daily and I had no rebound or any other side effects after stopping,1706963339,koq8u7x,t3_1ahuegb,t3_1ahuegb,3,False,t5_4aoxhu
Original_Rule_4669,Ordered from UK site to assist with my taper too. Will update with results. Thanks for recommendation,1707388552,kpgtgxi,t3_1ahuegb,t3_1ahuegb,3,False,t5_4aoxhu
TrenAppreciator420,Never noticed it no,1706961823,koq6guk,t3_1ahuegb,t3_1ahuegb,2,False,t5_4aoxhu
CaveLegion,"I've heard some anecdotes which included symptoms of overactive NMDA receptors when stopping agmatine, but it seems for the vast majority of people it does not produce tolerance or withdrawal",1707011062,kotiye4,t3_1ahuegb,t3_1ahuegb,1,False,t5_4aoxhu
tapestry0fm0lecules,I used 1 gram three times a day for years with no rebound :),1706967869,koqh6c1,t3_1ahuegb,t3_1ahuegb,1,False,t5_4aoxhu
MezDez,"Guys,

You do know you can come off cold turkey, being on benzos like Xanax for over 10 years, or even heroin, using topiramate?

Look it up,

Many case studies. It works so profoundly that they were able to kick the benzo habit within a week that's been there for a decade.",1707007626,kotatjl,t3_1ahuegb,t3_1ahuegb,0,False,t5_4aoxhu
1Reaper2,"Should be okay, but regardless you should taper off. I can’t think of any time that cold quitting is advisable. Not unless your licking mercury in your spare time.",1706990484,kos38vc,t3_1ahuegb,t3_1ahuegb,1,False,t5_4aoxhu
MezDez,What dosing protocol,1707007542,kotamb8,t3_1ahuegb,t3_1ahuegb,1,False,t5_4aoxhu
Original_Rule_4669,Where can I source agmatine? Currently fast tapering diazepam and struggling real bad.,1707346359,kpehr0c,t3_1ahuegb,t3_1ahuegb,1,False,t5_4aoxhu
paulm19855,"This is very reassuring 
Think it need to stay away from benzo wd boards as they are putting the fear of death into me thinking of repucusions of using Agmatine and acamprosate",1706966618,koqeoar,t3_1ahuegb,t1_koqdksc,3,False,t5_4aoxhu
cyclist5000,Withdrawal from Memantine? This seems unlikely from its long half life? What withdrawals?,1707050354,kovd5eg,t3_1ahuegb,t1_kos506q,1,False,t5_4aoxhu
paulm19855,"That’s reassuring 
Overthinking everything atm as in the thick of benzo acute so was worrying when I stop this I’ll be in hell again .",1706963563,koq979t,t3_1ahuegb,t1_koq8u7x,5,False,t5_4aoxhu
paulm19855,"Did you use it coming off benzo ? 

Btw great username lol",1706962750,koq7w7i,t3_1ahuegb,t1_koq6guk,2,False,t5_4aoxhu
paulm19855,I use nootropics depot,1707354676,kpf3wbp,t3_1ahuegb,t1_kpehr0c,1,False,t5_4aoxhu
Psilanaut,"I hear you! When I began tapering off of it myself (from 4mg down to 0.25mg now), I made the mistake of reading benzo wd sites and boards. It wasn't just the fear of death it caused but the feeling of sheer hopelessness.",1706966960,koqfci3,t3_1ahuegb,t1_koqeoar,4,False,t5_4aoxhu
TrenAppreciator420,I didn't no. Also thanks 😘,1706989328,kos06q4,t3_1ahuegb,t1_koq7w7i,2,False,t5_4aoxhu
Original_Rule_4669,What specifically does it help with?,1707375892,kpgcl4c,t3_1ahuegb,t1_kpf3wbp,1,False,t5_4aoxhu
paulm19855,"Yes man , like you see the terrible stories and people suffering for years. .
Doesn’t make good reading",1706967257,koqfxtj,t3_1ahuegb,t1_koqfci3,3,False,t5_4aoxhu
paulm19855,And congrats on coming down such a significant amount .,1706967276,koqfz86,t3_1ahuegb,t1_koqfci3,3,False,t5_4aoxhu
Psilanaut,"Ugh, I know. Not just stories but I remember some people sharing YouTube vids of acute withdrawal.  


I remember it completely psyching me out and leaving me hopeless and fearful.",1707032929,kouorxp,t3_1ahuegb,t1_koqfxtj,2,False,t5_4aoxhu
Psilanaut,"Thank you :)

I managed to drop from 4mg to 0.875mg in around 6 weeks using psychedelics (4-aco-dmt). Sounds unbelievable but it's the honest to Mushroom truth!

The rest of the taper involved multiple attempts with Ketamine and Agmatine, both of which were extremely helpful for me. I chose to stick with Agmatine since I value my bladder and would rather not mess about with Ket anymore.",1707033707,koupvs6,t3_1ahuegb,t1_koqfz86,3,False,t5_4aoxhu
paulm19855,"Yeah Agmatine is amazing for wd .
As I said used it to get off lyrica , zopiclone and now benzo .
This past year I’ve managed to come off many pharma , Effexor , vyvanse , lyrica , zopiclone and now clonazepam .
I’m looking at implementing mushrooms very soon , micro then macro",1707052352,kovgkmc,t3_1ahuegb,t1_koupvs6,2,False,t5_4aoxhu
Original_Rule_4669,Hey would you be able to message me with more info on this? Tapering diazepam and really struggling 😔,1707346441,kpehz57,t3_1ahuegb,t1_koupvs6,2,False,t5_4aoxhu
Psilanaut,"Congrats on getting off of Lyrica (I remember that nightmare but thankfully it resolved quickly since I didn't use it for that long). Zopiclone has withdrawal symptoms that are almost the same as benzos. Effexor.......nasty shite! Kudos to you for getting over all that stuff man!  


Feel free to drop me a DM if you ever want to discuss micro/macro-dosing. I'm terribly partial towards 4-aco-dmt but mushrooms would work just as well.",1707115878,kozt1js,t3_1ahuegb,t1_kovgkmc,3,False,t5_4aoxhu
