author,body,created_utc,id,link_id,parent_id,score,stickied,subreddit_id
ReflexionesExplicita,"Someone had recommended [the Braverman Test](https://www.bravermantest.com/) as a good resource to roughly assess which neurotransmitters a person may be dominant & deficient in - which also comes with suggestions for supplements & dosages for one’s corresponding results;

Basic theory would often state depression corresponding to serotonin issues - though might be worthwhile taking a few minutes to do that test and look through your results, as there might be some additional insight there along with custom-tailored suggestions.

(Also, this is by no means “advice” or a recommendation, though there’s been alot of promising research on ketamine as being a HIGHLY effectively treatment for depression - not something to do on your own, but may be worth looking into what’s unfolding in that world in professional settings with trained therapists.)",1700771337,kahdlma,t3_17ze0cw,t3_17ze0cw,1,False,t5_4aoxhu
mag_man,"The real cause of your symptoms are:

\- heavy metal toxocity

\- weak adrenals (adrenal fatigue)

There might be other reasons but those two above are the most important. You can get out of this after addressing the real cause.",1700776648,kahprae,t3_17ze0cw,t3_17ze0cw,1,False,t5_4aoxhu
,For me I’m taking 18gram of Inositol powder from pure encapsulations. It’s been an amazing to feel like me again.,1700784247,kai5tyl,t3_17ze0cw,t3_17ze0cw,1,False,t5_4aoxhu
UDF2005,Ketamine therapy,1700789566,kaighpe,t3_17ze0cw,t3_17ze0cw,1,False,t5_4aoxhu
Plane-Payment2720,"Do you think you got permanently worse after taking SSRIs? Just to warn you, there is a condition called PSSD, where you can develop persistent sexual dysfunction and other effects like anhedonia, emotional blunting, fatigue and brain fog. No idea if it's your case, just to tell you this exists. For more information check r/pssd and https://www.pssdnetwork.org/",1700791902,kail5q6,t3_17ze0cw,t3_17ze0cw,1,False,t5_4aoxhu
BugSafe7102,Try Microdosing magic musbrooms (100-200 mg) with lions mane (200-300 mg) and 50 mg of flushing niacin.,1700847679,kal7p52,t3_17ze0cw,t3_17ze0cw,1,False,t5_4aoxhu
Born-Situation-9793,Nac,1700852077,kalikd4,t3_17ze0cw,t3_17ze0cw,1,False,t5_4aoxhu
V20agent,"This!
Get the following checked:
A1C
Testosterone free and total with shbg
E2
prolactin (Incase of prolactinoma)
CRP
CBC
CMP
Igf1
Ferratin
B12
Vitamin D
Lipids panel



Order yourself from ultalabs if you don't have insurance.


Then find a good PCP.",1700564574,ka56yxk,t3_17ze0cw,t1_k9z0s76,3,False,t5_4aoxhu
muhnbuht,"Just figured out that some hormone levels were checked at my last blood test:  
\- Prolaktin: 8,8 ng/ml (OK)  
\- Testosterone: 6,37 ng/ml (OK  
\- TSH 1,46 mU/L (OK)  
Still made up an appointent with a hormone specialist.",1700744113,kaflsfs,t3_17ze0cw,t1_k9z0s76,2,False,t5_4aoxhu
muhnbuht,"Only my thyroid hormones, since I have a thyroid condition. These are very well within the healthy range.",1700476889,ka03esd,t3_17ze0cw,t1_k9z0s76,1,False,t5_4aoxhu
muhnbuht,"Thanks for the recommendations.

I put emoxypine on my bucket list.

Agmatin sulfate and St John wort maybe... But I have already tried so much of the less potent stuff, that I want to focus on the more potent stuff now.

&#x200B;

I've been taking SAMe for some months but stopped it, since it is rather expensive and didn't do a thing. I also did running - 4 months in a row every day, it gave me a short high afterwards but the rest of the day I would still feel down. Sports is on my bucket list, but this time I will rather focus on weight training. At the moment I am just so overworked and down, that I can't find the time and motivation to get up and so it.

Ketamine is also on my radar, but since I am in Europe where it is not as widespread as in the US, I don't have many options. There is one clinic that offers it, but only for severe cases and only together with a 4 week inpatient stay. At the moment I can't afford to stay from work away for so long",1700478091,ka04u5f,t3_17ze0cw,t1_k9zp1ez,3,False,t5_4aoxhu
fruiop,They don’t allow posts of people asking for nootropic suggestions. Part of the rules. They don’t ban; just remove post and refer you to StackAdvice sub,1700451585,k9z4w6x,t3_17ze0cw,t1_k9yzts8,11,False,t5_4aoxhu
Aggravating-One-2413,"Interesting,  thanks for sharing that. I had been looking into 9-me-bc for the same prescription stim/dopamine issue.",1700493353,ka0vy99,t3_17ze0cw,t1_ka0r8u0,2,False,t5_4aoxhu
couchpotatoguy,"After reading the effects of this, they sound VERY similar to bromantane, which is helping me with the same problems. Any experience with that?",1700593599,ka72rfb,t3_17ze0cw,t1_ka0r8u0,2,False,t5_4aoxhu
muhnbuht,"Funny that Iyou mention 9-me-bc. I found this whole subreddit only after stumbling over 9-me-bc and reading about it's potential effects on anhedonia. I've only read very positive user reviews so far but at the same time lots of warnings about potential cancerogenity and neurotoxicity... Still interesting to me, since my life quality is low enough to put up some risks to improve it....",1700496359,ka137v2,t3_17ze0cw,t1_ka0r8u0,1,False,t5_4aoxhu
kittensbabette,Interesting...how much Kratom had you been taking and how much are you now? Do you just dump a capsule under your tongue? Notice any negative effects?,1700618756,ka8uwr3,t3_17ze0cw,t1_ka0r8u0,1,False,t5_4aoxhu
muhnbuht,"I've been testing my thyroid hormones 4 times in the last 2 years. the last tme was just 2 weeks ago. The doctors always tell me that my antibodies are elevated but my hormone levels are fine. I still would like to try how my body reacts to a hormone treatment, but couldn't find a doctor so far, that would prescribe one to me.",1700511084,ka26n7v,t3_17ze0cw,t1_ka1o72z,1,False,t5_4aoxhu
muhnbuht,Interesting!,1700616546,ka8pt36,t3_17ze0cw,t1_ka8n81m,1,False,t5_4aoxhu
muhnbuht,"Thanks, I will look into these....",1700478614,ka05hlf,t3_17ze0cw,t1_ka011gu,1,False,t5_4aoxhu
muhnbuht,Would you actually advise to stack all these substances or rather try them after one another?,1700516041,ka2k1g3,t3_17ze0cw,t1_ka011gu,1,False,t5_4aoxhu
muhnbuht,"Thanks for extending the range of possible causes . I have excluded mold as a primary cause since I was living at my parents house when the whole shit started, which was a massive house in a very good condition, and moved 3 times in between with no change in symptoms. 

I use Lion's mane and Ashwagande since a few months with no apparent positive or negative effect, but thanks for the warnings, might just remove them from my stack since I am overstacked anyways...

I still refrained from seeing doctors that go beyond standard procedures, since these are not covered by health insurance and things get very expensive very quickly. That's how the system here works. The doctor either has a contract with a health insurance, then he only does standards examinations that are covered by insurance or he has a private practice, then he can do pretty much everything but you will have to pay for everything in full. Don't have much money to put into that game, but hey, since cryptos go up again - maybe in the near future? ;-D",1700512745,ka2b3vx,t3_17ze0cw,t1_ka21b3f,1,False,t5_4aoxhu
muhnbuht,Doing it already.,1700609356,ka892t7,t3_17ze0cw,t1_ka6vyq7,2,False,t5_4aoxhu
muhnbuht,"I'm going with the lower hanging fruits first, but ketamine is definitely in my radar!",1700616107,ka8osfq,t3_17ze0cw,t1_ka8mi4w,2,False,t5_4aoxhu
muhnbuht,"Thanks for the hint with the hormone levels. Funny that no doctor EVER looks at hormones...  


Cerebrolysin seems unreachable for me since it must be subscribed and administered by a doctor in Europe. Don't think that I will find a doctor who wil give it to me, since it would be an ""off label"" use....",1700478904,ka05uom,t3_17ze0cw,t1_k9zm3u7,1,False,t5_4aoxhu
muhnbuht,"Thanks for all the recommendations. is there a specific reason why you would suggest to first take an NRI and then take an MAOI?

Also, would you suggest to stack 4’-dma-7,8-dhf with Semax and Selank or would you rather not? And how about the supplements you mentioned? Can they be stacked with the proposed drug-like substances?",1700609178,ka88nn4,t3_17ze0cw,t1_ka3it82,1,False,t5_4aoxhu
muhnbuht,No official test. I have a sleep tracker from sleepon that measures blood oxygen levels and those appear to be normal. I don't know how trustworthy the results are though .. I do have a deviated septum and trouble breathing through my nose ..,1700584332,ka6d2yf,t3_17ze0cw,t1_ka4rfk6,1,False,t5_4aoxhu
muhnbuht,Too many side effects. The SNRIs  seemed to work fine at the beginning but slowly turned me into a person I didn't like. Made me emotionally cold and indifferent.,1700658740,kaanjp1,t3_17ze0cw,t1_kaalsg7,1,False,t5_4aoxhu
muhnbuht,How long did you take that stack until you felt improvements? And do you still take it or could you keep your improvements after tapering off?,1701699332,kbye3ij,t3_17ze0cw,t1_kby730b,1,False,t5_4aoxhu
muhnbuht,"So Cerebrolysin or Cortexin help with the cognition part? For me the cognition part is the most important one, since I am very well used to a low mood, but my bad concentration and bad memory give me a hard time to make a living...",1700513446,ka2czok,t3_17ze0cw,t1_ka1pft5,1,False,t5_4aoxhu
Upset_Scientist3994,"I heard that St. Johns Wort maybe dangerous for liver in interaction with other medicines. From some professional doctor. 

And because it affects some enzymatic things it may destroy effects of other good things in your stack, or enhance them too much. And this liver damage potential is connected with that. 

But if it is just only substance you are taking, then it will be much better than SSRI medicines without their or its own ill-effects. Also one issue is that it can turn your skin as very foto-sensitive. 

Since it grows commonly as wild here, I picked it up a lot but then after some time never used when learning about some potential problems of it as I also use other nootropics along. Lot of that stored in my closet if somebody wants order it from me...",1700829410,kak4hh6,t3_17ze0cw,t1_ka1pft5,1,False,t5_4aoxhu
muhnbuht,"Thanks, I'm going to look into this!",1700478680,ka05kkq,t3_17ze0cw,t1_k9zr3ya,2,False,t5_4aoxhu
zasura,bad idea. You don't want hormone imbalances and opioid addiction,1700566644,ka59wye,t3_17ze0cw,t1_ka34fkd,2,False,t5_4aoxhu
Upset_Scientist3994,Only for very very contemporary usage if you have to get out of like alcohol or worse opioids. Then good. Otherwise long term bad. I dont want to tell what happened for me.... Someone in here told that only just one tablespoon per day ended him up into hospital - may happen of you already have bad depression and then comes even mild withdrawal from such substances combined then with that.,1700828653,kak3cf6,t3_17ze0cw,t1_ka34fkd,1,False,t5_4aoxhu
muhnbuht,This is scheduled for the new year. I will be going tot the netherlands annd take part in a ceremony.,1700476964,ka03hw8,t3_17ze0cw,t1_k9z8wft,3,False,t5_4aoxhu
muhnbuht,No just the normal over the counter supplements.,1700478925,ka05vnz,t3_17ze0cw,t1_ka052q9,1,False,t5_4aoxhu
Delicious_Finding739,"I just posted about kratom too lol. In truth any mu-opioid agonist would work, and there are quite a few.",1700524031,ka34my5,t3_17ze0cw,t1_ka31rbj,1,False,t5_4aoxhu
420yoloswagxx,">The vendor I get from has $55 kilos (1000 grams)

where",1700590447,ka6tz11,t3_17ze0cw,t1_ka31rbj,1,False,t5_4aoxhu
Sispants,"Jesus, 3.5g would be an insane leap unsupervised. OP probably isn’t trying to see God lol. Better to start at like 1g so OP can see how he handles it.",1700615397,ka8n5ti,t3_17ze0cw,t1_ka64hki,1,False,t5_4aoxhu
muhnbuht,I wouldn't want to try it because of the addiction potential...,1700513246,ka2cg0i,t3_17ze0cw,t1_ka1lxfk,5,False,t5_4aoxhu
muhnbuht,"I use methylated B-Vitamins, so actually they should be working...",1700478652,ka05jcg,t3_17ze0cw,t1_k9zsgks,1,False,t5_4aoxhu
muhnbuht,"Checking my sinuses is another thing that it is on my bucket list... I have chronic sinusitis as far as I can remember, probably all my life. No doctor ever found a reason for that and they just prescribed nose sprays against smptoms... Since this is a chronic thing with no apparent reason behind it I do believe that it is either psychosomatic or allergic....

You are probably right with OCD. I am very perfectionistic, get lost in details easily and I need to do everything very thoroughly...",1700511466,ka27nv4,t3_17ze0cw,t1_ka1suij,2,False,t5_4aoxhu
OrneryLandscape5402,"my opinions (dont ask me for sources im making everything up)

\* kratom is shit, yes

\* ketamine is pointless

\* psilocybin is neat, but SRIs will probably make it not work (just a note)

\* 9 me bc is stupid

\* those things are mostly not dopamine agonists (cba to check which ones are)

\* st johns wort is stupid

\* MAOIs can be helpful but they have their issues. still better than SSRIs/SNRIs i think

\* memantine is stupid

\* bromantane is good

\* modafinil is meh

Huperzine can probably go too unless it actually helped you. The three things you were going to add probably wont do anything.",1701825709,kc63hmw,t3_17ze0cw,t1_ka8hjsx,1,False,t5_4aoxhu
muhnbuht,It's on the bucket list. Strangely no doctor ever looks at hormones...,1700641514,ka9z4jh,t3_17ze0cw,t1_ka98i2g,1,False,t5_4aoxhu
muhnbuht,"Luckily I am still functioning enough to go to work, I guess one could classify it as dysthymia. And the OCD helps with being overly detailed! ;-D",1700682183,kacbh2n,t3_17ze0cw,t1_kaaxw1u,1,False,t5_4aoxhu
itsiviej,"Yup, I feel a lot better after taking algal omega 3 for about 4 months now - my brain seems to be working better (or so my boss says haha) and I also feel much more relaxed and just happier in general although I'm usually experiencing SAD during the winter months :)",1700670506,kabfme2,t3_17ze0cw,t1_kaaz2ov,1,False,t5_4aoxhu
muhnbuht,I take Möllers cod liver oil. I keep it in the fridge and take one or two table spoons every day...,1700683294,kaceg6x,t3_17ze0cw,t1_kaaz2ov,1,False,t5_4aoxhu
muhnbuht,I've planned a trip to Amsterdam for the new year ;-) What can I expect from a landmark Forum Weekend?,1700744724,kafmugr,t3_17ze0cw,t1_kae9jew,1,False,t5_4aoxhu
muhnbuht,"Just tried the braverman test. It gives me the following results:

Total Results Summary  
1A Total Number of True Responses - DOPAMINE Nature: 15   
2A Total Number of True Responses - ACETYLCHOLINE Nature: 11   
3A Total Number of True Responses - GABA Nature: 29   
4A Total Number of True Responses - SEROTONIN Nature: 14   
You are GABA Dominant. 

&#x200B;

Deficiency Results Summary  
1B Total Number of True Responses - DOPAMINE Deficiency: 16   
2B Total Number of True Responses - ACETYLCHOLINE Deficiency: 14   
3B Total Number of True Responses - GABA Deficiency: 9   
4B Total Number of True Responses - SEROTONIN Deficiency: 14 

&#x200B;

Accoring to the results i have a deficiency in all of these hormones. Can't imagine that this is really the case...",1700846422,kal4kkk,t3_17ze0cw,t1_kahdlma,1,False,t5_4aoxhu
muhnbuht,"I do have one amalgam seal, which I am planning to remove. Other than this I couldn't think of any other heavy metal exposure. So maybe, but rather not... I've also thought about adrenal fatigue, but I couldn't find a doctor yet who would even agree that such a condition even exists. Going to a new doctor next week who claims to be a hormone specialist. Let's see what she thinks about it!",1700846787,kal5h1n,t3_17ze0cw,t1_kahprae,1,False,t5_4aoxhu
muhnbuht,"Thanks for highlighting this. My cognition and memory are worse after treatment with SSRIs than they were before, sexual drive stayed low to normal, just as it was under SSRIs. Hard to say whether the bad cognition is related to the SSRIs or not...",1700839332,kaknm3h,t3_17ze0cw,t1_kail5q6,1,False,t5_4aoxhu
muhnbuht,Tried already the Stamets Stack. Didn't do much!,1700849239,kalbl6o,t3_17ze0cw,t1_kal7p52,1,False,t5_4aoxhu
muhnbuht,"Some of these levels were checked at my last blood test and seem mostly OK:

* Prolaktin: 8,8 ng/ml (OK)
* Testosterone: 6,37 ng/ml (OK)
* CRP: 0,8 mg/l (OK)
* Ferritin: 1118 mcg/l (OK)
* B12 870 pg/ml (OK)
* Vit D3: 28 ng/ml (LOW)  
Still made up an appointent with a hormone specialist to get more thorough testing.",1700744401,kafma5y,t3_17ze0cw,t1_ka56yxk,1,False,t5_4aoxhu
Reasonable_Dot_1831,"In Europe you can easily buy 2-FDCK it's a legal Ketamin analoge. The effects are the same and you can build a DIY version of the spravato nasal spray.

I already tried it, ketamine is the strongest antidepressant that I ever tried. The day after my brain felt like new born. But the effects lasts only short.",1700480493,ka07xbf,t3_17ze0cw,t1_ka04u5f,6,False,t5_4aoxhu
ilovedoxo,Agmatine and Emoxypine have been live changing supplements for me. For cognition anxiety and general health,1700544625,ka4fvhr,t3_17ze0cw,t1_ka04u5f,2,False,t5_4aoxhu
hypolaristic,Memantine off label helped me tremendously for 6 months. I will try to cycle back to ketamine and then back to memantine.,1700511532,ka27u8d,t3_17ze0cw,t1_ka04u5f,1,False,t5_4aoxhu
muhnbuht,"Can't find it in their rules, and I am banned.",1700476643,ka034dt,t3_17ze0cw,t1_k9z4w6x,6,False,t5_4aoxhu
BorgoDorgo3950,"Oh no, they ban alright... I have been banned without warning and publically belittled by the moderators at r/Nootropics just for mentioning Sirsadalot and Bromantane. All that, then for me to ask in the private mod chat why they banned me for mentioning Sirsadalot, JUST for them to continue belittling me there as well and then muting me says A LOT, lol.

You'll see there are a good few people from this subreddit that were banned from r/Nootropics for similar nonsense reasons without warning, including the creator of this subreddit himself.",1700490780,ka0q5xq,t3_17ze0cw,t1_k9z4w6x,7,False,t5_4aoxhu
CryptoEscape,"For dopamine depletion/ downregulation due to prescription stimulants (or even stimulant abuse) is where this molecule really seems to shine.  

I’m Trying to take a break from the meds to really let things repair…. heard when you do take stimulants again they’ll hit you pretty hard.  (Unfortunately my ADHD is too severe, so I’ll probably be back on them soon )

I’ve read some people take their prescribed doses while on 9-me-bc and still get results though…just be careful with the MAOI + stimulant combo",1700496053,ka12gkt,t3_17ze0cw,t1_ka0vy99,3,False,t5_4aoxhu
CryptoEscape,"Yeah I’ve used Bromantane too…it was much milder than 9-me-bc IME, but it did have some benefits…Bromantane looks safer and more studied as well.

Tbf I never completed a full 30 day cycle of Bromantane…I used to get this odd side effect which is probably TMI. (If you really want to know you can ask though)

Will try Bromantane again in the future though.

9-me bc *seems* more effective for *repairing* and restoring deeper dopamine damage ( e.g. Heavy stimulant use). 

They both up regulate Tyrosine Hydroxylase….hard to say which does it more, although from my research it *seems* Bromantane does a better job of this.

Hard to say if Bromantane actually repairs significant damage (e.g. prolonged stimulant use/abuse) to the same level as 9-me-bc, but bromantane does restore some dopamine function.

I wish there were more side to side comparisons….seems like Bromantane may be better for just regular cognitive / dopamine enhancement, while 9-me-bc is for deeper damage / anhedonia….Im just speculating here though, feel free to correct me if I’m wrong or share your opinion",1700603584,ka7uccd,t3_17ze0cw,t1_ka72rfb,2,False,t5_4aoxhu
CryptoEscape,">Still interesting to me, since my life quality is low enough to put up some risks to improve it....

This was my thinking too.  

Desperate to feel better….simple tasks shouldn’t be so exhausting….life should be interesting.

Very glad I took the risk.",1700509599,ka22m4r,t3_17ze0cw,t1_ka137v2,1,False,t5_4aoxhu
CryptoEscape,"I was taking 60-70 grams per day of Kratom, which is incredibly high.

On day 8 of the 9-me-bc cycle I noticed I got out of bed easy and without Kratom….my craving for it was significantly reduced.  I cut my morning dose in half and felt fine.  Normally I feel awful and anxious when cutting my dose that much.

Currently down to about 30 grams per day….still a bad habit, but a huge improvement….kinda like cutting down from two packs of cigarettes a day to one…still bad, but much better.

What’s interesting is I’m doing fine on just 30 GPD….last time I tried such a big cut it was unbearable and I couldn’t function, could barely move.

I buy the powder 9-me-bc (not the capsule.). I weigh out 30 mg on a powder plate, then pull my tongue back, and dump the powder into the crevice.  It’s a bit tricky because the powder can stick to the plate.  You gotta really tap it good, and make sure it goes under your tongue (it’s difficult to move it back under your tongue if you miss it.) 

Also try to swallow any saliva before dumping the powder….the longer you hold it the more saliva accumulates.  Eventually it’s like a pool, and it gets harder and harder to hold it the more saliva accumulates.  So clear out any Saliva first.

The first batch burned pretty bad, and was mildly numbing.  The second batch burns mildly, no numbing.  I’m not sure if that’s a sign the second batch is weaker, or if it’s just more pure….or maybe I’m getting used to it.

Vivid dreams too.  Photosensitivity even though it’s late November….lips are burnt from being outside the other day (even with SPF chapstick.). Some people report loss of taste.  Otherwise no side effects I’m aware of…potential toxicity if you get a bad batch or take too much.",1700672878,kabm3jh,t3_17ze0cw,t1_ka8uwr3,1,False,t5_4aoxhu
SunDevil329,"Np! Meant to say, you're most likely correct that Rhodiola rosea and Apha-GPC wouldn't really be helpful.

However, Rhodiola isn't bad; it might even work really well, but it has to be cycled or it'll lose its effects. Ofc, it could just as well have little to no effect. Granted, it's not going to solve the problem, but it may be helpful for occasional use.",1700479448,ka06jqg,t3_17ze0cw,t1_ka05hlf,1,False,t5_4aoxhu
SunDevil329,"The polygala and 4'-DMA should ideally be taken together. Polygala is a decent herbal mood booster on its own, but there's also evidence it prevents potential TrkB downregulation from 4'-DMA.

I'd start with bromantane on its own probably, but Semax and/or Selank are commonly stacked. The 4'-DMA combo is a little less common, but it helps me. Unfortunately it's also fairly pricey from ND.

Of these, bromantane and Semax seem to have the best anecdotal evidence. Possibly a good starting point.

Also, I didn't mention it originally, but many swear by Cerebrolysin. Haven't tried it myself.",1700540568,ka488qk,t3_17ze0cw,t1_ka2k1g3,1,False,t5_4aoxhu
ChidiOk,"I second mold. The thing with mold though is that it colonizes the sinuses so even if you move it doesn’t fix the symptoms until the colony in the sinuses is resolved. If you have some sinus issues and pressure on your forehead then it’s very very likely mold. I have a protocol on how to treat all this. I can share it with you if you want. 

Your symptoms align with mold toxicity",1700537065,ka408ag,t3_17ze0cw,t1_ka2b3vx,3,False,t5_4aoxhu
acgoblue,"Gotcha, likely not the cause then. It's so unfortunate that many tests that can get to the root cause are not covered by insurance, and that functional medicine practitioners have to operate outside of the insurance model because of that. 
Sorry that you're stuck in that system. At least see if they will test your hormones then. Here's to hoping crypto goes back up!",1700522359,ka30kj5,t3_17ze0cw,t1_ka2b3vx,1,False,t5_4aoxhu
Wellyeahso,"Cerebrolysin is easy to buy of the internet from trusted vendors, most if which I found located in the former USSR.

There is also P21, which is supposedly the next level of Cerebrolysin which is available from some trusted peptide vendors.",1700486967,ka0igyj,t3_17ze0cw,t1_ka05uom,1,False,t5_4aoxhu
killword-noot,"MAOIs require special consideration which is why they’re generally not prescribed as first line options. Drug interactions can be deadly but more commonly they just cause unwanted side effects. They also primarily address mood and anxiety (which they’re great for if you have atypical depression) but don’t do much for cognition… NRIs can be great for cognition (almost but not quite as good as traditional stimulants) and have a unique calming effect from adrenergic downregulation. They also have side effects but more manageable than MAOIs. Also you seem to do well with SNRIs like duloxetine—the indifference and low emotions are likely from the SRI part of that.

I think everything would be fine stacked (minus the MAOIs) but I personally would be cautious stacking 4’-dma and Semax or lions mane… 4’-dma is the most stimulating of those three (more like caffeine than amphetamine) and can keep you up if you don’t take it close to when you wake up. It would probably be fine but might cause anxiety stacked with Semax especially. I think anything that increases attention and motivation will lead to overstimulation if you take too much or combine it with others like it.",1700692779,kad3afe,t3_17ze0cw,t1_ka88nn4,2,False,t5_4aoxhu
FearlessEggplant5702,"You can have normal oxygen levels and have completely jacked up sleep, this is typical with UARS.   


Have you been to an ENT about your nose? I knew for years I had a deviated septum but it wasn't until my sleep became disabling I went and got an examination. Turns out it was far worse than I thought. Oops.",1700609639,ka89qtl,t3_17ze0cw,t1_ka6d2yf,2,False,t5_4aoxhu
