author,body,created_utc,id,link_id,parent_id,score,stickied,subreddit_id
SlipSubstantial1163,"It probably worked off the mark but I was so busy with life that I didn't notice until after 2 months. These things don't work in the typical drug fashion where you feel the high straight away. They build up in your system gradually until you look back and realise they've had an actual effect. To answer the second part of your question, I'm not as consistent with it these days. There are times when I don't take them for weeks and the effects are still there. I may come off just to see if the depression comes back.",1701768814,kc2r257,t3_17ze0cw,t1_kbye3ij,2,False,t5_4aoxhu
Friedrich_Ux,Yes,1700537452,ka414gh,t3_17ze0cw,t1_ka2czok,1,False,t5_4aoxhu
Friedrich_Ux,"Yes, it inhibits enzymes that metabolize certain drugs.",1700927719,kapiz9t,t3_17ze0cw,t1_kak4hh6,1,False,t5_4aoxhu
Delicious_Finding739,"I'm not addicted to opioids, just freed from depression. I'm speaking about low doses and BTW kratom has had an aphrodisiac effect on me lol and this is one of its traditional uses in Indonesia.

You are much more likely to get sexual problems from SSRIs.",1700567986,ka5c09d,t3_17ze0cw,t1_ka59wye,1,False,t5_4aoxhu
infrareddit-1,Good luck. Many have found profound changes.,1700568971,ka5dmmb,t3_17ze0cw,t1_ka03hw8,1,False,t5_4aoxhu
OfficialMilk80,"Yeah but kratom is natural and unadulterated. I used to take traditional opiates but kratom is so much better for me in terms of antidepressant effects. And the WD’s aren’t as bad unless you’re taking 40-50 grams daily which is a crap ton. Low doses are the best, like 2-4 grams. Idk I’m just throwing that out there, and it’s $55 for a whole Kilo and is cheap. I prefer kratom over regular mu-opioid agonists any day, eapecially for anti depressant effects (with lower doses), and for pain relief/anti inflammatory effects (higher doses).",1700524612,ka360mj,t3_17ze0cw,t1_ka34my5,1,False,t5_4aoxhu
muhnbuht,supervised trip is planned for the new year!,1700618338,ka8tyns,t3_17ze0cw,t1_ka8n5ti,2,False,t5_4aoxhu
paranoidPOS,Yeahhhhh you right,1700663706,kaay7a4,t3_17ze0cw,t1_ka8n5ti,1,False,t5_4aoxhu
Delicious_Finding739,"Don't be a chickenshit. If you're afraid of taking risks, then how will you ever overcome your problems?

When I started my nootropic journey, in retrospect I wish I had just begun with phenibut and kratom instead of wasting my time with other things out of fear of ""muh addiction.""

I have had no issues with getting off of either even after having used them rather excessively. I learned how to control tolerance to opioid agonists and make them managable for low dose, daily use, and now take phenibut only sparingly and consider 500mg optimal.",1700568288,ka5chnv,t3_17ze0cw,t1_ka2cg0i,1,False,t5_4aoxhu
ShiftPerspective101,Don't listen to these people checkout the quittingkratom sub. It may help for a few months but will end up putting you in a worse mental space.,1700798232,kaixkxg,t3_17ze0cw,t1_ka2cg0i,1,False,t5_4aoxhu
ChidiOk,Definitely mold man,1700537113,ka40ca3,t3_17ze0cw,t1_ka27nv4,1,False,t5_4aoxhu
muhnbuht,"Just figured out that some hormone levels were checked at my last blood test: 

* Prolaktin: 8,8 ng/ml (OK)
* Testosterone: 6,37 ng/ml (OK
* TSH 1,46 mU/L (OK)

Still made up an appointent with a hormone specialist.",1700744006,kafllv6,t3_17ze0cw,t1_ka9z4jh,1,False,t5_4aoxhu
muhnbuht,"Switched to liquid oil, since 4 capsules a day didn't seem to do anything, and I wanted increase the dose without eating a ridiculous amount of capsules...",1700683562,kacf5ay,t3_17ze0cw,t1_kaceg6x,1,False,t5_4aoxhu
ReadExpert1354,"You can read as much as you can about it, but honestly no one can truly put it in words. It has to be experienced.  How was your trip?",1705774098,kirpf3x,t3_17ze0cw,t1_kafmugr,1,False,t5_4aoxhu
mag_man,"For how many years did you have that amalgam? Heavy metal toxicity is often very hard to identify when it comes to it's surface that's why you go by symptoms. In your case this amalgam might be enough to poison your brain with mercury, find dentist who uses proper safety standards when removing like IOAMT - this is very important!

After removing you can start detoxing from heavy metals, you can PM me for guidance. 

Regarding adrenal fatigue, it's completely ignored by mainstream medicine, I guess all you can do is to make cortisol level test. I know it's real because I have it and it's symptoms can be reduced by taking hydrocortisone. It might be difficult to get prescription for that stuff though.",1700849460,kalc4yq,t3_17ze0cw,t1_kal5h1n,2,False,t5_4aoxhu
BugSafe7102,Sorry it didn’t work for you. How long did you give it?,1700856351,kalt3l8,t3_17ze0cw,t1_kalbl6o,1,False,t5_4aoxhu
muhnbuht,that's good to know! thanks for that hint!,1700495218,ka10eq5,t3_17ze0cw,t1_ka07xbf,2,False,t5_4aoxhu
Personalvintage,Where are you getting your emoxipine? Nootropics Depot sold out.,1700553376,ka4ssu1,t3_17ze0cw,t1_ka4fvhr,1,False,t5_4aoxhu
CryptoEscape,"Yeah they ban you over the dumbest stuff there….I could understand removing a post, even giving a warning, but an immediate permanent ban is extreme….especially considering how badly some people need help",1700490146,ka0ot3g,t3_17ze0cw,t1_ka034dt,11,False,t5_4aoxhu
fruiop,"Hmm idk, maybe because of your account age? They could’ve thought that you’re a bot/spammer that made new account to troll or something. I don’t see anything in your post that would warrant a ban.",1700492175,ka0t8qa,t3_17ze0cw,t1_ka034dt,3,False,t5_4aoxhu
fruiop,"Yes but that’s different, this person just asked a typical question. I think it’s because of the account age.",1700492380,ka0tp93,t3_17ze0cw,t1_ka0q5xq,3,False,t5_4aoxhu
blackmak,What's the sirsadalot Bromantane situation?,1700615115,ka8mi0t,t3_17ze0cw,t1_ka0q5xq,1,False,t5_4aoxhu
couchpotatoguy,"I'm way too new to bromantane, and never used the other to have any opinions. But with my extremely limited experience with bromantane, it seems to be helpful so far, at least mood support wise.",1700603693,ka7umy3,t3_17ze0cw,t1_ka7uccd,2,False,t5_4aoxhu
kittensbabette,"Oh wow congrats on getting down to 30 gpd from 80 that's a huge deal!! Thanks for the info. I quit Suboxone after 14 years (and was on oxy for a few years previously) with Kratom and take 5 gpd but my serotonin and dopamine are trashed and like you and OP I have a hard time doing anything and it definitely doesn't help that I work from home and don't really have to work but I miss having a drive and creativity. I used to have all sorts of ideas and start projects and businesses (not that I *finished* a lot but still). I also took Adderall for years and quit when I quit Suboxone but lately have been taking a little again but really don't want to...but the lethargy has been too much. I'm super curious about 9-me-bc, I tried Kana a few times and it was suggested to put it in a piece of paper towels or toilet paper and then put it under your tongue (until it dissolves but not actually swallowing the paper). Do you think you could do that with it? Thanks for the info!!",1700673584,kabo14o,t3_17ze0cw,t1_kabm3jh,1,False,t5_4aoxhu
Personalvintage,What is your mold protocol? Mold is everywhere and for most not a concern.,1700553520,ka4szoq,t3_17ze0cw,t1_ka408ag,1,False,t5_4aoxhu
No-Adhesiveness276,Whats the protocol?,1700565042,ka57lwm,t3_17ze0cw,t1_ka408ag,1,False,t5_4aoxhu
muhnbuht,interesting! So i just need to find someone with a calm hand....,1700495592,ka11bm8,t3_17ze0cw,t1_ka0igyj,2,False,t5_4aoxhu
muhnbuht,"decades ago. these doctors just prescribed nose sprays ans never did anything helpful, so I started avoiding them... Time to find a good one I guess...",1700615157,ka8mlos,t3_17ze0cw,t1_ka89qtl,1,False,t5_4aoxhu
zasura,if it has an aphrodisiac effect then you are on a limbo between short term depression resolution and kratom fucking up your prolactin and destroying your testosterone production. So its a matter of time until it makes you impotent,1700569786,ka5f1xk,t3_17ze0cw,t1_ka5c09d,1,False,t5_4aoxhu
Delicious_Finding739,"I mean, there can easily be contaminants in kratom since it's grown in soil, unlike synthetic opioids which are produced in a lab. The differential nature of each batch also tends to make the effects of a given dose rather inconsistent. 

I see success with any opioid though, and can confirm that the endogenous opioid system is the main problem behind depression. Take care of dopamine on top of it, as with a stimulant, and you're golden. 

This is because opioids dictate social attachment drive, and a dearth of social attachment (particularly social loss), can and will cause depression.",1700525310,ka37olx,t3_17ze0cw,t1_ka360mj,1,False,t5_4aoxhu
Sispants,"Awesome, excited for you and hope it’s an enlightening experience!",1700621755,ka91mog,t3_17ze0cw,t1_ka8tyns,2,False,t5_4aoxhu
OrneryLandscape5402,dude neither of those are even remotely close to being nootropics and just because you claim you benefited from them doesn't mean everyone else will,1701826681,kc65oqq,t3_17ze0cw,t1_ka5chnv,1,False,t5_4aoxhu
muhnbuht,"No Trip so far. I found an underground facilitator closer to me but the guy cancelled the appointment. At the moment I am not even eager to find a different facilitator, since I have a new theory of where my depression might come from. I made a bioresonance treatment (I know that this is whoowhoo, but what do I have to lose?) And tested positive for Borna virus. Borna virus would explain my symptoms perfectly. Now I am trying to find a doctor who would make a blood test, to verify this.",1706304174,kjpsd17,t3_17ze0cw,t1_kirpf3x,1,False,t5_4aoxhu
muhnbuht,I have the amalgam since 25 years or so. I've read about possible mercury poisoning by amalgam about half a year ago so removing it I have been already thinking about removing it... Just been procrastinating on that issue since it wasn't urgent... Thanks for reminding me to do that and thanks for the offer to give me some guidance on detoxofication... I'll come back to you!,1700909492,kaom1jg,t3_17ze0cw,t1_kalc4yq,1,False,t5_4aoxhu
muhnbuht,"Did it for some weeks. It just felt awkward going to work all red in the face, it also didn't help with concentration, rather the opposite... But the psilocybin helped with accessing emotions, so I still do psilocybin alone, once a week before psychitherapy... I might give the Stamets Stack a second try though....",1700866006,kamgxef,t3_17ze0cw,t1_kalt3l8,1,False,t5_4aoxhu
pooptwat1,"Dextromethorphan works similarly and is also a sigma1 agonist. I took some in generic dayquil while sick recently and was wondering why my mood was so much better the following days. A study showed improvements in autistic adults and it's prescribed as a combo with wellbutrin. It would be worth trying if it's available for you, I'd just limit the frequency.",1702692428,kdk2q5j,t3_17ze0cw,t1_ka10eq5,2,False,t5_4aoxhu
muhnbuht,"probably I was banned because I posted the same post 2 times. I posted and since my posting didn't appear in the forum, I thought I might have done something wrong and posted the same content again. The ban followed seconds after the second post. Seems like nootropics can greatly improve reaction time ;-D",1700495904,ka1237s,t3_17ze0cw,t1_ka0t8qa,4,False,t5_4aoxhu
BorgoDorgo3950,"Not exactly different in the sense where there was no warning over a nonsensical issue, in regards to your previous bit in your original message where warnings were mentioned.

Yeah, account age could be the reason since OP said it was instant. But the automoderator taking your post down and warning you for your account age or karma versus getting subreddit banned are pretty different, lol.

Whatever this is, this is unwarranted and the r/Nootropics moderators are at fault until they help OP... It's just the moderators there don't have a good track record sadly. Hopefully that changes though!",1700493102,ka0vd1r,t3_17ze0cw,t1_ka0tp93,2,False,t5_4aoxhu
CryptoEscape,"Sounds like my experience with Bromantane too…mainly a subtle mood boost.  I need to give it a full six-eight weeks next time 

It’s supposed to enhance exercise under extreme conditions too (e.g. heat, high altitude/ low oxygen)

How long do you plan to take it?",1700668061,kab8zxy,t3_17ze0cw,t1_ka7umy3,2,False,t5_4aoxhu
CryptoEscape,"Thank You, and congrats on quitting Suboxone!  That must be even harder than Kratom….Id imagine suboxone tanks your testosterone and libido even worse too.

I really hope I can stay at this 30 GPD, or even get lower…,the only thing is the 9-me-bc magic will eventually wear off, and I’m worried I might slip again unless I do another cycle.

Last March I got down to 35-40 GPD and my testosterone improved a lot.

Soon I’ll need to go back on my ADHD meds too….while 9-me-bc helps me get out of bed and do basic tasks, it doesn’t help with more complex stuff, time management, or my job (work is slow now though)

Yes totally hear ya on all the projects and ideas….lately my biggest goal and concern is seeking comfort, which is antithetical to my natural personality of adventure and ambition.  I hate it.  My old self would be disgusted with my current self.

Zero creativity, except a brief burst when I use Cannabis….but no energy, motivation, or confidence to act on it.  

I’ve never heard of that with the paper.  I have no idea if that would work or not with 9-me-bc….but it’s expensive, and I don’t want to risk wasting it….but if I couldn’t tolerate it I’d def consider that.

Zyn pouches are wrapped in paper and they definitely work, so I could see how that would possibly, if not probably, work.

If after 7-12 Days of that there’s no difference I’d say it’s not working though",1700689623,kacv7zu,t3_17ze0cw,t1_kabo14o,1,False,t5_4aoxhu
ChidiOk,I used to have it on a Google doc but eventually that became outdated so I have it on pdf now but I’m about to revise it again soon. I can email you the pdf of you want just send me your email,1700583147,ka69us2,t3_17ze0cw,t1_ka4szoq,2,False,t5_4aoxhu
ChidiOk,Yeah it’s usually not an issue unless if you live in a water damaged building with high concentrations which can enable it to colonize the sinuses. It also is able to more easily colonize the sinuses of those with heavy metals issues or weakened immune systems,1700583240,ka6a3zw,t3_17ze0cw,t1_ka4szoq,2,False,t5_4aoxhu
ChidiOk,I used to have it on a Google doc but eventually that became outdated so I have it on pdf now but I’m about to revise it again soon. I can email you the pdf of you want just send me your email,1700583152,ka69vcs,t3_17ze0cw,t1_ka57lwm,3,False,t5_4aoxhu
Wellyeahso,"It is very simple to do yourself, into your thigh or shoulder muscles with a thin tipped needle you'd hardly feel.",1700502309,ka1ivpb,t3_17ze0cw,t1_ka11bm8,1,False,t5_4aoxhu
Delicious_Finding739,My prolactin has went down ever since taking a stimulant daily. Increasing dopamine will drive down prolactin so it's worth doing alongside an opioid agonist.,1700573608,ka5mg3z,t3_17ze0cw,t1_ka5f1xk,1,False,t5_4aoxhu
Upset_Scientist3994,Well I do not know if impotency is the worst out of that in long run...,1700828809,kak3ksu,t3_17ze0cw,t1_ka5f1xk,1,False,t5_4aoxhu
OfficialMilk80,"Yeah for sure I agree. Personally, fl-Modafinil along with kratom or any opioid is amazing for motivation, depression, and stress. Or a Modafinil/Benzo or Modafinil/alcohol combo. I don’t usually recommend that but it works amazingly. I’d rather use Flmodafinil or Fladrafinil than traditional atoms personally, but to each is their own. That’s just what always works for me. Flmodafinil + Phenibut + kratom/opioids + alcohol = god mode for me. But I don’t recommend it to others because that’s quite a lot to be taking all the time lol",1700526101,ka39ka8,t3_17ze0cw,t1_ka37olx,1,False,t5_4aoxhu
mag_man,"I'm happy to help, I had similar symptoms as yours and it took me years to figure out what to do and what's really behind it. 

You can do few things now for start, it's quite simple to check by yourself if you really have adrenal fatigue: buy Adrenal Cortex, made by Thorne and start like this: take one capsule as the first thing in the morning, observe what happens. If nothing happens then next day take two capsules, you can increase the dosage safely (in the past I've been taking like 5 capsules a day). Let me know how it went. More info how it works below, this supplement is commonly known as ACE because in the past Thorne used to call it Adrenal Cortex Extract or something like that.

[https://livingnetwork.co.za/lifestylefunctional-medicine/hormones/adrenal-fatigue/](https://livingnetwork.co.za/lifestylefunctional-medicine/hormones/adrenal-fatigue/)",1701123433,kb194r5,t3_17ze0cw,t1_kaom1jg,1,False,t5_4aoxhu
BugSafe7102,Maybe try reducing the amount of niacin. The goal is to open capillaries so nerve growth factor can access the ends of neurons that need it. Psilocybin and psilocin are vasoconstrictors. Try experimenting with lower doses of niacin.,1700867539,kamkhjy,t3_17ze0cw,t1_kamgxef,2,False,t5_4aoxhu
kittensbabette,"Thanks again for the info, I'll definitely consider trying it out. Best of luck with tapering down the Kratom!",1700691678,kad0jh2,t3_17ze0cw,t1_kacv7zu,1,False,t5_4aoxhu
AdCautious9799,Could you send me that . PDF please.  Thank you.  averagejoesautomotive@gmail.com,1700787369,kaic5xr,t3_17ze0cw,t1_ka69us2,2,False,t5_4aoxhu
Delicious_Finding739,"Combining alcohol with phenibut is unnecessary imo, since they're both GABAergic. As for modafinil, I dislike how norepinephrine-loaded it is, and prefer more dopaminergic stimulants. 

I also don't feel a need for phenibut on an opioid/stim combo, and would only do it if I have particular social expectations that day.",1700568676,ka5d4sj,t3_17ze0cw,t1_ka39ka8,1,False,t5_4aoxhu
CryptoEscape,"Glad to help.

I’m curious to hear if the paper works for you, or how the 9-me-bc works for you.

Come back to this comment if you remember or have any other questions, or even DM is cool too.

I’m honestly shocked at how effective it’s been.  Will make a full post soon",1700703202,kadr6n9,t3_17ze0cw,t1_kad0jh2,1,False,t5_4aoxhu
ChidiOk,"Okay, I emailed it to you, I’m rewriting some parts so right now it’s a little outdated but I sent you a rough draft, but the protocol is the same, I haven’t updated it yet, I just wrote the intro so far. So only page 1 is fully up to date. I’ll resend once I complete the protocol section",1700799545,kaj015u,t3_17ze0cw,t1_kaic5xr,2,False,t5_4aoxhu
kittensbabette,"Thank you so much, I will!",1700708945,kae3t5x,t3_17ze0cw,t1_kadr6n9,1,False,t5_4aoxhu
AdCautious9799,Thank you ❤️,1701410985,kbika8s,t3_17ze0cw,t1_kaj015u,2,False,t5_4aoxhu
AdCautious9799,You're the best,1701411005,kbikbe3,t3_17ze0cw,t1_kaj015u,2,False,t5_4aoxhu
livinginsideabubble7,"Hey I have mold issues, can you send it to me as well? Klexosliberosis@gmail.com",1701265511,kb9czeo,t3_17ze0cw,t1_kaj015u,1,False,t5_4aoxhu
ChidiOk,"Okay, I emailed it to you",1701276932,kba61he,t3_17ze0cw,t1_kb9czeo,1,False,t5_4aoxhu
