author,body,created_utc,id,link_id,parent_id,score,stickied,subreddit_id
dallasboy,"Ok, hormones. Have you had those checked?",1700449519,k9z0s76,t3_17ze0cw,t3_17ze0cw,11,False,t5_4aoxhu
Reasonable_Dot_1831,"Try emoxypine, after 10 years researching nootropics, this is by far my Nr1

Just search on reddit for Reports, all are very positive, because it's true.

My other recommendation is Agmatin sulfate, sam-e or St Johns wort.

If this stuff still does not work, try a therapeutic dose of ketamine.

For all those recommendations exits scientific studys about it, that they really working for depression or anxiety.


And if it's really testosterone related then try tong kat Ali from ND. It's one of the best natural testosterone booster.

I suffer also 10 years+ from depression, and those things were at least for me helpful, because they really worked.

I tried also every pharma antidepressants that exists here in Europe, without any success.

Exercise especially running would also tremendously improve your mental health. Try to get stable with a med/substance and then focus on exercise when you have enough energy.",1700464435,k9zp1ez,t3_17ze0cw,t3_17ze0cw,9,False,t5_4aoxhu
muhnbuht,PS: I originally tried to post this to r/Nootropics but I have been banned immediately after posting for no apparent reason. I would kindly ask you tell me if there's something wrong with my post before just banning me. Thanks in advance.,1700449030,k9yzts8,t3_17ze0cw,t3_17ze0cw,15,False,t5_4aoxhu
CryptoEscape,"So I have very very similar symptoms lately….my life is fine too.

Just getting out of bed takes enormous Will power, as does simple Tasks like making breakfast, laundry, etc.  Life feels unbearable some days, and for no reason

I started using Kratom to manage the symptoms, but it made things much worse….while it provided short term relief, regular use caused high prolactin and low testosterone, so made things worse long term.  

I started 9-me-bc , on day 9 now, and yesterday I noticed something very unusual….I got out of bed no problem.  Made breakfast no problem.  Did things I was supposed to be doing all day without needing enormous Will power.  Kratom dosage cut in half.  

I don’t feel high.  I don’t feel stimulated.  Nor manic.  I just feel….normal.  Like I’m back to life.  Life is interesting again (as it should be)

I’ve been taking 30 mg Sublingual for 15-20 min …this is a bit difficult as it really burns….but I’m so desperate to feel better I didn’t care .  This is significantly more effective than oral IME (tried same dose oral before, noticed nothing after three weeks)

Dreams have been very bizzare.  There’s photosensitivity which is why I waited until the winter to take it.

I’ve been a regular prescription stimulant user too, so my dopamine may have burnt out….9-me-bc seems to restore the functioning and tone of dopamine, without directly releasing much like an agonist (although it does have some MAOI activity, which could cause a direct increase in dopamine, serotonin, etc but it doesn’t feel super strong)

I’ve spent well over $3,000 on nootropics and this has been by far the most effective….this is actually what I was expecting from Nootropics all along 

Going to do a full post soon.",1700491275,ka0r8u0,t3_17ze0cw,t3_17ze0cw,6,False,t5_4aoxhu
Icy_Ability_4240,"You don't say if you have the Hashimoto's treated with thyroid hormone. Hashimoto's is a known cause of depression. If you don't see a doctor, I would suggest seeing one, getting your labs done and getting treated. No amount of nootropic will make you feel better until the hashimoto's is taken care of.

I would also get your other hormones checked - dhea, estadiol, progesterone, testosterone. 

Make sure your doctor gets your tsh, ft3 and ft4. T3 ( lionothyronine) can help with depression.",1700504273,ka1o72z,t3_17ze0cw,t3_17ze0cw,4,False,t5_4aoxhu
scobysex,"I know this thread is old but 

Lithium orotate, 5mg. Seriously look into it, and try it. Welands brand off Amazon, dirt cheap. 

It's entirely changed my partner's and I's life. You can be deficient in lithium, also you intake ~2mg of elemental lithium per day through just tap water. 

Somehow, taking 5mg of lithium orotate has caused me zero side effects(10mg makes me tired, so I don't do that high) and entirely changed the way I react to things. It's amazing. I can explain more as I've read into this a lot and have experience now as well as my partner. But it's crazy to me this isn't more well known. Especially because towns with higher concentrations of it in tap water  have lower suicide and homicide rates. It's an extremely interesting topic. And just anecdotally, it seriously has made a difference",1700615424,ka8n81m,t3_17ze0cw,t3_17ze0cw,4,False,t5_4aoxhu
SunDevil329,"Bromantane, Semax and/or Selank, maybe 4'-DMA-7,8-DHF with polygala tenuifolia. First three can be obtained from everychem, last two from ND. 

Testing hormones is a good idea and something I need to do myself.

Your current stack looks pretty solid to me. L-Tyrosine debatably unnecessary if you eat a decent amount of meat, but some people choose to supplement anyway. No harm in it.

This is a decent resource from /r/anhedonia that I occasionally reference:

https://www.reddit.com/r/anhedonia/s/5i8v0scurk",1700474873,ka011gu,t3_17ze0cw,t3_17ze0cw,3,False,t5_4aoxhu
acgoblue,"Not a nootropic but look into getting tested for mold. Did you move or start a new job in 2011 that could have exposed you? Mold illness can cause all of these symptoms, including Hashimotos.
Also be cautious with Lions Mane and Ashwgandha. They can cause anhedonia in themselves. Not everyone is sensitive to them but seeing as you have had reactions to SSRIs I would just be more cautious. It's possible you have a genetic reason for not detoxifying medications and toxins well. 
This is a lot of supplements, I would make absolutely certain you're getting good quality third party tested supplements and try to narrow these down.
As others have stated, get your hormones checked. Would suggest working with a functional medicine practitioner who can help get to the root cause of what's going on and help guide you in narrowing these supplements down.",1700509115,ka21b3f,t3_17ze0cw,t3_17ze0cw,3,False,t5_4aoxhu
WhiteReuben,"Cold showers, intense, but I always feel better after one.",1700591159,ka6vyq7,t3_17ze0cw,t3_17ze0cw,3,False,t5_4aoxhu
Sispants,Could maybe give Ketamine treatments a spin (if you have the financial means…isn’t cheap unfortunately). My friend has had treatment-resistant depression her entire life and Ketamine was the one thing that actually  worked for her,1700615116,ka8mi4w,t3_17ze0cw,t3_17ze0cw,3,False,t5_4aoxhu
Alternative-Being181,"I recommend taking tryptophan at night - aside from helping with sleep, it will raise your serotonin levels. 

Taking fish oil is also strongly recommended for depression - I keep mine in the fridge, and put only 4 days of the pills into my pill case, to prevent it from going rancid. Look for brands that filter out heavy metals and ideally have 3rd party testing to ensure this.

Rhodiola is good, though in some people it can worsen anxiety - for many it’s great for depression so long as they don’t take too high of a dose. Herbalists recommend taking a break from it every few months (though I’m not sure how long). I recommend Gaia Herbs.

Have you ever been tested for the MTHFR genetic mutation? It causes mental health problems and trouble absorbing B vitamins, but is very easily treated by taking active or methylated B vitamins. If you have it, it’s recommended to avoid regular folic acid since it would block the pathways, preventing you from absorbing the methylated folate used to treat it. (Sometimes bread/wheat is fortified with it, at least in the US)",1700671681,kabitg7,t3_17ze0cw,t3_17ze0cw,3,False,t5_4aoxhu
PermitOk3183,"Sounds like low testosterone symptoms. Get the following blood markers tested: 

- LH
- FSH
- total testosterone 
- free testosterone 
- SHBG
- Dihydrotestosterone


If your symptoms are not due to low testosterone, Cerebrolysin would be the nootropic of choice, at least in my opinion. You can read up on that.",1700462154,k9zm3u7,t3_17ze0cw,t3_17ze0cw,2,False,t5_4aoxhu
FlimsyMastdon,"Modafinil , take daytime daily for lower dose and ease depression gives you  energy at the same time",1700517677,ka2oh0d,t3_17ze0cw,t3_17ze0cw,2,False,t5_4aoxhu
killword-noot,"Get a sleep study, apnea can definitely cause morning (and all day even) fatigue and depression even if the only risk factor you have is congestion. 

As for psych meds, try Wellbutrin alone or I think in Europe they have reboxetine which might be helpful. We have atomoxetine here which is pretty similar (both primarily NRIs)… they cause anxiety and restlessness at first but once your body adjusts they can be calming and very helpful for ADHD symptoms. After that maybe try getting prescribed MAOIs but get off EVERYTHING if you do—drug-drug interactions are no joke with those. Modafinil also definitely worth a shot if you can get it prescribed.

I think you mentioned Lions Mane somewhere, make sure you get a good extract from fruiting bodies like Real Mushrooms or ND. A good turmeric extract is also important—Longvida is the best I’ve found for cognition, Meriva is great for inflammation.

From what I’ve seen mentioned I’d prioritize 4’-dma-7,8-dhf (very nice for mood and focus and quite a few of the things you mentioned). Unfortunately you’ll have to order from the US since I think only ND has it. Polygala extract from them is also worth a try but has less pronounced effects, good one to take on days you don’t take 4’-dma. Agmatine should be available to you in Europe and is also worth a shot, it may not be as mild as you think. Semax for cognition and Selank for mood and anxiety are also pretty good options if those are more easily available. I personally don’t think kratom is a good fit for you.",1700529957,ka3it82,t3_17ze0cw,t3_17ze0cw,2,False,t5_4aoxhu
FearlessEggplant5702,"Been checked for sleep disordered breathing(UARS/OSA)? Do you have any obvious anatomical deficiencies jaw wise? Recessed mandible/maxilla, deviated septum, nasal valve collapse?",1700552345,ka4rfk6,t3_17ze0cw,t3_17ze0cw,2,False,t5_4aoxhu
infrareddit-1,"You might consider stopping something rather than starting something. You are taking a number of things that upset my mood. Because I know this about myself, I only add one thing at a time for a week and closely monitor my mood throughout the day. You might try taking a holiday from all supplements and see how you are, carefully adding one at a time to see what impacts they have.",1700569213,ka5e1n6,t3_17ze0cw,t3_17ze0cw,2,False,t5_4aoxhu
WayProfessional1126,"For the drugs that gave you improved mood, why did you stop them?

I started Nardil, MAOI, 6 weeks ago. I am on 45mg now with the goal to go to 60mg but I'm going slow due to hypotension. My depression has moved from severe to moderate. I still have a way to go but there is improvement. I know some folks get total remission which I hope happens for me and hopefully will happen when I go to 60mg. Was hoping to stay on 45 though due to hypotension.

Anyway, it's worth exploring at some point.",1700657811,kaalsg7,t3_17ze0cw,t3_17ze0cw,2,False,t5_4aoxhu
Dagenslardom,"Hello, 

I was severely depressed and anxious with suicidal tendencies for three to four months. 

This what I do on a daily basis:

Two hours incline walk (two sessions). 
Listen to David Goggins. 

I take: 

NAC 1800 mg
L-tyrosine occasionally
Caffeine 200 mg 
B-complex methylated 
Shilajit occasionally 
D3 5000 iu with k2 400 iu
Rhodiola Rosea 450 mg
L-theanine 500 mg
Ashwaganda 600 mg (occasionally 900 mg)((incredible for lowering anxiety))
Magnesiumglycinate (800 mg elemental) 
Astaxanthin 12 mg occasionally
Boron 9 mg occasionally 
Zinc 75 mg occasionally 
EPA 2000 mg
Creatine 5 g
BCAA 7.5 g
Collagen 15 mg 
Lidl protein shake 3x/day
Mineral complex 
Iodine 

Looking to add Bacopa Monnieri and Citicoline. 

I focus on taking good care of myself by getting ripped. I focus on relationships with genuine good-hearted people. I focus on helping my friends with whatever I can. I focus on being calm and in the present. I focus on realizing that life will throw challenges your way and the only thing you can do is to never let yourself give up. 

PS: I have tinnitus too due to an asshole who made a loud noise next to me. Four months in, this just serves as extra motivation to conquer my goals. Not letting anything stand in my way. 

Strength to you.",1700841051,kakrm0x,t3_17ze0cw,t3_17ze0cw,2,False,t5_4aoxhu
SparkysBest,"Host defense mushrooms by Paul Stamets.  Look him up on Ted talks.  It sounds like you have a cellular inflammation a form of auto immune issues.  A whole host of things can trigger it.  I like Lions mane for focal clarity and Reishi for energy and immune support.  I do the tinctures.
My degree is Psychology, few understand the chemical impact of these drugs and fewer still can guess why you are off.  Food clarity, feet to earth grounding, take out the trash in your body with mushrooms, and test all your hormones but start slow with these.  Look up cellular inflammation and uptake inhibition.  Vitamins C in graduating larger doses get good quality vitamins - I like fermented ones.",1700850153,kaldv1p,t3_17ze0cw,t3_17ze0cw,2,False,t5_4aoxhu
SlipSubstantial1163,"It depends whether your depression is serotonin related or dopamine related. If the typical pharmaceutical antidepressants don't work, try something like Bromantane + Rhodiola + DLPA. I've had chronic depression for years and I've been on various prescription antidepressants (SSRI's, SNRI's, Tricyclics) and none of them seemed to help. Combining Bromantane + Rhodiola + DLPA and going to the gym has absoultely cured me, it's been 2 years now and I'm more driven, motivated and energetic than ever.",1701695916,kby730b,t3_17ze0cw,t3_17ze0cw,2,False,t5_4aoxhu
Friedrich_Ux,"Cerebrolysin or Cortexin IM and/or IN. Drop the Ash, can make anhedonia/depression worse. Saffron extract (Affron or ND's) is probably the best herbal anti-depressant besides St. Johns Wort, Polygala extract from ND is also great for mood ime.",1700504729,ka1pft5,t3_17ze0cw,t3_17ze0cw,4,False,t5_4aoxhu
Mister_Abendsen,"I would narrow down the number of supps you're currently taking, just so that you know what's doing what -- might be a few too many variables in there.  Personally I would concentrate on the inflammation aspect of depression + the neurogenesis theory of antidepressants + the dopamine axis. So likely you'd be looking at something like:  


\- a dopamine agonist like Macuna Pruriens or Wellbutrin  
\- a heavy-duty anti-inflammatory/anti-oxidant like Astaxanthin (12mg)  
\- something like Lion's Mane or Noopept for neurogenesis  
\- a Choline + Inositol supp as a nootropic adjunctive therapy  


In any case, always read up on all the things you're taking and be aware of any interactions. A bit of light reading below. Good luck on the journey, friend.  
[https://www.frontiersin.org/articles/10.3389/fnins.2021.594448/full](https://www.frontiersin.org/articles/10.3389/fnins.2021.594448/full)

[https://bmcmedicine.biomedcentral.com/articles/10.1186/1741-7015-11-200](https://bmcmedicine.biomedcentral.com/articles/10.1186/1741-7015-11-200)

[https://pubmed.ncbi.nlm.nih.gov/19240853/](https://pubmed.ncbi.nlm.nih.gov/19240853/)

[https://www.frontiersin.org/articles/10.3389/fphar.2022.916653/full](https://www.frontiersin.org/articles/10.3389/fphar.2022.916653/full)",1700466131,k9zr3ya,t3_17ze0cw,t3_17ze0cw,2,False,t5_4aoxhu
Delicious_Finding739,"Kratom and other mu-opioid agonists

/thread",1700523945,ka34fkd,t3_17ze0cw,t3_17ze0cw,1,False,t5_4aoxhu
Brandon_Quits,Eat some mushrooms bud. The fun kind.,1700453674,k9z8wft,t3_17ze0cw,t3_17ze0cw,1,False,t5_4aoxhu
StevePreston__,"Honestly sorry but I’m
Not reading all this. Have you tried a MAOi yet?",1700478285,ka052q9,t3_17ze0cw,t3_17ze0cw,0,False,t5_4aoxhu
OfficialMilk80,"KRATOM all day. 1000%. It’s the leaf of a tree and smoke everything else. Better than any drug, better than any nootropic for depression, Anhedonia, and motivation. Man it’s such a literal life saver, and it’s super cheap if you use the right vendor. 

The vendor I get from has $55 kilos (1000 grams), and most companies charge literally 5-20x that. It’s ridiculous. Higher price doesn’t = higher quality with kratom. All IS vendors order it fromIndonesia and aurroundong areas for $18-25 per kilo, then JACK the price up because they slapped their company label on it. Total BS.

Kratom is the biggest game changer you can ever use. If you take too much for too long, you’ll have WD synptoms similar to mild opioid WD’s, so just rapid taper off when you want to quit. That’s the only downside. You can get 10 years of feeling great out of it, and if you want to quit, rapid taper off over 1 month, it’s painless. Then you’re back where you were at before.",1700522837,ka31rbj,t3_17ze0cw,t3_17ze0cw,0,False,t5_4aoxhu
j__todd,Start semen retention. Psilocybin. Cerebrolysin.,1700524737,ka36b8y,t3_17ze0cw,t3_17ze0cw,0,False,t5_4aoxhu
paranoidPOS,"Holy shit you are on a lot of stuff. Stop microdosing and do 3.5g of shrooms. Or if you can find a vape shop with shroom gummies with a ""nootropic blend""...its 4-aco-dmt. No nausea with those guys.",1700581156,ka64hki,t3_17ze0cw,t3_17ze0cw,0,False,t5_4aoxhu
Tricky_Recipe768,Kratom is the solution,1700503433,ka1lxfk,t3_17ze0cw,t3_17ze0cw,-2,False,t5_4aoxhu
aadz888,"I've just read about the mthfr gene. So between 40 to 60% of people have this gene mutation which doesn't allow their bodies to use vitamin b correctly.


They supplement with a methyl vitamin b.


It would be a good idea to get your genome tested and see if you have the mutation.",1700467268,k9zsgks,t3_17ze0cw,t3_17ze0cw,1,False,t5_4aoxhu
Beautiful-Heat,"In addition to testosterone levels, have the doctor consider a chronic sinus infection.  

It sounds like you have looked into the psychology angle a lot but just based on the sheer volume of supplements you’re going through it sounds a bit like me before I was diagnosed with OCD (which I didn’t think I had at all before my therapist walked me through the conditions of “real” OCD rather than the pop-culture idea of it).",1700505985,ka1suij,t3_17ze0cw,t3_17ze0cw,1,False,t5_4aoxhu
muhnbuht,"Thank you guys for all your comments! 

&#x200B;

I want to make a short wrapup of the recommendations so far:

The most mentioned substances were:

* 4 mentions: Cerebrolysin  / P21 / Cortexin (4 mentions)
* 3 mentions: Kratom,  high dose Psilocybin, Semax / Selank , 4'-DMA-7,8-DHF / Eutropoflavin , polygala tenuifolia, Modafinil
* 2 mentions: dopamine agonists (Macuna Pruriens, Wellbutrin, Revoxetine), Agmatin sulfate, Ketamin, MAOIs, Lion's Mane, ST John's Wort
* 1 mention: 9-me-bc, Emoxypine / Mexidol, Bromantane, Memantine, Astaxanthin, Choline + Inositol, SAMe, Tumeric, Saffron

&#x200B;

Here are my thoughts on these substances:

* Cerebrolysin  and Cortexin are available in Europe and seem to be very save, and from what I understood it is more like a vitamin and doesn't change your brain chemistry, so I am inclined to start with one of these substances...
* Semax / Selank: Similar case. They are available and seem to be very safe. Also something that I could start with...
* Psilocybin is something on the bucket list, I want to do a high dose ceremony with a professional tripsitter in the new year. I want to avoid to go on any prescribed medication like Wellbutrin or an MAOI until then, since it is not recommended to do psilocybin on psych meds and trip sitters are reluctant to work with people who are on psych meds. Are there any other compounds I should be careful with when doing psilocybin?
* Kratom is not an option for me, I am far too scared of the addiction potential.
* Ketamin seems more like an emergency medication than a long term solution to me, so it is nothing I would start with, since I am interested in long term relief....
* 4'-DMA-7,8-DHF / Eutropoflavin: Couldn't find any bad reviews on it and seems to fit my symptoms, so sounds interesting to me
* 9-me-bc: Sounds very interesting to me, since I've read so many outstanding user reports on it. But seems to be unexplored and risky.
* I didn't find the time to research on the other substances yet...

&#x200B;

Recommendations to do outside the realm of nootropics:

* test for hormones levels (thyroid, testosterone) (4x)
* reuce supplements in general (3x)
* remove Ashwaganda from protocol (2x) remove lion's mane from protocol (1)
* test for Sleep apnea (2x)
* test for Mold exposure (2x)

Here are my thoughts on these suggestions: I'm definitely going to see an otolaryngologist for my sinus issues, check if there is a mold infection, and check if there can be anything done to improve my breathing, even surgery, if necessary. I'm also going to look for a private doctor who does hormone checks. I guess that I will need to find a private practitioner, since this is most likely not covered by insurance. I'm also going to cut out Ashwaganda from my supplementation protocol.

&#x200B;

Any thoughts or recommendations?",1700612989,ka8hjsx,t3_17ze0cw,t3_17ze0cw,1,False,t5_4aoxhu
photomedic13,"I hope I word this without being offensive, but if you are male or testosterone dependent go get your blood levels checked.  I fought severe depression and was treated with anti-depressants, when a solid core of my problem was low testosterone.  

Hormone imbalance has has same symptoms but is easily overlooked by your physician and treated as depression. 

As far as supplements I’d suggest Lions Mane mushroom, I’ve found it to help with my brain fog and focus.",1700624958,ka98i2g,t3_17ze0cw,t3_17ze0cw,1,False,t5_4aoxhu
MindlessCountry9223,Memantine,1700657339,kaakx6u,t3_17ze0cw,t3_17ze0cw,1,False,t5_4aoxhu
HtxBeerDoodeOG,Goddamn for being depressed you are quite detailed. I’m so depressed I haven’t showered in a week,1700663570,kaaxw1u,t3_17ze0cw,t3_17ze0cw,1,False,t5_4aoxhu
lily2456,"What kind of omega 3 supplement are you taking? Studies have showed promising results in omega 3's effect on mood, if you're interested in which omega 3 fats are more beneficial for your brain, read [this](https://www.reddit.com/r/NootropicsDepot/comments/17wv6e2/comment/kaayed6/?utm_source=share&utm_medium=web2x&context=3).",1700664078,kaaz2ov,t3_17ze0cw,t3_17ze0cw,1,False,t5_4aoxhu
TheFlashyFlash,Modafinil?,1700681994,kacaysd,t3_17ze0cw,t3_17ze0cw,1,False,t5_4aoxhu
ZaneM18,Maybe u should just try shrooms lol,1700687175,kacos1j,t3_17ze0cw,t3_17ze0cw,1,False,t5_4aoxhu
ReadExpert1354,"Sounds like you tried a lot.  Here is what I suggest.  Although not exactly nootrooics.

1. Attend a Landmark Forum Weekend. It's been online now since COVID, however in person is still the best.

2. Try a therapeutic dose of psilocybin (3.5g) in a safe familiar setting.  While listening to Imperial Colleges psychedelic playlist.  Allow the music to bring up thoughts and use the distinctions from landmark to help navigate through them. If possible have a good friend be with you and be willing to listen especially as you come off and start integrating back to reality.

3. Live your best life and pay it forward.",1700711713,kae9jew,t3_17ze0cw,t3_17ze0cw,1,False,t5_4aoxhu
More-Wolf-4409,my advice is to get a genetic test done which will highlight the genes that potentially are responsible. it will give you decide precise supplements and actions. otherwise its blindly taking anything hoping something will work,1700731921,kaf53ba,t3_17ze0cw,t3_17ze0cw,1,False,t5_4aoxhu
beatmalls3,"Considering this sub I have some controversial advice. Your story sounds very familiar. I suffered the same symptoms for around 10 years, and still do to some extent. But now I know how to recover. 

In my case it turned out I was just exhausted from constant anxiety over my performance, about being liked etc. As you say, you end up in a vicious cycle. Anyways, like you, I was always looking for a solution in external stuff: try new supplements, exercise more, socialize more, or whatever Google told me might be wrong. In the end, I crashed and discovered that all I needed was... rest. 

I think you're just tired. Stop searching for ""the solution"" and give yourself a break if you can. All of the symptoms you list are likely caused by chronic stress and just sheer exhaustion. Take 1-3 naps of 10-20 minutes a day, this will help build your energy reserve back up. Be kind to yourself, watch yourself for negative self-talk, and allow whatever comes.",1700757737,kagfqa6,t3_17ze0cw,t3_17ze0cw,1,False,t5_4aoxhu
----X88B88----,"You've tried a bunch of SSRIs/NRIs.

Time to try a MAOI like EMSAM.",1700758965,kagiudb,t3_17ze0cw,t3_17ze0cw,1,False,t5_4aoxhu
karlwikman,"Alpha-lipoic-acid. Also, increase the dose of your ALCAR to 3 grams/day. 

&#x200B;

But more than anything, do some extensive reading about psilocybin as a depression treatment, then go to a psilocybin ""retreat"" and do it. Best thing I ever did. Two treatments was all it took for my chronic depression to subside.",1700760129,kagls7v,t3_17ze0cw,t3_17ze0cw,1,False,t5_4aoxhu
PsychedStrawberry,Semax,1700760434,kagmjtd,t3_17ze0cw,t3_17ze0cw,1,False,t5_4aoxhu
