author,body,created_utc,id,link_id,parent_id,score,stickied,subreddit_id
sirsadalot,"Most of the time it doesn't lead to a hugely significant change but Omega 3s come to mind, ironically.",1651442912,i6ygrvc,t3_ug80ql,t3_ug80ql,6,False,t5_4aoxhu
N1414,"Be careful with Gabapentin. 

It works great for its indications, but it is by no means a nootropic, and prolonged use comes with withdrawals and discomfort.

I was on it for a few years and it actually worked great for my anxiety / depression. Coming off the med, even though I tapered slowly, was difficult.

Good luck.",1651473941,i70033z,t3_ug80ql,t3_ug80ql,2,False,t5_4aoxhu
Friedrich_Ux,"Aniracetam, best used with mct oil sublingually or C8 nasal spray like bromantane.",1651510823,i71rbul,t3_ug80ql,t3_ug80ql,1,False,t5_4aoxhu
lowkeyf1sh,those pills are fat itself right?,1651497191,i70vj2h,t3_ug80ql,t1_i6ygrvc,1,False,t5_4aoxhu
lowkeyf1sh,i had 3 back surgeries so im supplied for lyfe lol,1651497163,i70vh3w,t3_ug80ql,t1_i70033z,1,False,t5_4aoxhu
lowkeyf1sh,"Interesting, thanks! ✌️",1651517247,i727hki,t3_ug80ql,t1_i71rbul,1,False,t5_4aoxhu
