author,body,created_utc,id,link_id,parent_id,score,stickied,subreddit_id
Cappin_The_Turtle,"The ultimate anti-hedonism stack would be something like:

Neboglamine (NMDA glycine site agonism), 
NAC (glutamate release inhibition), 
Naltrexone (MOR antagonism), 
Huperzine A (ACHe inhibition)

That stack should help you have a clearer mind, blunt abnormal euphoria from food and drugs, and develop more balanced and rational behaviors",1692559882,jx1b85i,t3_15wi26v,t3_15wi26v,9,False,t5_4aoxhu
Juggy38,Ibogaine,1696713644,k3wm4ha,t3_15wi26v,t3_15wi26v,2,False,t5_4aoxhu
ilovedoxo,"Theacrine and Tyrosine help, same with magnesium and ALCAR",1692561100,jx1eb1m,t3_15wi26v,t3_15wi26v,1,False,t5_4aoxhu
Friedrich_Ux,"Yes, helps with any addiction.",1692566994,jx1t5lr,t3_15wi26v,t3_15wi26v,-1,False,t5_4aoxhu
Think-Quiet-3772,"nac, agmatine, memantine, emoxypine",1692601687,jx3oi9c,t3_15wi26v,t3_15wi26v,1,False,t5_4aoxhu
lambjenkemead,"If his food issue is overeating then have him get OEA off everychem. Fantastic naturally occurring compound that nukes your appetite and tons of positive side effects. I’d also second Tropisetron, Neboglamine and Black seed oil with high Thymoquinone concentration.",1692616931,jx48nz2,t3_15wi26v,t3_15wi26v,1,False,t5_4aoxhu
ODEexperience,Biogaia reuteri complety changed how i experience hunger,1692632802,jx58fwg,t3_15wi26v,t3_15wi26v,1,False,t5_4aoxhu
Hxmusa,AKA the robot stack,1692563107,jx1jdhi,t3_15wi26v,t1_jx1b85i,8,False,t5_4aoxhu
neuro__atypical,">NAC (glutamate release inhibition)

Isn't glutamate release inhibition extremely undesirable for cognition though?

Huperzine A is also an interesting choice. Why not tropisetron or Citicoline in this case, does ACHe inhibition have a unique effect in terms of anti-hedonism? ACHe inhibition does have a tolerance and long-term neuroadaption effect that could cause problems. Pramiracetam could be another alternative, it's cholinergic and specifically known for its atypical emotional blunting effect.",1692564514,jx1mywy,t3_15wi26v,t1_jx1b85i,1,False,t5_4aoxhu
Legitimate_Banana512,Noted,1697104417,k4jhvs0,t3_15wi26v,t1_jx1b85i,1,False,t5_4aoxhu
