author,body,created_utc,id,link_id,parent_id,score,stickied,subreddit_id
ScienceWins_87,What are you getting from J147?,1684741511,jl4piyh,t3_13oghn7,t3_13oghn7,3,False,t5_4aoxhu
hikkitor,"Do NOT buy the capsules from Science.bio absolutely no effects. Good or bad.

I don’t necessarily think tesofensine doesn’t work.
I think either Sfience.bio’s version was junk.
Or pill is not the best method for it.

If you search here on Reddit you’ll see im not the only one saying this.",1684790497,jl7j2a3,t3_13oghn7,t3_13oghn7,3,False,t5_4aoxhu
,"I got some tesofensine from a source during their Black Friday sale last year, but I used it for 3 weeks in April.

I have been tracking my food closely for over 5 years and done numerous bulks and cuts so I get predictable results when I increase or decrease my calories.  

Having said that, I did a minicut with 600 kcal deficit 500mcg/day tesofensine. I didn't feel a drop in energy, actually felt more energised. Did not have any appetite issues, but I already optimize my diet to maximise volume. However the focus was a bit hit and miss, sometimes it was ok, sometimes felt too scatterminded due to tesofensine being more norepinephrine biased and perhaps sporadic caffeine use also contributed.

I don't know what your goals are but I wouldn't take it as nootropic, but it works as appetite suppressant if you don't have access to anything better, eg Adderall, vyvanse etc",1684755332,jl56uro,t3_13oghn7,t3_13oghn7,2,False,t5_4aoxhu
,"I like it when I stack Longvida and EGCG, and sometimes take R-ALA with them.
I haven't heard of J147 before but I am wondering how it compares to Longvida. Longvida is said to cross BBB, so the results might be similar, or maybe even better!. I am now intrigued to try J147.",1684764633,jl5p4bn,t3_13oghn7,t3_13oghn7,1,False,t5_4aoxhu
mamabearNOV,Has anyone notice any depressive effects of taking this for almost 3 months?!? Dissociation effects??,1698875648,k7fb2fm,t3_13oghn7,t3_13oghn7,1,False,t5_4aoxhu
skytouching,Umbrella labs and I think science.bio has it I. Stock too.,1684744353,jl4ssel,t3_13oghn7,t1_jl4piyh,1,False,t5_4aoxhu
skytouching,Yeah thanks. Unfortunately I bought it right after i posted this original thread lol. But if hadn’t been impatient I’d really have appreciated the post 🙏,1684885361,jlcxwc8,t3_13oghn7,t1_jl7j2a3,1,False,t5_4aoxhu
skytouching,"Yeah I wasn’t really looking for a nootropic but to try and see if there’s anything to the antidepressant effect. There aren’t really any tripple reuptake inhibitors and even though it looks fairly week on dopamine I was just speculating how that may alter the cognitive effect. 
But yeah thanks for the response. I guess it must have been around but I just saw it on a couple of vendors and it caught my attention.",1684758493,jl5cbtn,t3_13oghn7,t1_jl56uro,3,False,t5_4aoxhu
,[deleted],1688154722,jq68wm9,t3_13oghn7,t1_jl56uro,1,False,t5_4aoxhu
skytouching,"I never ended up taking it at best it sounds like a run of the mill antidepressant which I wouldn’t doubt anyone experiencing from tesofensine. 
In some weight loss subs I read a lot of accounts of  things like aggravated mood etc however effective at weight loss.
I got hyper excited reading a couple articles on the pharmacology. It being a triple reuptake inhibitor. And the possibility of real antidepressant benefit by adding a dopaminergic component.",1699442672,k8cdj9g,t3_13oghn7,t1_k7fb2fm,1,False,t5_4aoxhu
sirsadalot,And everychem lol,1684749778,jl4z0iy,t3_13oghn7,t1_jl4ssel,7,False,t5_4aoxhu
fruiop,"Fyi, The op was asking you what effects you are getting from J147, not from where he purchased.",1684769548,jl617oh,t3_13oghn7,t1_jl4ssel,5,False,t5_4aoxhu
hikkitor,"Hopefully it’s legit for you. It could have been a bad batch for me, and this was 5 months ago. I also ordered Bpc and that did work. Post a follow up if the Teso is effective. I ordered the pills too. The injectable could be different",1684902926,jldy3j9,t3_13oghn7,t1_jlcxwc8,1,False,t5_4aoxhu
,"Ah, if antidepressants effects is what you're looking for, then I think you might not appreciate the elevated heart rate from being NRI, and the long half-life. 9 days half-life is messed up. If you look at the studies where they measure the serum levels, it starts to level after 7-8 weeks if I remember correctly. I think this is one of the reason why people can lose weight at a constant rate on this. The long half-life makes it take far too long to build a tolerance for it. This is my speculation.

Also when I stopped it, the first week was good. Then I had terrible two weeks of lethargy. Not recommended if not trying to lose weight fast.",1684761152,jl5hiii,t3_13oghn7,t1_jl5cbtn,2,False,t5_4aoxhu
,ok,1688155028,jq69oqf,t3_13oghn7,t1_jq68wm9,1,False,t5_4aoxhu
skytouching,"Oh my bad. Thanks. 
It’s hard to specifically characterize them totally and they seem to be slightly transient or occur situationally. And at the beginning of my starting it I had a really bad concussion and was going through like a month long post concussive syndrome where I was going through extreme fatigue and had frequent headaches. I can’t honestly tell if it really helped with that or it finally went away. But note that. I’ve also been going through a major depression for a long time.
When I first started at either 25-50mg I’d have to take a nap. Post nap no extremely tangible effects while just laying around watching tv, then one day in the first week I was watching something and renegade by Styx came on and I noticed how googling of a song it really is. )This wouldn’t be remarkable but I haven’t been listening to music and enjoying it unless intoxicated in a long time.)
At the time I didn’t think anything of it. Then while still extremely fatigued from the concussion I noticed being able to do things I’d only have to do if obligated. Then for the fist time in a couple months I went out to the bar with my best friend had a good time nothing remarkable but the next day even though extremely hungover I was soo happy talkative greatful and watching party down was more funny to me. One day while taking a pretty high dose of phenibut and 300 mg of gabapentin I went out to eat and I had a very hedonic experience eating, it’s a good restaurant and I really like the food there but this was extraordinary. That seems to be specific to that particular combination of substances.That lasted a day about a day, now the music thing is slightly transient and the other effects have balanced out but it was a game changer in terms of antidepressant. Also took like fifty milligrams Dexedrine for like a week and the recovery process was a lot easier. Not very depressing at all and lasted about four days in which I just needed a lot of sleep normally it’d take about a week
.But it takes work I get no more motivation for anything thing I’d normally not want or lik to do.
And all of this seems to maybe not be independent of neutrophic factors but it really doesn’t feel like that’s the main factor in its moa. It’s unlike all of the pro bdnf nootropics I’ve taken, it’s not as pep in my step as 7,8 dhf, semax or anything else I’ve tried.",1684887477,jld2620,t3_13oghn7,t1_jl617oh,3,False,t5_4aoxhu
skytouching,Oh yeah that’s unfortunate too bad from what I read it looks like they were developing other drugs with I assume more favorable transporter binding profiles. But yeah that sounds pretty rough more like a typical anti depressant for me. Not necessarily the side effects but the timeline,1684762643,jl5kmqd,t3_13oghn7,t1_jl5hiii,2,False,t5_4aoxhu
Double_Professional4,"Hi. Do you mind and sharing where  your purchased or the brand you purchased ? Thank you so much, in advance. :)!",1687127976,jomzsig,t3_13oghn7,t1_jl5hiii,1,False,t5_4aoxhu
ScienceWins_87,Thanks!,1685197570,jltqofe,t3_13oghn7,t1_jld2620,2,False,t5_4aoxhu
,It was Swiss Chems.,1687149336,joo2a6b,t3_13oghn7,t1_jomzsig,1,False,t5_4aoxhu
Double_Professional4,"Ok ,thank you. I will have to look into it. I wanted to read reviews on it .",1687179057,jop5eow,t3_13oghn7,t1_joo2a6b,1,False,t5_4aoxhu
