author,body,created_utc,id,link_id,parent_id,score,stickied,subreddit_id
Wellyeahso,It doesnt,1701986199,kcf3ovf,t3_18d4kes,t3_18d4kes,3,False,t5_4aoxhu
sirsadalot,Sounds like one of the two chemicals are seriously contaminated with something,1702004180,kcgae71,t3_18d4kes,t3_18d4kes,3,False,t5_4aoxhu
luizedu91,Good. But does it burn orally? Because otherwise I may have gotten a bad batch,1701991713,kcfhnvj,t3_18d4kes,t1_kcf3ovf,1,False,t5_4aoxhu
luizedu91,"I didn't even mix the bromantane in yet, that's only the caprilyc acid, thankfully",1702036991,kchocqd,t3_18d4kes,t1_kcgae71,1,False,t5_4aoxhu
luizedu91,"A quick question, sir: do you know if the caprylic acid you use is the isolated fatty acid, or is it its triglyceride form?

The one I bought it lab grade, so it's only free fatty acid, and triglycerides are known to be less strong and stinky (and, I suppose, do not burn).",1702319010,kcxe9dl,t3_18d4kes,t1_kcgae71,1,False,t5_4aoxhu
Wellyeahso,Mine never has had even the most slight sensation of anything other than consuming oil.,1701997193,kcfue45,t3_18d4kes,t1_kcfhnvj,3,False,t5_4aoxhu
snAp5,"Yes. All oils have a burn. Try olive oil, it’ll burn the back of your throat.",1701993437,kcflq0g,t3_18d4kes,t1_kcfhnvj,1,False,t5_4aoxhu
luizedu91,"True, but it feels much more intense than an olive oil burn. Also, the other comments here make me doubt it is really safe.",1702037188,kchonv4,t3_18d4kes,t1_kcflq0g,2,False,t5_4aoxhu
