author,body,created_utc,id,link_id,parent_id,score,stickied,subreddit_id
Better_Cupcakes,u/sirsadalot \- any comments?,1688678219,jqxxlzl,t3_14rmhrp,t3_14rmhrp,2,False,t5_4aoxhu
XQCW_VIVON420,"They do third party purity testing, you can find it on each product description",1688603385,jqtucxg,t3_14rmhrp,t3_14rmhrp,4,False,t5_4aoxhu
Wild-Fix4809,They hide their COAs per request only. Interpret that as you will.,1688593378,jqt7qyd,t3_14rmhrp,t3_14rmhrp,-1,False,t5_4aoxhu
ll3N1GmAll,"Who/What is MYASD? Sorry, I'm new to this community.",1692730346,jxb4gl0,t3_14rmhrp,t3_14rmhrp,1,False,t5_4aoxhu
MrNezzer,Purity but no toxins,1688603455,jqtuie1,t3_14rmhrp,t1_jqtucxg,1,False,t5_4aoxhu
MrNezzer,i dont think that's necessarily true -- there is a purity report listed with each product. it just doesn't detail what the impurities are,1688594101,jqt9i2v,t3_14rmhrp,t1_jqt7qyd,3,False,t5_4aoxhu
KillerGnomeStarNews,"Fresh account created as of the date of this post, with only this comment to the account. No other comments or post

Sus",1688596221,jqteere,t3_14rmhrp,t1_jqt7qyd,6,False,t5_4aoxhu
sirsadalot,"Impurities would be the starter molecules used in the synthesis of the compound. Many things that we sell are above 99%, and 98% is pharmaceutical standard. Nootropics aren't like herbal supplements in that heavy metals accumulate over decades and leech into the plants.",1688740086,jr10arc,t3_14rmhrp,t1_jqt9i2v,1,False,t5_4aoxhu
BDNFan,MYASD's alt confirmed,1688599990,jqtn0qd,t3_14rmhrp,t1_jqteere,7,False,t5_4aoxhu
XQCW_VIVON420,😹,1688603350,jqtua5d,t3_14rmhrp,t1_jqtn0qd,5,False,t5_4aoxhu
