author,created_utc,domain,id,is_self,num_comments,over_18,permalink,retrieved_on,score,selftext,stickied,subreddit_id,title,url
CryptoEscape,1675975348,self.NooTopics,10y5lvj,True,1,False,/r/NooTopics/comments/10y5lvj/alpha_gpc_and_cdp_choline_to_help_stim_crashes/,1709901464,2,"Stimulants are known for releasing dopamine, norepinephrine, and sometimes serotonin.  But they also often release acetylcholine.

Does anyone take choline sources to help replenish?  



Could Bacopa, which has acetylcholinesterase inhibitors prevent some breakdown of the extra released acetylcholine?

Thus allowing it to possibly reabsorbed and reused.

Thank You",False,t5_4aoxhu,Alpha GPC and CDP Choline to help stim crashes?,https://www.reddit.com/r/NooTopics/comments/10y5lvj/alpha_gpc_and_cdp_choline_to_help_stim_crashes/
