author,body,created_utc,id,link_id,parent_id,score,stickied,subreddit_id
ProfessionalOrder208,They are legit given that rupharma is legit. But keep in mind they only ship to the USA.,1677589112,jacf6n4,t3_11e0zcq,t3_11e0zcq,6,False,t5_4aoxhu
MmmSmellsDelish,As legit as they come,1677624940,jaew4gs,t3_11e0zcq,t3_11e0zcq,2,False,t5_4aoxhu
jamesuk7,Legit,1677973127,jay4t32,t3_11e0zcq,t3_11e0zcq,2,False,t5_4aoxhu
lambjenkemead,interesting. I hadn't see this vendor before. It looks like the exact line of products that Cosmic has.,1677593592,jaco2j3,t3_11e0zcq,t3_11e0zcq,1,False,t5_4aoxhu
EchoingSimplicity,"The Modafinil I bought seems to be on its way. I don't have it yet, though, so I can't tell you what's actually in the package, but they did indeed send a package.",1677596615,jacv1lc,t3_11e0zcq,t3_11e0zcq,1,False,t5_4aoxhu
infrareddit-1,Interesting. Please update us when you can on the products.,1677604187,jadeb6y,t3_11e0zcq,t3_11e0zcq,1,False,t5_4aoxhu
SunDevil329,"Placed an order, will let you know.",1678327664,jbhj3gw,t3_11e0zcq,t3_11e0zcq,1,False,t5_4aoxhu
SunDevil329,"They appear to use the same Zelle payment info as Cosmic, fwiw. Thought that was interesting.",1678455433,jbo784b,t3_11e0zcq,t3_11e0zcq,1,False,t5_4aoxhu
Human_Individual_379,Ordered Phenotropil from them. Works excellent for my concentration and mental stamina. Definitely legit.,1678902776,jcbm78h,t3_11e0zcq,t3_11e0zcq,1,False,t5_4aoxhu
Connect-Coyote-5825,They are legit given that rupharma is legit. But keep in mind they only ship to the USA,1680362581,jejnzqp,t3_11e0zcq,t3_11e0zcq,1,False,t5_4aoxhu
Main-Adhesiveness508,"Vendor is totally legit. Moda received in 2 weeks, works fantastically well.",1680364760,jejt3b9,t3_11e0zcq,t3_11e0zcq,1,False,t5_4aoxhu
yungtemple,Did u receive it?,1678029544,jb0oho1,t3_11e0zcq,t1_jacv1lc,1,False,t5_4aoxhu
One-Cup797,let me know,1677616389,jaeakxx,t3_11e0zcq,t1_jacv1lc,1,False,t5_4aoxhu
yungtemple,Please,1678337264,jbi2ow8,t3_11e0zcq,t1_jbhj3gw,1,False,t5_4aoxhu
EchoingSimplicity,"It's currently in New Jersey, still on its way.",1678038469,jb19gru,t3_11e0zcq,t1_jb0oho1,1,False,t5_4aoxhu
SunDevil329,Received my order today. Definitely legit.,1680066573,je3sbyz,t3_11e0zcq,t1_jbi2ow8,1,False,t5_4aoxhu
yungtemple,It come?,1678667658,jbzwpj4,t3_11e0zcq,t1_jb19gru,1,False,t5_4aoxhu
EchoingSimplicity,"Yep! And it works just as advertised. Been taking it for a few days now. Feels like being solidly awake. Find myself able to focus. No buzz though. It's just a raw ability to get shit done, and not having to worry about anything else. It's nice.",1678667828,jbzx2o6,t3_11e0zcq,t1_jbzwpj4,1,False,t5_4aoxhu
