author,body,created_utc,id,link_id,parent_id,score,stickied,subreddit_id
Black_Cat_Fujita,"Are there even enough people in the world who take Alpha GPC, to render meaningful statistics on this?",1688046533,jpzr9eb,t3_14m4un9,t3_14m4un9,10,False,t5_4aoxhu
mrmczebra,"In absolute numbers, the baselone stroke risk is 0.7% and increases to about 1% among alpha-GPC users. It's worth pointing out that study participants were all over 50.",1688046630,jpzrhdl,t3_14m4un9,t3_14m4un9,8,False,t5_4aoxhu
BigShuggy,Todays example of people who can’t read…,1688060268,jq0qjna,t3_14m4un9,t3_14m4un9,2,False,t5_4aoxhu
YoungPeublo,"Alpha GPC + Stroke Risk?

In podcast #80 Andrew mentions that a study found an association between long term use of AlphaGPC and increased risk of stroke18.

One possible reason for this is that AlphaGPC increases blood levels of a chemical called TMAO, which itself is associated with atherosclerosis.

It’s worth noting that this study looked at a cohort in Korea taking AlphaGPC regularly for cognitive decline.

Whilst the paper doesn’t specify their daily dosage, I reached out to the lead author (Gyeongsil Lee) to learn more. He said that in Korea, the typical dosage prescribed by doctors there is 400mg 3x per day, so 1,200 mg per day, every day.

So what they’re taking in a single day is roughly comparable to what Andrew might take in a week.

Andrew’s approach to reduce his TMAO levels (a tip from Dr Kyle Gillett, former podcast guest), was to add 600 mg of garlic (which contains allicin) the same day as taking AlphaGPC.

His blood work showed a decrease in TMAO after he added the garlic.


Sourced: https://fastlifehacks.com/andrew-huberman-supplements-list/

I watch a lot of the Huberman Lab on YouTube. If you haven't heard of this neuroscientist/professor, I suggest you watch a few of his videos.",1689540045,js8hwxv,t3_14m4un9,t3_14m4un9,2,False,t5_4aoxhu
Sharp-Ad5518,I wonder if this applies to other Choline supplements like Citicoline...,1688058977,jq0n2dn,t3_14m4un9,t3_14m4un9,1,False,t5_4aoxhu
EscapingQuicksilver,"I'm wondering if it may be due to excessive heavy metals in the sourced supplement? Each source differs, but overall, all supplementation has heavy metals toxins in them, which is why moderation is ideal. Depending on your body's heavy metal burden, your liver/kidneys may not be capable of filtering enough of the metals out (especially with regards to mercury or lead), resulting in the heavy metals degrading your nervous system's myelin sheath and cardiovascular health, amongst numerous other deficiencies it develops. 🤔 It's definitely a growing concern I share, as I take numerous nootropics/supplements daily. Personally, I mostly take Alpha GPC after any workout.",1688083329,jq2cioy,t3_14m4un9,t3_14m4un9,1,False,t5_4aoxhu
b0lfa,"Giving choline to folks whose diets cause their gut microbiota to rapidly produce TMAO makes sense that it would increase stroke risk, it's like throwing gasoline into a blazing fire.

For those of us who do not produce much TMAO at all (vegans/plant based eaters) if I recall correctly, taking choline is a non-issue.

We've already removed the most significant cause of stroke risk and CVD from our lives, and the bacteria who contribute to the TMAO production are largely absent from our system. The general population, or at least that selected population in the South Korean group on the other hand i assume is at higher risk of stroke and CVD in general than their general population, and a lot of the folks prescribed alpha GPC in the study i assume are of an age group that is already at higher risk anyway.

tl;dr - speculative, but IMO not a big deal if you are already minimizing the most significant risk factors for stroke and CVD.",1688603533,jqtuoga,t3_14m4un9,t3_14m4un9,1,False,t5_4aoxhu
Miriampalaciosg7,"These types of studies must be confirmed in pairs since many are related to other risk factors and not only with [alpha GPC](https://neurogent.com/alpha-gpc), since most of the people who consume it also use other substances that do alter cardiac function.",1693962292,jzbf1yz,t3_14m4un9,t3_14m4un9,1,False,t5_4aoxhu
SalemSavage,"Take another supplement that decreases the risk of stroke by 46%, I only half kidding, but it in bro science terms, it does make sense...",1706302046,kjpm5dg,t3_14m4un9,t3_14m4un9,1,False,t5_4aoxhu
mrmczebra,"According to the study, there were 108,877 people who were prescribed alpha-GPC. That's a very substantial number.",1688046733,jpzrpxx,t3_14m4un9,t1_jpzr9eb,7,False,t5_4aoxhu
Dathuryan,This was a cohort study including 12 Million individuals apparantly. But they also were 50 or older. But still noteworthy i think.,1688046660,jpzrjxa,t3_14m4un9,t1_jpzr9eb,2,False,t5_4aoxhu
Yoshbyte,Keep in mind that in some parts of the world this is seen as normal,1688111199,jq3pp3v,t3_14m4un9,t1_jpzr9eb,1,False,t5_4aoxhu
,"Ah, relative Vs absolute risk.  
Also important to note that:
> The mean (SD) age was 61.6 (9.4) for nonusers and 68.3 (10.0) years for users. In addition to being older, the α-GPC users tended to have lower household income (lowest quartile, 33.7% vs 24.1%), and more comorbidities (CCI score ≥2, 65.7% vs 29.5%) than nonusers in the total cohort 

Alpha-GPC users were older, had more comorbidities, and were from lower income households.   
It doesn't look like a randomised study is it?",1688056556,jq0glzg,t3_14m4un9,t1_jpzrhdl,7,False,t5_4aoxhu
Dathuryan,If so the stated ' Individuals using vs not using α-GPC had a 46% higher risk of stroke.' in the description of the study is pretty misleading? Where did you find these numbers?,1688046846,jpzrzcn,t3_14m4un9,t1_jpzrhdl,1,False,t5_4aoxhu
Yoshbyte,"This is what makes me uncertain about such studies. The concerns to my prior reading tend to line up with TMAO and gpc increasing it potentially. To this end, idk a good solution, but it is hard to say that these studies are much useful since the demographic is so disparate to the people who are younger using it as a nootropic. I personally doubt it implies risk in the long run if someone is younger and ceases at an older age regardless since if it is a TMAO thing ceasing would eventually cause a normalization. Again, it’s been a while though. I do wish we actually had some studies on younger people but it isn’t a viable area of research compared to the intended demographic",1688111387,jq3pxdv,t3_14m4un9,t1_jpzrhdl,1,False,t5_4aoxhu
Dathuryan,"Sorry, only can on Alpha-GPC :o) Just sharin' in case it's preventing damage u know?",1688062353,jq0w2qa,t3_14m4un9,t1_jq0qjna,0,False,t5_4aoxhu
SalemSavage,"> TMAO

thank you. will garlic reduce chances of the other one you mentioned besides stroke.",1706302297,kjpmw12,t3_14m4un9,t1_js8hwxv,1,False,t5_4aoxhu
Dathuryan,"I have no facts at hand here, but do remember people criticizing basically all of em- Citicoline, CDP Choline and now Alpha GPC. Sharing here so someone may know or remember the side effects of these. As i saw the suggested percentage of risk increase i just had to share it.",1688062284,jq0vw41,t3_14m4un9,t1_jq0n2dn,1,False,t5_4aoxhu
Dathuryan,I think the best bet is to eat stuff that detoxes all the time. The deeper i go into the nutrition biochemistry realm the more conditions i find for this or that to work - and then in the end it is fruitless bc of something psychological or environmental poisons or radiation.  Equally important to nutritions seems to be the feeling fine with it and eliminate stress as far as possible. Like also working out the right way so that it does not cause harm bc of stress and so on. It's just so many factors.,1688735900,jr0qqlo,t3_14m4un9,t1_jq2cioy,1,False,t5_4aoxhu
Dathuryan,"Thanks, yeah still i would say its nothing for everyday, or to at least off-cycle it and so on. Just my intuition with it, i never took it everyday, just sometimes for example for nootropics.",1688735586,jr0q2u6,t3_14m4un9,t1_jqtuoga,1,False,t5_4aoxhu
Black_Cat_Fujita,Think of why they were receiving the Alpha GPC in the first place and how that biases them as a population. We need a random selection of people to be given Alpha GPC to know how it’s likely to affect any given individual- not people who were prescribed it. Many people take Alpha GPC but would never be prescribed it- even if they lived in countries where that’s done.,1688052744,jq06jto,t3_14m4un9,t1_jpzrpxx,4,False,t5_4aoxhu
Dathuryan,Where does this number come from? Maybe i should take some nootropics lol.,1688051332,jq02xop,t3_14m4un9,t1_jpzrpxx,0,False,t5_4aoxhu
mrmczebra,46% is correct. I rounded the wrong way and since edited. I found these numbers from someone else who responded to this same study that I posted at another time. Hopefully someone smarter than me can double check them. The original commenter found the cohort study that showed the baseline stroke risk at about 0.7%.,1688048639,jpzw7mv,t3_14m4un9,t1_jpzrzcn,2,False,t5_4aoxhu
arvada14,Phosphotydalcholine has been found not to increase fasting TMAO levels. I was reading cho 2020 and another study that shows no increase.,1690241841,jtbexy8,t3_14m4un9,t1_jq0vw41,1,False,t5_4aoxhu
mrmczebra,It was prescribed for prevention of dementia by virtue of the fact that the sample population was over 50. It was otherwise a random sample. This is all explained in the study.,1688052976,jq075tg,t3_14m4un9,t1_jq06jto,9,False,t5_4aoxhu
mrmczebra,The number comes from the study that you posted.,1688051425,jq0362w,t3_14m4un9,t1_jq02xop,2,False,t5_4aoxhu
Dathuryan,"I see, i wish it was 0.7%, i liked Alpha-GPC...",1688051050,jq0289w,t3_14m4un9,t1_jpzw7mv,1,False,t5_4aoxhu
Dathuryan,"Very interesting, thank you!",1691134459,juqdqqh,t3_14m4un9,t1_jtbexy8,1,False,t5_4aoxhu
Dathuryan,">108,877

Got a point there, i tend to get confused quick with too many numbers. Just thought i'll share so the hive mind can decide if the study weighs enough to change ones stack. I found the number, still a bit to tired to answer sth smart.",1688051924,jq04f35,t3_14m4un9,t1_jq0362w,1,False,t5_4aoxhu
mrmczebra,"0.7% is the baseline risk. If you add 46% to that, you get about 1%.",1688052748,jq06k7x,t3_14m4un9,t1_jq0289w,1,False,t5_4aoxhu
