author,body,created_utc,id,link_id,parent_id,score,stickied,subreddit_id
neuro__atypical,"you want pure dopamine? 3-brmodafinil is a modafinil analog that's about as clean of a DRI as it gets - the effect on NE really is virtually zero. people on the discord actually dislike it because of how pure dopamine it is, but it's probably perfect for you. tak-653 has no tolerance by the way (its mechanism isn't capable of having tolerance or withdrawal), something else might be going on there.",1693772015,jyzvg5d,t3_1694p70,t3_1694p70,4,False,t5_4aoxhu
mikorbu,"Consider Neboglamine (or TAK-653) paired with NAC to reset NMDA/glutamate signaling.

Worsened anhedonia from stimulants (which inhibit AMPA/mGlur1 signaling) means it’s glutamate based, and I’ve personally cut my dose of d-amp to 1/4th now that things are flowing smoothly :)",1693768861,jyzmbbw,t3_1694p70,t3_1694p70,6,False,t5_4aoxhu
Legitimate_Banana512,"You take too much, dopamine and serotonin work via a bell shaped curve. They have very broad effects also, so it's like the gross manipulation of total dopamine/serotonin levels you do before fine tuning it with more specific mechanisms",1697188893,k4omg6s,t3_1694p70,t3_1694p70,2,False,t5_4aoxhu
Tiny_E_NYC,Bromantane made my research subject feel terrible. They wish they could take it too.,1693767226,jyzhqa4,t3_1694p70,t3_1694p70,1,False,t5_4aoxhu
AM_OR_FA_TI,Mucuna Pruriens…if you’re looking for dopamine. Most are standardized to 15-20% L-dopa.,1693781127,jz0jtjy,t3_1694p70,t3_1694p70,1,False,t5_4aoxhu
whatdidshewrite,Ask your doc about MAOIs,1693781935,jz0lres,t3_1694p70,t3_1694p70,1,False,t5_4aoxhu
Most-Laugh703,"Wait I have this same thing w all ur shit. Wanna know, do you have adhd or autism? 

Just asking bc the neurophysiology/chemistry aspect",1694323407,jzx393i,t3_1694p70,t3_1694p70,1,False,t5_4aoxhu
verysatisfiedredditr,"Maybe some leads here

https://www.reddit.com/r/betacarbolines/comments/17o9two/ultimate_dopaminergic_enhancement_stack_wip/

i think 10-methoxy-harmalan looks interesting",1699580997,k8l71h2,t3_1694p70,t3_1694p70,1,False,t5_4aoxhu
caffeinehell,"Interesting. Yea it may be. 

What about TAK makes it not have tolerance?

Also is low dose armodafinal say 25 mg or less mostly dopamine?",1693773919,jz00yei,t3_1694p70,t1_jyzvg5d,1,False,t5_4aoxhu
Nootropiks,Just curious is the modafinil analogue you mentioned a typo? I just searched 3-brmodafinil and i see 0 results of that name. No offense I’m just really interested in this compound you described lol.,1693879873,jz6gb4t,t3_1694p70,t1_jyzvg5d,1,False,t5_4aoxhu
caffeinehell,This is very interesting. Because TAK653 was one of the things that completely brightened everything two times for me altho itself is inconsistent and most of the time mild. And GABAergics/gabapentinoids also help my symptoms,1693770188,jyzq5m7,t3_1694p70,t1_jyzmbbw,0,False,t5_4aoxhu
irlostrich,I’m guessing you were just taking nebo+NAC on days off (or serious break) from d-amph? Or in combination too?,1693788487,jz11mkt,t3_1694p70,t1_jyzmbbw,0,False,t5_4aoxhu
Hot_Lingonberry5817,"Metabotropic glutamate receptor 2, NMDA, D1 but more intriguingly DARP-32 by ALCAR. ALCAR also has epigenetic mechanisms via HDAC. Also upregulates tyrosine hydroxylase. 

Seriously. Very potent substance.",1693835788,jz3g05a,t3_1694p70,t1_jyzmbbw,1,False,t5_4aoxhu
TheMuMPiTz,Are you a MD?,1693768929,jyzmi4o,t3_1694p70,t1_jyzhqa4,1,False,t5_4aoxhu
caffeinehell,"I actually tested Parnate and Nardil, albeit briefly, recently. Mentioned in the post but the Parnate has the stim like effect which results in blunting. That I only tried for 2 days and couldn’t tolerate the increased blunting. 

While Nardil I just tried and actually day 1-2 massively helped but then its serotonergic side effects like no morning wood and no libido along with more blunting kicked in on day 3-4 and now at a week feel worse. I also got bad bloating from it. 

It seems like my symptoms just get worse with MAOIs due to both the stim and serotonergic sensitivities. I need something just GABAergic or just dopaminergic. Something like Zuranolone is basically what I am waiting for but hoping I can somehow manage until then.",1693782418,jz0mxee,t3_1694p70,t1_jz0lres,1,False,t5_4aoxhu
neuro__atypical,"odd that there are no google results for it, but it's available on alkonchem where it's referred to only by the full chemical name of *2-{[(3-Bromophenyl)(phenyl)methyl]sulfinyl}acetamide*: https://www.alkonchem.com/product-page/2-3-bromophenyl-phenyl-methyl-sulfinyl-acetamide-min-98-2-5-grams

it's been discussed in the nootopics discord, and i believe someone there has linked to a paper or other resource that describes its dopaminergic and noradrenergic binding affinities",1693882118,jz6l41g,t3_1694p70,t1_jz6gb4t,3,False,t5_4aoxhu
mikorbu,"Yeah seems like aberrant glutamate signaling for sure then— NAC restores normal function to glutamate antiporters, and Neboglamine enhances the beginning of the signal cascade via mGlur1.

Funny enough I had the same response to TAK-653, but Neboglamine was an entirely different ballpark (especially when paired with the NAC).",1693778333,jz0cxxc,t3_1694p70,t1_jyzq5m7,1,False,t5_4aoxhu
whatdidshewrite,What dose parnate?,1693782583,jz0nbn2,t3_1694p70,t1_jz0mxee,1,False,t5_4aoxhu
Pure_Nourishment,"Did you give them enough time to work? Like, 4-6 weeks? I'm guessing their timeframe is similar to SSRIs but idk",1693845970,jz45opr,t3_1694p70,t1_jz0mxee,1,False,t5_4aoxhu
caffeinehell,"5 mg for parnate, 7.5 for Nardil",1693783193,jz0osaw,t3_1694p70,t1_jz0nbn2,1,False,t5_4aoxhu
caffeinehell,"I didnt wait that long as implied above because the side effects involved worsening in the symptoms that I am trying to treat, and I didn’t want to risk a crash. Like with Parnate I tried just 2 days and the stimulant robotic feeling was really bad and still took like 3 days after to resolve. Nardil I took for 1 week which as I said first 2 days was great I thought it was working right away but then its own blunting from what I think was serotonin (due to losing morning wood and 0ing my already low libido as well) happened. 

So basically emotional blunting worsened in diff ways on both (parnate immediately, nardil over a few days after initial massive improvement). 

I think my glutamate system is messed up like one comment here said and can’t handle them at all.",1693848019,jz4b099,t3_1694p70,t1_jz45opr,1,False,t5_4aoxhu
whatdidshewrite,Bro what 💀 the therapeutic dosage of parnate starts at 30mg. They don’t even have 5mg pills here they start at 10mg,1693785361,jz0tza8,t3_1694p70,t1_jz0osaw,2,False,t5_4aoxhu
Pure_Nourishment,"Totally understand where you're coming from. The medication trialing procedure is so fatiguing and depressing. I've been on a Prozac trial for a few weeks and the first two weeks I had worsening depression and anxiety. Things have felt better in the third week. Sometimes things get worse before they get better. Or, the medications just aren't for you. It's a crapshoot- albeit a painful and exhausting one.

Anywho, good luck! I hope the glutamate route treats you well 🤙",1693852521,jz4mwpd,t3_1694p70,t1_jz4b099,1,False,t5_4aoxhu
caffeinehell,"Ya my doctor told me to break the pill in half for parnate & nardil since im sensitive. Which is evidently the case considering I had a reaction to both, except for nardil it was initially positive then over the week it was more blunting while parnate was more blunting right away from the stim effect just like ritalin.",1693785777,jz0uz4d,t3_1694p70,t1_jz0tza8,1,False,t5_4aoxhu
whatdidshewrite,Have you tried the TCAs?,1693788812,jz12edu,t3_1694p70,t1_jz0uz4d,1,False,t5_4aoxhu
caffeinehell,"No aren’t they both serotonergic and noradrenergic, which are both things that create more blunting for me? They also can cause PSSD so ive avoided anything that does that.",1693789308,jz13jsn,t3_1694p70,t1_jz12edu,1,False,t5_4aoxhu
whatdidshewrite,"Yea.

Focalin maybe?",1693789377,jz13pkd,t3_1694p70,t1_jz13jsn,1,False,t5_4aoxhu
caffeinehell,"Is that one more dopaminergic at lower doses than noradrenergic?

I was considering low dose armodafinal (like 25 mg or less) how js that one in terms of minimizing noradrenergic effects and being more dopamine focused?",1693789580,jz146a5,t3_1694p70,t1_jz13pkd,1,False,t5_4aoxhu
