author,body,created_utc,id,link_id,parent_id,score,stickied,subreddit_id
BDNFan,"Coward, gargle your TAK and TUDCA like a man",1700267139,k9pggsr,t3_17xp15y,t3_17xp15y,5,False,t5_4aoxhu
e59e59,"That's just the solvent, same as with their PRL liquid. Just wait until you try tropisetron lol that's like 2 hours of onion and nap mouth",1700256276,k9oreyx,t3_17xp15y,t3_17xp15y,5,False,t5_4aoxhu
Doesded,"Honestly taking it overtime for me it doesn’t taste too bad, it honestly tastes sweet for me with a little hint of bitterness.",1700258236,k9owagd,t3_17xp15y,t3_17xp15y,3,False,t5_4aoxhu
labratdream,"Well it may be contaminated with some leftovers from synthesis. Only pramiracetam due to pH may cause chemical burns in contact with nasal or mouth mucosa.
Many rc taste strange, chemical first like it is a in case of cyclazodone or may burn like  ppap when delived intranasally however it will not cause chemical burns.

It is the best to ensure high quality and purity by doing third-party testing which is quite expensive or buy exactly same compound  from different vendor and with the same  equal purity level. If it differes in taste or even look it is worth to investigate the reasons for such difference.
It is better to be safe than sorry.",1700276180,k9pz6a1,t3_17xp15y,t3_17xp15y,1,False,t5_4aoxhu
Potential_Low4134,You kinky barstard,1700268479,k9pjb0q,t3_17xp15y,t1_k9pggsr,3,False,t5_4aoxhu
fruiop,Tropisetron not that bad. Reminds me a bit of bitter almond flavor.,1700256417,k9orroc,t3_17xp15y,t1_k9oreyx,5,False,t5_4aoxhu
GmodZ,That's exactly what trop tastes like to me lol.,1700269411,k9pl9bh,t3_17xp15y,t1_k9orroc,4,False,t5_4aoxhu
