author,body,created_utc,id,link_id,parent_id,score,stickied,subreddit_id
lambjenkemead,So helpful. I appreciate you taking the time do this research and interpretation of the data.,1681483712,jg8h1ro,t3_12lvvjq,t3_12lvvjq,11,False,t5_4aoxhu
hamzazazaA,Where can one source it?,1681484566,jg8j7gm,t3_12lvvjq,t3_12lvvjq,5,False,t5_4aoxhu
Turbulent_Zone_5324,Doing God’s work out here 🙏,1681495548,jg9blwb,t3_12lvvjq,t3_12lvvjq,2,False,t5_4aoxhu
Reasonable_Stuff4058,It’s just dropped today,1686942511,jodvomn,t3_12lvvjq,t3_12lvvjq,2,False,t5_4aoxhu
,"Hi, my mom is slowly dying from Huntington's disease can I try this on her? What dosage would you recommend... we are pretty desperate at this point.

Thank you",1692990395,jxqdk1u,t3_12lvvjq,t3_12lvvjq,2,False,t5_4aoxhu
Snoo-62854,Anyone tried?,1681491550,jg91azy,t3_12lvvjq,t3_12lvvjq,1,False,t5_4aoxhu
RunsWithSissors1,Does anyone know if there is a preferred time of day to take pinealon sub Q? Is it better to take hour is before bed or mid day?,1694480147,k06xwhz,t3_12lvvjq,t3_12lvvjq,1,False,t5_4aoxhu
Front-Dream4521,Has anyone tried this?,1706996235,kosicwq,t3_12lvvjq,t3_12lvvjq,1,False,t5_4aoxhu
oregonpelican,Can someone send me an invite to the nootropics discord server?,1709478680,kt5m0s1,t3_12lvvjq,t3_12lvvjq,1,False,t5_4aoxhu
GeorgeFandango,"One important aspect I'd like to address concerning GDF11 is its impact on liver autophagy. It tends to decrease autophagy in the liver due to increased mTOR1C activation .

That is a concern, at least for longer term use.",1709486867,kt68o3t,t3_12lvvjq,t3_12lvvjq,1,False,t5_4aoxhu
BrendenHenry,Of course! Happy to help when I can.,1681489127,jg8v0os,t3_12lvvjq,t1_jg8h1ro,6,False,t5_4aoxhu
BrendenHenry,I think everychem is going to make nasal sprays sometime next month at a good price.,1681489178,jg8v5fb,t3_12lvvjq,t1_jg8j7gm,10,False,t5_4aoxhu
XQCW_VIVON420,Either group buys or everychem is stocking it hopefully in like 3 weeks,1681487249,jg8q69s,t3_12lvvjq,t1_jg8j7gm,6,False,t5_4aoxhu
EchoingSimplicity,It may be on peptidesciences,1681487590,jg8r2eg,t3_12lvvjq,t1_jg8j7gm,2,False,t5_4aoxhu
IncreasinglyTrippy,https://cosmicnootropic.com/products/cerluten-pinealon-cerebramin-peptide-pills/,1705955887,kj3dt8s,t3_12lvvjq,t1_jg8j7gm,1,False,t5_4aoxhu
Apart-Kiwi706,Aaaaand it’s gone,1687023928,johrdjj,t3_12lvvjq,t1_jodvomn,2,False,t5_4aoxhu
BrendenHenry,"Morning or afternoon is preferred since it is not sedating and the athlete study in wrestlers was dosed morning. Also, just updated the post to the latest version as of 2/15/2024.",1707978786,kqi27le,t3_12lvvjq,t1_k06xwhz,1,False,t5_4aoxhu
BrendenHenry,"Yes, GDF11 overexpression in isolation accelerates liver senescence through decreased autophagy, but rapamycin induced autophagy prevented this effect- [https://pubmed.ncbi.nlm.nih.gov/34905649/](https://pubmed.ncbi.nlm.nih.gov/34905649/)  
  
and pinealon does not activate gdf11 in isolation, it activates many other pathways, including pathways which activate liver autophagy, such as irisin  
 [https://www.ncbi.nlm.nih.gov/pmc/articles/PMC6959141/](https://www.ncbi.nlm.nih.gov/pmc/articles/PMC6959141/)  
  
[https://www.ncbi.nlm.nih.gov/pmc/articles/PMC7588919/](https://www.ncbi.nlm.nih.gov/pmc/articles/PMC7588919/)  
   
and PPARa [https://www.nature.com/articles/cddis2014361](https://www.nature.com/articles/cddis2014361)





#",1709489011,kt6et9r,t3_12lvvjq,t1_kt68o3t,3,False,t5_4aoxhu
Theta_10,Where’d you hear this? Does he share info on upcoming chems somewhere?,1681494686,jg99ei6,t3_12lvvjq,t1_jg8v5fb,4,False,t5_4aoxhu
Good-dayayy,So looking forward to trying Pinealon once you have it in stock! Can you please update the community when it is. Will be one of the first to buy,1683134782,jiq084m,t3_12lvvjq,t1_jg8q69s,1,False,t5_4aoxhu
,[deleted],1684171620,jk9blbn,t3_12lvvjq,t1_jg8q69s,1,False,t5_4aoxhu
XQCW_VIVON420,"They have it but its way overpriced, pinealon is actually pretty cheap to synth.",1681488147,jg8sidm,t3_12lvvjq,t1_jg8r2eg,2,False,t5_4aoxhu
Reasonable_Stuff4058,That’s fast lol,1687038151,joilmzo,t3_12lvvjq,t1_johrdjj,1,False,t5_4aoxhu
Reasonable_Stuff4058,If ur on the discord server some guy bought 10 you might be able to buy off him,1687040524,joiqf0d,t3_12lvvjq,t1_johrdjj,1,False,t5_4aoxhu
BrendenHenry,Yeah in the nootopics discord,1681510846,jgad4u0,t3_12lvvjq,t1_jg99ei6,7,False,t5_4aoxhu
XQCW_VIVON420,I am not affiliated with everychem but I know a lot about them. You should see it on this reddit when it is released.,1683137426,jiq73qf,t3_12lvvjq,t1_jiq084m,3,False,t5_4aoxhu
XQCW_VIVON420,should be released within a week? hopefully,1684171869,jk9c7y0,t3_12lvvjq,t1_jk9blbn,2,False,t5_4aoxhu
karlnuw,Is it just Pinealon that's expensive on there or is pretty much everything overpriced?,1681510832,jgad3qe,t3_12lvvjq,t1_jg8sidm,2,False,t5_4aoxhu
Jazzlike_Fan232,I knew I should’ve got 2 of them it’s going to be a while for a restock.,1687284662,jouzoru,t3_12lvvjq,t1_joiqf0d,1,False,t5_4aoxhu
Fun-Soil6936,How can I get added to the discord server? Mind sending me a direct message?,1705976876,kj4zito,t3_12lvvjq,t1_joiqf0d,1,False,t5_4aoxhu
,"Do you mind breaking down how to create a nasal spray for Pinealon? What solution are you using?

I’m running an IM cycle right now at 5mg/day and it’s great so far but I would like to add in intranasal to see if it makes any difference.",1683032400,jik342k,t3_12lvvjq,t1_jgad4u0,2,False,t5_4aoxhu
Good-dayayy,Thanks for the heads up! Will stay tuned,1683139817,jiqd8aa,t3_12lvvjq,t1_jiq73qf,1,False,t5_4aoxhu
kaamkerr,everything is overpriced. The capsules are about 1/5th the price in Russia. The raw lyophilized cytogen powders are about $150-200 per GRAM from China -- peptidesciences resells them for about 20mg vial / $75,1700203217,k9lxkwr,t3_12lvvjq,t1_jgad3qe,3,False,t5_4aoxhu
XQCW_VIVON420,"Everything seems over triple the normal price they should be. For BPC it is 3x more expensive than everychem for example, and for pinealon for 10 days of Intranasal dosing or one day of oral dosing, it is 75$. Pinealon should be <0.5$/day for intranasal doseage.",1681512344,jgagh2s,t3_12lvvjq,t1_jgad3qe,2,False,t5_4aoxhu
Reasonable_Stuff4058,Fuck I hope not,1687296427,jovtsxs,t3_12lvvjq,t1_jouzoru,1,False,t5_4aoxhu
