author,body,created_utc,id,link_id,parent_id,score,stickied,subreddit_id
Efik_Pail,"Hello, I'm quite familiar with Semax and 4-dma 7,8-Dhf, but still waiting to receive Tak.

4-DMA 7,8--DHF works quite well but will, after some time, seems do downregulate TrkB (being a potent TrkB agonist)
Some people seem to pair it with Semax with success...did not try, but it pairs well with Polygala (which upregulates TrkB)...seems to do the trick.

TAK + Semax seems ok on paper, some people do it.

But I would be a bit concerned to take Tak + Semax + 7,8-DHF, as two of them are quite experimental.

AMPA Pam + TrkB agonist a the same time...well...I'd surely prefer to cycle them to avoid messing something up.


Reminder: Noots can make your more focused and improve memory, making your brain work well, like a well maintained and optimised car or like a good pre-workout when you train, but they don't improve anything by themselves, they mainly make your brain work smooth, they are not some kind of overdrive.",1693132907,jxxy4sv,t3_162kqvj,t3_162kqvj,8,False,t5_4aoxhu
itrn7rec,"Some of my personal thoughts/experiences that may be of relevance, you probably know some of these points but I also just wanted to get some feedback tbh:

TAK can be a bit stimulating, and dosage has to be right to see benefits ime. You'd be surprised how much the balance between optimal stimulation & focus can make or break peak performance on something like a grad level standardized exam(Tropi helped me stay in this balance on TAK). I also experienced reduced need for sleep (needed an hour less over several weeks of taking 2-3mg/day). It could also be the case that while many people do see concrete enhancements in cognitive function, for some the benefits are not as reliable, like for me. I suggest you test it out alone, try finding an optimal dose, and track performance on something challenging like dual n back or GRE reading section. This will be well worth it I think.

4DMA-7,8-DHF: I have not seen any studies on brain-wide localization after ingestion. I think this is key because in some regions straight up generally enhancing neuroplasticity would not be as beneficial, perhaps even detrimental. Ime it can allow greatly reduced fatigue after hours of mental work, and can be stimulating/make your focus a bit off in a way similar to mild ADHD, in fact this has been my experience with generally acting powerful neuroplasticity enhancers like Dihexa and both microdosing/macrodosing. But it has its uses, especially once in a while when you feel like you're stuck. Ime the sweet spot between synaptogenesis induced impulsivity/dysregulation of established cognitive patterns and the need for a ""boost"" to generate new patterns and break out of a rut can be accessed consistently through cycling, say 2-3 days on 7-10 days off. This was when I was studying 10+ hrs a day for an exam for over two months. I've always had this notion of cycling between periods of synaptogenesis and synaptic pruning to continuously produce incremental optimizations in efficiency to local structure and my recent experience only bolsters it. That said it may be due to the fact that my general experience with noots/history/etc all match up and point to a brain structure similar to (probably very mild)autism, which entails excessive local dendritic density and hypersensitivity in some aspects, and thus for someone else, that sweet spot is very different.

Semax: this shit probably worked for me, but effect size is not large. No small dysregulation of cognitive patterns, no impulsivity, enhanced focus, good balance between stimulation and calm taken alone. I used dual n back to track its effects and it seems to have a mild 10-20% increase in the rate of improvement past the 1-2 month plateau(assuming you're familiar with this), over a month or so.

Cardio: ime absolutely crucial for cognitive enhancement, I have experimented with this for years and used to be a middle distance runner, the first two of which I experienced massive improvements in IQ(but I was 15-17 years old so it's not a reliable measure, but still). I suggest two modes: 1. Interval training 15sec max effort, 1min 45sec walking rest, build up to repeating 4-8 time depending on fitness. Great for enhancing pain tolerance which helps a ton during studying as well. I had this idea of interval training inducing mild hypoxia ultimately resulting in enhanced pruning of overproduced/underutilized dendritic branches, no idea if this is scientifically backed, but over years of doing this, I would say it works one way or the other. 2. Long distance zone 2 (I personally stayed around 150-165 bpm/near my lactate threshold) build up to 45min then focus on increasing speed. Occaisional long sessions of up to 1.5-2hrs every 3-4 weeks or so can also greatly improve mitochondrial profile and has been a great way to cause a huge metabolic stress spike which I would argue can be good every once in a while given proper recovery and some experience training. This specifically helps with enhancing prolonged focus, and apparently increasing hippocampal and frontal lobe size. I had a period where I had to train exclusively long distance for several months, and by then I had laser focus and supreme executive control, but also what felt like a marked reduction in creativity/random thoughts/new patterns of cognition. This again gets at the idea of that sweet spot between neuroplasticity induced new patterns of cognition vs focus/pruning induced stabilization and strengthening of practiced patterns of cognition. I suggest HIIT, rest, zone 2, rest, repeat. I lift on my cardio rest days and workout 6 days a week. Expect to see the very noticeable improvements after several months. New hippocampal cells apparently take 3-4 weeks to mature, and long term structural changes in other regions take a while to be really noticeable, or so I've read.

Dual n back: I've tried it for a while, intermittently and consistently. It works for the first several months, I want to say around 4-6 months, after which the benefits seem to be incremental. That said I think that if after the 2 month newbie gains period you're at dual 6 back and after an year of training you're at consistent dual 12 back, you can't not have enhanced your IQ by several points simply due to the massive effect size. But it depends on whether you were truly at your functioning maximum at all points. Nowadays, syllogimous V3 seems a bit more interesting, and tbh doing a shit ton of reading complicated, dense, and diverse texts probably is more helpful and useful long term depending on occupation/goals. Good for a medium term several months challenge tho, and those can yield some concrete benefits ime. I imagine 6 months dual n back, switching to something else like syllogimous v3 for 6 months, then maybe an instrument/new language for another 6 months, and so on, and occaisionally returning to past endeavors for a few months every once in a while can yield long term not just new skills but also increased intelligence at some level. Or so I hope.",1693146687,jxymvme,t3_162kqvj,t3_162kqvj,14,False,t5_4aoxhu
FrogFister,"microdosing + meditation consistently to take things to next level. or meditation alone but should be 2 hours a day, see what happens in about a week, beats the shit out of every supplement.",1693325092,jy8vzvs,t3_162kqvj,t3_162kqvj,2,False,t5_4aoxhu
Kuroneko1916,"NSI-189 has some decent results for verbal fluency I believe its a DRI, NRI, and has weak MOR binding 

Magnesium L theronate helps modulate gaba, and sodium potassium channels which facilitates spatial awareness via NR2B upregulation

CDP-Choline or Acetyl L Carnitine would bd good for acetylcholine (ALCAR also helps activates AMPK which upregulates insulin receptor and sensitivity as well as DRD1, and 5HT-1A)

NAC helps protect against some types of hepatotoxcity, and regulates Glutamate, Acetylcholine, and Dopamine.

TUDCA. has another mechanism separate from NAC thay facilitates liver protection.

Don't take Alpha GPC as it has about a 47% risk of stroke with use",1693134483,jxy08bd,t3_162kqvj,t3_162kqvj,1,False,t5_4aoxhu
harry_lawson,"Posts like this make me roll my eyes

Edit: either OP used his alt to seem like he's got more support than he has, or this community is filled with people who use 4chan speak. Look at this shit lmao, what the fuck has this community come to? https://imgur.com/a/3WNpjUI",1693132894,jxxy497,t3_162kqvj,t3_162kqvj,0,False,t5_4aoxhu
wallyxii,People still think TAK is doing something 😂,1693146769,jxyn2wi,t3_162kqvj,t3_162kqvj,1,False,t5_4aoxhu
,"Hey dude!

Wanna work in your goal.

Do you have email or something?",1693157755,jxzf4rt,t3_162kqvj,t3_162kqvj,0,False,t5_4aoxhu
Tiny_E_NYC,Have you tried or researched either Noopept or Pinealon?,1693809534,jz2820q,t3_162kqvj,t3_162kqvj,1,False,t5_4aoxhu
entavias,Seconded,1693201365,jy20u3h,t3_162kqvj,t1_jxxy4sv,4,False,t5_4aoxhu
,Thank you very much. Do you have anything else to add to the stack of my goal is to become more intelligent?,1693147061,jxynsk9,t3_162kqvj,t1_jxymvme,1,False,t5_4aoxhu
,Top tier comment. Saving as a reference,1693150747,jxywweh,t3_162kqvj,t1_jxymvme,1,False,t5_4aoxhu
entechad,Bravo!,1693162164,jxzqed0,t3_162kqvj,t1_jxymvme,1,False,t5_4aoxhu
tsmc_227_447_bowie,"4DMA-7,8-DHF sounds very interesting. It sounds like it increases neuroplasticity. Are there any evidence backing this up?",1694011438,jzdwbof,t3_162kqvj,t1_jxymvme,1,False,t5_4aoxhu
mrmczebra,"46% *increased* risk of stroke over 10 years if you're over 50

https://jamanetwork.com/journals/jamanetworkopen/fullarticle/2786547",1693139905,jxy8skm,t3_162kqvj,t1_jxy08bd,8,False,t5_4aoxhu
EveningFinancial836,"If you say Alpha GPC ist not ok then ALCAR is the same they were both synthesis to TMAO by gut bacteria especially if you eate animal protein there was a study who showed that vegans dont convert ALCAR to TMAO cause the dont have the gut bacteria. In the Study they say after a half jear vegan the gut bacteria changed so ther was no risk... But every one is individual. Dr. Steven Gundy sayed he had 2 vegan patients who sill produce TMAO but the dond know whow... Hey sayed its possible to paralyze this bacteria by a substance found in Balsamic vinegar, red wine and native olive oil
Good luck!",1693138104,jxy5py8,t3_162kqvj,t1_jxy08bd,3,False,t5_4aoxhu
,"Hello there!

It seems you know a lot. I have some studies. 

Would you like to review them, share your opinion and think of a drug combination to achieve something that is close to what has been found in the studies?",1693158554,jxzh7q9,t3_162kqvj,t1_jxy08bd,0,False,t5_4aoxhu
,[removed],1693133181,jxxyhat,t3_162kqvj,t1_jxxy497,-13,False,t5_4aoxhu
,I need it to raise my IQ so I can be smart enough to seduce your mom so she sucks my cock,1693147258,jxyo9wq,t3_162kqvj,t1_jxyn2wi,-6,False,t5_4aoxhu
,"No, TLDR please?",1693809932,jz28ocp,t3_162kqvj,t1_jz2820q,1,False,t5_4aoxhu
itrn7rec,"Honestly it's a bit hard to say because you kind of need different ones for different purposes and those purposes all converge to enhance task performance, of which idk exactly how much would be strictly IQ. And most of this being situational and individual to a large degree doesn't help much either. Bromantane for example can be great for reversing short term anhedonia due to extremely stressful periods, and this is important because once you go deeper down that hole it impacts your general cognitive function a shit ton. And if you're super stressed because you're studying 10+ hrs a day for months, then it's absolutely critical for maintaining optimal performance throughout. You also can't ignore basic supplements like PQQ, a choline source, DHA-1000, B complex, taurine etc and good healthy sources of fats, and things like blueberries and dark chocolate.

I'm going to say extensively testing nebo could prove beneficial as well although it might depend on individual brain structure and neurochemistry. And racetams too. Basically the big everychem stuff like pinealon, roxa, tropi, brom, carnosic acid, etc are probably all worth experimenting with individually just to see if you can push yourself further on those. Methylene blue seems really cool too, would be interesting to compare with an NAD related supplement.

Most importantly, you have to be doing something where you're pushing your ceiling constantly to have a nuanced sensitivity to the effects of these. Or that's just been my experience.",1693148584,jxyrjh3,t3_162kqvj,t1_jxynsk9,4,False,t5_4aoxhu
itrn7rec,Thanks lol,1693152204,jxz0mwe,t3_162kqvj,t1_jxywweh,1,False,t5_4aoxhu
Kuroneko1916,"Alpha GPC's mechanism is different, although when taken together it allows the acetyl group from Alcar to more readily latch onto choline, upregulating acetylcholine.",1693142022,jxycs2o,t3_162kqvj,t1_jxy5py8,4,False,t5_4aoxhu
harry_lawson,"Maybe you should stop looking to increase IQ and start looking to mellow yourself out, you got your panties in quite a tight wad there. Maybe try some L-theanine or Phenibut.",1693133577,jxxz02y,t3_162kqvj,t1_jxxyhat,7,False,t5_4aoxhu
whattodoaboutit_,So you're too much of a moron otherwise?,1693228041,jy32no6,t3_162kqvj,t1_jxyo9wq,3,False,t5_4aoxhu
wallyxii,if anything tak you reduced your IQ talking like that,1693159850,jxzkkrn,t3_162kqvj,t1_jxyo9wq,2,False,t5_4aoxhu
Several-Yellow-2315,https://www.psypost.org/2023/08/new-psychology-research-indicates-that-general-cognitive-ability-is-linked-to-reduced-emotional-responding-168200,1693267414,jy5v2lw,t3_162kqvj,t1_jxyo9wq,1,False,t5_4aoxhu
AromaticPlant8504,"Ikr Increasing IQ will make him even more if a dic,k.",1693142447,jxydmt0,t3_162kqvj,t1_jxxz02y,2,False,t5_4aoxhu
,[removed],1693133750,jxxz88h,t3_162kqvj,t1_jxxz02y,-8,False,t5_4aoxhu
harry_lawson,"Haha I know how bad it is, would definitely mellow him out. Seems OP got offended, not me. Might wanna check your reading comprehension there bud, or maybe go back to 4chan or something.",1693134009,jxxzksm,t3_162kqvj,t1_jxxz88h,3,False,t5_4aoxhu
,[deleted],1693134404,jxy047i,t3_162kqvj,t1_jxxzksm,-7,False,t5_4aoxhu
harry_lawson,Lmao,1693134428,jxy05gq,t3_162kqvj,t1_jxy047i,3,False,t5_4aoxhu
Kuroneko1916,Nice alts,1693142083,jxycwjq,t3_162kqvj,t1_jxy05gq,1,False,t5_4aoxhu
