author,body,created_utc,id,link_id,parent_id,score,stickied,subreddit_id
resinsuckle,This subreddit has saved me from depression and life-altering ADHD symptoms and I couldn't have done it without y'all,1699051203,k7pridy,t3_17mwloj,t3_17mwloj,7,False,t5_4aoxhu
sirsadalot,"Hey just hopped on reddit to see this. Thanks for the positivity, much like what you remarked, finding that is equally so rare. So appreciate you too. Good luck with your progress.",1699097130,k7rx1km,t3_17mwloj,t3_17mwloj,9,False,t5_4aoxhu
Real-Yogurtcloset770,Well done buddy! Thanks for making me smile!,1699023445,k7npf0h,t3_17mwloj,t3_17mwloj,4,False,t5_4aoxhu
analXplorer,"Just have to chime in and praise the positivity!

It’s amazing how much of a positive influence biochemistry and supplementation can have on peoples lives",1699102809,k7s6ukx,t3_17mwloj,t3_17mwloj,3,False,t5_4aoxhu
Connect-Lake-6715,I'm a fast learner,1700279714,k9q5yf1,t3_17mwloj,t3_17mwloj,1,False,t5_4aoxhu
Connect-Lake-6715,Made a 99% on the chemistry GRE,1700279799,k9q63sy,t3_17mwloj,t3_17mwloj,1,False,t5_4aoxhu
,[deleted],1699369878,k87zfhk,t3_17mwloj,t1_k7pridy,3,False,t5_4aoxhu
freshprincemufasa,"thank you, i appreciate your reply.",1699097507,k7rxlbb,t3_17mwloj,t1_k7rx1km,3,False,t5_4aoxhu
freshprincemufasa,"appreciate it man, thank you aswell",1699035158,k7olc44,t3_17mwloj,t1_k7npf0h,2,False,t5_4aoxhu
freshprincemufasa,Most definitely. Can be life changing no doubt.,1699105638,k7scuj1,t3_17mwloj,t1_k7s6ukx,1,False,t5_4aoxhu
resinsuckle,"Taurine, Agmatine sulfate, collagen peptides from bovine, creatine, NAC. All of these are considered proteins, aside from taurine. Agmatine is no.1 in terms of noticeable benefits like depression and anxiety relief. It's great for neuroprotection too",1699393952,k89u31r,t3_17mwloj,t1_k87zfhk,2,False,t5_4aoxhu
