author,body,created_utc,id,link_id,parent_id,score,stickied,subreddit_id
gnootynoots26,All I want is that beautiful Fasoracetam.,1653942891,ial2lwn,t3_v174uv,t3_v174uv,5,False,t5_4aoxhu
Discipline_General,Good read thanks,1654026384,iap74oh,t3_v174uv,t3_v174uv,3,False,t5_4aoxhu
TheOptimizzzer,Should’ve bought more PP while I could…,1654286615,ib2pvlm,t3_v174uv,t3_v174uv,2,False,t5_4aoxhu
dmt267,Imma be sad 🥲,1655945488,iddgyvs,t3_v174uv,t3_v174uv,2,False,t5_4aoxhu
tayfun333,What exactly is that stuff and what is it doing?,1653937301,iakqs8d,t3_v174uv,t3_v174uv,1,False,t5_4aoxhu
HiLiiife,"Man... I just recently started running out of the oxiracetam I bought years ago. Oxiracetam was always my favorite racetam to use for stacking. I came back to the scene and was like, ""wtf happened?"" It's sad to see how every racetam has been phased out... Heck even a few months ago when I peaked, there was still some aniracetam floating around with these vendors... Not anymore! lol Thanks for the explanation though! I felt so in the dark. haha",1682385940,jhlhsd8,t3_v174uv,t3_v174uv,1,False,t5_4aoxhu
sahandthebilioner,i tell u the reason becuase they increase brain function and increase your IQ which is not qood thing for governments my friends,1695501626,k1whwqr,t3_v174uv,t3_v174uv,1,False,t5_4aoxhu
Emotional-Sense-7104,"I DID THAT!    
\-THE BIG GUY",1709519659,kt8p3wg,t3_v174uv,t3_v174uv,1,False,t5_4aoxhu
thekazooyoublew,Is it stimulating? I can't get a clear image of what the effect is with this one.,1653954836,ialqiq8,t3_v174uv,t1_ial2lwn,4,False,t5_4aoxhu
Zdog54,You can get fasoracetam from newmind still. You need an approved account to be able to buy from them but it's honestly not that hard to do. I was able to pass their application by doing some quick Google searches and I completely half assed the entire thing and still got approved,1653947468,ialc24v,t3_v174uv,t1_ial2lwn,3,False,t5_4aoxhu
BobEylid,[Google.scholar.com](https://Google.scholar.com) wikipedia.org,1654018806,iaoqskr,t3_v174uv,t1_iakqs8d,2,False,t5_4aoxhu
entropeutic,"im quite sad at the racetam sweep thats happening. i have a bunch of oxi/ani left but thats it. its disgusting how authorities just take shit away from us like that, shit that does wonders for our quality of life in general. why do they like to take away the things we love the most? meanwhile, killers like alcohol and tobacco run rampant, making us dumber and giving us cancer. but some cool interesting compounds that do the opposite of make us dumber with no carcinogenic properties? i guess anything that doesnt keep us dumb and dying is not ok to them... so many things wrong with so many things :(",1685500912,jmaf434,t3_v174uv,t1_jhlhsd8,2,False,t5_4aoxhu
DrPhuctard,"I've seen oxiracetam on chemical exchange's website. Piracetam on there as well, and fasoracetam on paradigm peptides",1688327295,jqf2ydm,t3_v174uv,t1_jhlhsd8,1,False,t5_4aoxhu
Stuffnbuttsdotcom,Tell me more,1654357247,ib5ldcl,t3_v174uv,t1_ialc24v,1,False,t5_4aoxhu
tayfun333,I whas hoping for a short answer given me the just of it,1654020694,iaovbbf,t3_v174uv,t1_iaoqskr,2,False,t5_4aoxhu
Zdog54,There really isn't much else to tell lol. Unless you have any specific questions.,1654366727,ib63exu,t3_v174uv,t1_ib5ldcl,1,False,t5_4aoxhu
BobEylid,That's what wikipedia is for :),1654023286,iap1gpy,t3_v174uv,t1_iaovbbf,3,False,t5_4aoxhu
tayfun333,Well it's not really a short Wikipedia article but I will take a look at it,1654101328,iasxzmf,t3_v174uv,t1_iap1gpy,1,False,t5_4aoxhu
