author,body,created_utc,id,link_id,parent_id,score,stickied,subreddit_id
MezDez,Not at all..,1687836015,jpods9k,t3_14jvlsz,t3_14jvlsz,0,False,t5_4aoxhu
HowlingElectric,"I say go for it. Maybe start low with the donepezil, but that's only due to my personal lack of experience with it's use.",1687907455,jpsbvh9,t3_14jvlsz,t3_14jvlsz,1,False,t5_4aoxhu
,[deleted],1687837722,jpogvhz,t3_14jvlsz,t1_jpods9k,2,False,t5_4aoxhu
raji,"I dmed you for more info, I actually want to see your opinions.",1687866950,jppl7qr,t3_14jvlsz,t1_jpods9k,1,False,t5_4aoxhu
MezDez,"You think inhibiting AChE if you don't have a severe problem already, is not going to cause a massive bell shaped curve in your desire of its outcome?

Selegiline is garbage. Inhibits GABA in certain areas of the brain, and actually mao-b has recently been re-evaluated as entirely functioning in astrocytes.",1687844635,jporqgd,t3_14jvlsz,t1_jpogvhz,0,False,t5_4aoxhu
PermitOk3183,Can you please explain why it is garbage?,1687881596,jpqhu76,t3_14jvlsz,t1_jporqgd,3,False,t5_4aoxhu
D2_Agonist_Master,Why would he bother explaining that when he’s making such a statement? I’d be surprised to hear back anything.,1688223210,jq9kjy2,t3_14jvlsz,t1_jpqhu76,2,False,t5_4aoxhu
whatdidshewrite,"Too much acetylcholine causes a ton of issues, like depression, muscle twitches/fasciculations, insomnia, etc",1689258160,jrt1nmu,t3_14jvlsz,t1_jpqhu76,1,False,t5_4aoxhu
PermitOk3183,I thought his statement referred to selegiline. How does selegiline affect achetylcholine levels?,1689275192,jru829h,t3_14jvlsz,t1_jrt1nmu,1,False,t5_4aoxhu
