author,created_utc,domain,id,is_self,num_comments,over_18,permalink,retrieved_on,score,selftext,stickied,subreddit_id,title,url
,1687872847,self.NooTopics,14kdxu4,True,1,False,/r/NooTopics/comments/14kdxu4/any_dopaminergic_synergy_between_bromantane_and/,1709901384,4,"Considering adding metergoline to my stack for its broad serotonin receptor antagonism. It is also an agonist at D2 and was wondering how it would fare when stacked with a TH upregulator like bromantane. Positives, negatives etc",False,t5_4aoxhu,Any dopaminergic synergy between Bromantane and Metergoline?,https://www.reddit.com/r/NooTopics/comments/14kdxu4/any_dopaminergic_synergy_between_bromantane_and/
unknowntrojan,1687852927,self.NooTopics,14k7akp,True,41,False,/r/NooTopics/comments/14k7akp/cognitive_enhancement/,1709901384,12,"There's probably been thousands of threads like this already, but what are some nootropics that have most profoundly helped with your cognitive skills or, more generally, productivity (I would count reducing brainfog as an improvement, too)?

I'm personally interested about the effects in the context of ADHD and autism.",False,t5_4aoxhu,Cognitive Enhancement,https://www.reddit.com/r/NooTopics/comments/14k7akp/cognitive_enhancement/
raji,1687818943,self.NooTopics,14jvlsz,True,8,False,/r/NooTopics/comments/14jvlsz/low_dose_selegine_donepezil_memantine/,1709901384,2,"Is this a good idea to add to a stack? And how would it affect cognitive and athletic performance?

Thank you!",False,t5_4aoxhu,Low dose Selegine + Donepezil + Memantine?,https://www.reddit.com/r/NooTopics/comments/14jvlsz/low_dose_selegine_donepezil_memantine/
