author,body,created_utc,id,link_id,parent_id,score,stickied,subreddit_id
Fine-Tale2468,"Store in the fridge if you can. I use both Bromantane and their NA Semax. Works fantastic. No interactions. 

FYI — I refrain from taking Semax after about 2:00 p.m. otherwise I'm awake at night. Not everybody's the same but that's just me.",1689759509,jski17a,t3_153i7vu,t3_153i7vu,4,False,t5_4aoxhu
sirsadalot,"It's somewhat less necessary due to the polysorbate 80 added to increase stability, but still better if refrigerated",1689752341,jsk93dl,t3_153i7vu,t3_153i7vu,3,False,t5_4aoxhu
familyfeedaye,"Yeah I was a bit iffy with dosing cause I got my Semax today and was not gonna risk it ahaha, in terms of Semax because obviously the everychem formula would be somewhat different too the rupharma one is it only 2 sprays for best results ? Thank you for taking the time too reply aswell",1689763108,jskmtmm,t3_153i7vu,t1_jski17a,2,False,t5_4aoxhu
familyfeedaye,"Deadset the reason I asked cause one thing I’ve always noticed with your nasal sprays is it’s always in a solution that prevents it from degrading during shippage appreciate the response, had been using coke during the saturdays for the past week the minute I began my bromantane cycle feeling way better already, goes too show you get every benefit from when you have punished your receptors. Combining both bromantane and Semax is safe?",1689762992,jskmnlb,t3_153i7vu,t1_jsk93dl,1,False,t5_4aoxhu
Fine-Tale2468,"Do you have instructions on how to administer nasal spray? 99% of people do it wrong. 

I always share this [helpful diagram. ](https://imgur.com/a/bUuW0pK)
Hope this helps.",1689768766,jskw4m4,t3_153i7vu,t1_jskmtmm,3,False,t5_4aoxhu
sirsadalot,"Yeah glad to hear you found something that isn't cocaine, lol",1689776691,jsldjto,t3_153i7vu,t1_jskmnlb,1,False,t5_4aoxhu
familyfeedaye,Bahahaha only recreational but shows the difference between a already baseline person vs downregulated dopamine person when using bromantane,1689784255,jslxand,t3_153i7vu,t1_jsldjto,1,False,t5_4aoxhu
