author,body,created_utc,id,link_id,parent_id,score,stickied,subreddit_id
Whatever_acc,selegiline is actually neuroprotective,1685217913,jlv0jcq,t3_13sae0i,t3_13sae0i,4,False,t5_4aoxhu
lambjenkemead,Take Guanfacine at night. Should be good combo though,1685103962,jlow04v,t3_13sae0i,t3_13sae0i,1,False,t5_4aoxhu
EccentricOhms,This sub needs a megathread for arguments concerning selegiline and rasagiline. It’s ridiculous how much contradictions I see on here. Especially with selegiline.,1685225357,jlvgaz4,t3_13sae0i,t1_jlv0jcq,1,False,t5_4aoxhu
BigWhat55535,"Guanfacine + Atomoxetine?

You'd think they might diminish each other's effects.",1685313234,jm00eld,t3_13sae0i,t1_jlow04v,1,False,t5_4aoxhu
