author,body,created_utc,id,link_id,parent_id,score,stickied,subreddit_id
XQCW_VIVON420,Dopamine reuptake inhibition is less desirable than upregulation.,1683135610,jiq2dr5,t3_136sej1,t3_136sej1,2,False,t5_4aoxhu
tnttyler,Ooooooooooooooooo,1683133632,jipx81m,t3_136sej1,t3_136sej1,1,False,t5_4aoxhu
werefuckinripper,Don’t SSRI’s increase the risk of developing dementia?,1683165645,jis2uk5,t3_136sej1,t3_136sej1,1,False,t5_4aoxhu
entechad,Sounds like a Parkinson’s treatment. Also sounds dangerous.,1683285740,jiy6oov,t3_136sej1,t3_136sej1,1,False,t5_4aoxhu
0phenyl,"On a serious note; why not both, with cycles of the reuptake inhibition?",1683140097,jiqdy62,t3_136sej1,t1_jiq2dr5,3,False,t5_4aoxhu
leafghost64,Forsen bajs,1683151473,jir6t99,t3_136sej1,t1_jiq2dr5,3,False,t5_4aoxhu
Khronosgod,"Yeah because the brain will end up with fewer receptors, so it wont matter if you have dopamine, is not going to get used. Makes sense",1683138290,jiq9bwi,t3_136sej1,t1_jiq2dr5,1,False,t5_4aoxhu
AromaticPlant8504,What has that got to do with the OP’s post?,1683222023,jiuvaiq,t3_136sej1,t1_jis2uk5,3,False,t5_4aoxhu
jahbiddy,"Not that I’m aware of. Serotonin isn’t known for that. Anticholinergics, GABAergics, and even opioids are more known for that shit.",1683242503,jiw9ziy,t3_136sej1,t1_jis2uk5,2,False,t5_4aoxhu
drogison,"no its actually the opposite, they decrease the chance for it",1692391755,jwru6e7,t3_136sej1,t1_jis2uk5,1,False,t5_4aoxhu
XQCW_VIVON420,On a silly note; why not just dopamine upregulation which has better effects?,1683142482,jiqk0s7,t3_136sej1,t1_jiqdy62,-3,False,t5_4aoxhu
Jeannnnnnnnnn,Vice versa,1690717026,ju288ui,t3_136sej1,t1_jiq9bwi,1,False,t5_4aoxhu
0phenyl,"It doesn't have better effects - if you think dopamine upregulation can match reuptake inhibition in terms of efficacy, you're deluded.",1683142867,jiql0fi,t3_136sej1,t1_jiqk0s7,18,False,t5_4aoxhu
