author,created_utc,domain,id,is_self,num_comments,over_18,permalink,retrieved_on,score,selftext,stickied,subreddit_id,title,url
,1667555953,self.NooTopics,yluhw7,True,21,False,/r/NooTopics/comments/yluhw7/anyone_have_experience_with_phenylpiracetam/,1709901502,8,"Really want to purchase phenylpiracetam to add as stimulant in my rotation with modafinil and 4f-mph. My reason being is to keep tolerance down to the effects for the stimulants.  I also had amazing results, effects using phenylpiracetam in the past when I could easily find it. Now I can only find phenylpiracetam hydrazide, has anyone had good experiences? How
Does it compare?",False,t5_4aoxhu,Anyone have experience with Phenylpiracetam Hydrazide? I cannot find regular phenylpiracetam anywhere in stock.,https://www.reddit.com/r/NooTopics/comments/yluhw7/anyone_have_experience_with_phenylpiracetam/
sirsadalot,1667517698,self.NooTopics,yli9zl,True,21,False,/r/NooTopics/comments/yli9zl/my_response_to_bromantaneco_being_taken_down_by/,1709901502,45,"Hello everyone.

Please be patient with me as I deal with njal.la delisting Bromantane.co. Because of this the new domain will be everychem.com, which I had been planning on transitioning to anyways. It will go live 11/6/22. All orders placed before this backstabbing will still be shipped, but we will be a few days in limbo as everything is taken care of.

Please stay updated with me, I will follow this up with another post and I'm going to need your help here.

Going to attempt to transfer my domain from njal.la but they are acting unprofessional and possibly doing illegal things to keep me from my domain. Wish me luck.",False,t5_4aoxhu,My response to Bromantane.co being taken down by njal.la,https://www.reddit.com/r/NooTopics/comments/yli9zl/my_response_to_bromantaneco_being_taken_down_by/
