author,body,created_utc,id,link_id,parent_id,score,stickied,subreddit_id
andalusian293,"It's not pleasant to insufflate, but I've taken other compounds this way experimentally, and it does work.",1655503457,icrku7m,t3_veqxgc,t3_veqxgc,2,False,t5_4aoxhu
319Macarons,Probably safe but I don’t think bromantane is soluble in it if that’s your goal,1655527652,icst0ek,t3_veqxgc,t3_veqxgc,2,False,t5_4aoxhu
Rolio99,Its not pleasant. Ive tried it too but i feel some part of it sliding in my throat,1655549663,ictivks,t3_veqxgc,t3_veqxgc,1,False,t5_4aoxhu
Consistent-Camp9289,"Hey, wondering if you've had success  
Any feedback?",1657909510,igan9qt,t3_veqxgc,t3_veqxgc,1,False,t5_4aoxhu
blnkacc,"Thanks, yeah I guess 😄 I’ll try at least",1655537945,ict5z57,t3_veqxgc,t1_icrku7m,1,False,t5_4aoxhu
blnkacc,It is. It’s already. Thanks,1655537855,ict5vg4,t3_veqxgc,t1_icst0ek,1,False,t5_4aoxhu
blnkacc,"Hey,

It worked good. First time was really weird.
I had to pause after few days because of other reasons and plan to start again tomorrow actually",1657913992,igayera,t3_veqxgc,t1_igan9qt,1,False,t5_4aoxhu
Consistent-Camp9289,"Thanks for the reply :)  
Would it be okay if i asked about the reason you put a pause to it?  
And what conc. did you solve your bromantane in PEG400 to?",1657914979,igb0tqv,t3_veqxgc,t1_igayera,1,False,t5_4aoxhu
blnkacc,"I had a lot of brain fog/fatigue at the time so I thought I’ll wait until I am completely free. Now it seems better.

It was already mixed with peg400. 50mg/ml from
Science.bio",1657952415,igd4hl3,t3_veqxgc,t1_igb0tqv,1,False,t5_4aoxhu
