author,body,created_utc,id,link_id,parent_id,score,stickied,subreddit_id
,why l tyrosine use bromantane instead sirsadalot wrote post on why l tyrosine is basically useless for dopaminergic shit XD,1697329098,k4wxek0,t3_177z49t,t3_177z49t,4,False,t5_4aoxhu
,yes,1697323333,k4wjzpn,t3_177z49t,t3_177z49t,2,False,t5_4aoxhu
ketofolic,"By the time you consume the cod liver oil it is highly oxidized, basically PUFAs turn into a mix of 4HNE, Acrolein and other highly reactive aldehydes that even serve as biomarkers for disease. They suppress immune function and therefor people wtith primary autoimmunity issues might feel initial relief, but youre going down a very dirty road to mitochondrial dysfunction, wrong hormone signaling, insulin resistance, oxLDL etc... Same accounts for other products with high PUFA, especially Omega-6, content, like seed oils. Avoid at all costs.",1697395270,k50e31x,t3_177z49t,t3_177z49t,2,False,t5_4aoxhu
gnootynoots26,2,1697506165,k577ner,t3_177z49t,t3_177z49t,2,False,t5_4aoxhu
AromaticPlant8504,7,1697348136,k4xy9nc,t3_177z49t,t3_177z49t,1,False,t5_4aoxhu
Upset_Scientist3994,"Works to extent it works, but dont know how much it is other peoples task to rate it since it is unclear what it even means. 

I believe that this type of posts should go to reddit nootropics - section and not here. There is lot of this type of posts there, and that subreddit is becoming increasingly specialized of such.",1697444905,k53a611,t3_177z49t,t3_177z49t,1,False,t5_4aoxhu
Jazzlike_Fan232,"Man oh man, I don’t know if this post is real or being sarcastic.",1697356014,k4y8wrw,t3_177z49t,t1_k4wxek0,0,False,t5_4aoxhu
,[deleted],1697388928,k4zwwn0,t3_177z49t,t1_k4wxek0,0,False,t5_4aoxhu
ilovedoxo,Tyrosine is literally a precursor to dopamine 😂,1697414124,k51r2ej,t3_177z49t,t1_k4wxek0,1,False,t5_4aoxhu
Turbulent_Zone_5324,This 🙏,1697324542,k4wmsly,t3_177z49t,t1_k4wjzpn,2,False,t5_4aoxhu
apextruthspeaker,"Source for your absurd claims regarding ""mitochondrial dysfunction, wrong hormone signaling, insulin resistance, oxLDL, etc"" or are you just talking out of your ass? Many supplement companies have stringent regulations for oxidation, and the effects of the low amounts presented are negligible or outweighed by the benefits of omega-3s. There is an indisputable mountain of evidence supporting the supplementation of omega 3s for health and cognition so I don't understand your stance on the matter. Please elaborate and provide citations for claims.",1697639685,k5eo42a,t3_177z49t,t1_k50e31x,2,False,t5_4aoxhu
,literally look at the science behind it XD,1697391801,k504lxd,t3_177z49t,t1_k4zwwn0,-1,False,t5_4aoxhu
,"6. Failed approaches to improving dopamine  
Dopamine precursors: L-Tyrosine and L-Phenylalanine are used as supplements, and L-Dopa is found in both supplements and prescription medicine.  
  
Both L-Tyrosine and L-Phenylalanine can be found in diet, and endogenously they experience a rate-limited conversion to L-Dopa by tyrosine hydroxylase. L-Dopa freely converts to dopamine but L-Tyrosine does not freely convert to L-Dopa.  
  
As elaborated further in prior posts, supplementation with L-Tyrosine or L-Phenylalanine is only effective in a deficiency, and the likelihood of having one is slim. Excess of these amino acids can not only decrease dopamine, but produce oxidative stress.\[14\] This makes their classification as nootropics unlikely. Their benefits to stimulant comedown may be explained by stimulants suppressing appetite.  
  
L-Dopa (Mucuna Pruriens in supplement form), come with many side effects,\[15\] so much so that it was unusable in older adults for the purpose of promoting cognition. In fact, it impaired learning and memory and mainly caused side effects.\[16\] XD",1697414869,k51ssae,t3_177z49t,t1_k51r2ej,1,False,t5_4aoxhu
BorgoDorgo3950,F,1697403243,k510476,t3_177z49t,t1_k504lxd,1,False,t5_4aoxhu
