author,body,created_utc,id,link_id,parent_id,score,stickied,subreddit_id
Goto_User,"collect then read all the papers you can on each, take notes of important information you'd put on Wikipedia. Then, search for interactions. Don't think you aren't going to hurt yourself just because you're trying to go with chemicals that ""have good safety profiles"". You absolutely can harm yourself. If you're willing to be a guinea pig, try it after you do your research. Have consistent sleep and diet, as consistent as possible. Taking nootropics thinking it will make you smarter is like overclocking and installing CCleaner thinking it will make your 1080 run like a 4080.",1697338443,k4xhi68,t3_1782w5i,t3_1782w5i,7,False,t5_4aoxhu
nutritionacc,I refuse to believe this is a parody account because it's actually representative of the average nootropics redditor,1697380037,k4zab3k,t3_1782w5i,t3_1782w5i,7,False,t5_4aoxhu
polgesteirg,XD,1697430461,k52qhul,t3_1782w5i,t3_1782w5i,2,False,t5_4aoxhu
AromaticPlant8504,Depends what wwb is,1697362216,k4ygonu,t3_1782w5i,t3_1782w5i,1,False,t5_4aoxhu
,yes of course but i am also posting here to gain additional information and anecdotes XD,1697352413,k4y47xo,t3_1782w5i,t1_k4xhi68,1,False,t5_4aoxhu
,u/sirsadalot look at this comment XD,1697352776,k4y4p8m,t3_1782w5i,t1_k4xhi68,0,False,t5_4aoxhu
,white willow bark it synergizes well with istra basically a better version of caffeine + aspirin XD,1697362390,k4ygwdh,t3_1782w5i,t1_k4ygonu,1,False,t5_4aoxhu
sirsadalot,"Does this parody account get funny at some point, or are you just trying to be obnoxious",1697359264,k4yczsx,t3_1782w5i,t1_k4y4p8m,2,False,t5_4aoxhu
,respond to my comment this is a dumb comment to say papers can only give so much the whole point i am asking this in the first place is to get anecdotes from other people XD,1697360192,k4ye5se,t3_1782w5i,t1_k4yczsx,0,False,t5_4aoxhu
sirsadalot,"Well go about it in a better way, I have no interest in entertaining your questions if you're going to put xd after everything and not have much substance in what you're asking",1697365090,k4yk8au,t3_1782w5i,t1_k4ye5se,8,False,t5_4aoxhu
Goto_User,seems like a lot of never going to happen and not worth your time to me,1697432016,k52t1gf,t3_1782w5i,t1_k4ye5se,1,False,t5_4aoxhu
