author,body,created_utc,id,link_id,parent_id,score,stickied,subreddit_id
,[deleted],1679778614,jdo1hb2,t3_121z4eh,t3_121z4eh,3,False,t5_4aoxhu
BDNFan,"I've taken 180mg DXM with 4mg TAK and I notice it greatly potentiates the antidepressant effects while reducing the cognitive impairment. The usual TAK introspection was magnified 10 fold along with the DXM's child like perspective 

Another interesting combo I've done is: DXM, ALCAR, Sarcosine, Tropisetron.",1679804427,jdpjhoy,t3_121z4eh,t1_jdo1hb2,4,False,t5_4aoxhu
Spirited_Gap7644,Someone reported doing TAK with Bupropion; which is known for lowering the seizure threshold greatly. So it may be that TAK is somehow atypical in that nature.,1679821619,jdq5bu6,t3_121z4eh,t1_jdo1hb2,3,False,t5_4aoxhu
,When I use ketamine on my own I pretty much always take Tropisetron beforehand just to attenuate the nausea. I'm not sure if its partial agonism of the a7 receptor wins out over ketamine's antagonism but the latter's affinity for the receptor is weak all things considered (\~3um),1679859905,jds6ch9,t3_121z4eh,t1_jdpjhoy,2,False,t5_4aoxhu
