author,created_utc,domain,id,is_self,num_comments,over_18,permalink,retrieved_on,score,selftext,stickied,subreddit_id,title,url
paulm19855,1706199430,self.NooTopics,19fczxj,True,7,False,/r/NooTopics/comments/19fczxj/memantine_benzo_wd_ocd/,1709901209,2,"Is anyone on Memantine long term ? 

I’m experiencing benzo wd and have bad pre existing ocd .

As you would expect , due to wd my mental ocd is insane atm . 

Used Agmatine and campral throughout taper which helped to an extent , but now ready to jump from benzo ocd is insane . 

Question is , for people who have tried Memantine for ocd , if it works can one say on this drug long term ?",False,t5_4aoxhu,Memantine benzo wd /ocd,https://www.reddit.com/r/NooTopics/comments/19fczxj/memantine_benzo_wd_ocd/
