author,body,created_utc,id,link_id,parent_id,score,stickied,subreddit_id
MystcJnx,never had an issue with nootropicsource honestly man. everything came to me as expected every time i’ve ordered.,1699823032,k8z85td,t3_17tpwhu,t3_17tpwhu,1,False,t5_4aoxhu
Wellyeahso,"What is the reputation of NootropicsSource? 

If only EveryChem accepted crypto, but they don't, so NS seems like the only reasonable alternative.?.?",1699819005,k8yx126,t3_17tpwhu,t3_17tpwhu,1,False,t5_4aoxhu
Jacob03013,"Yes, he needs to accept BTC",1699872010,k91v91d,t3_17tpwhu,t1_k8yx126,2,False,t5_4aoxhu
e59e59,Do you avoid the grocery store cause 'muh bitcoin' too?,1699819342,k8yxyht,t3_17tpwhu,t1_k8yx126,3,False,t5_4aoxhu
Wellyeahso,Yes.,1699822156,k8z5ph8,t3_17tpwhu,t1_k8yxyht,1,False,t5_4aoxhu
