author,body,created_utc,id,link_id,parent_id,score,stickied,subreddit_id
EzemezE,Sarcosine. It's main metabolites are D-Serine (specifically the d isomer) and glycine,1664599679,iql9aju,t3_xsg6v0,t3_xsg6v0,3,False,t5_4aoxhu
sirsadalot,Blackburn distributions,1664584549,iqkhznf,t3_xsg6v0,t3_xsg6v0,2,False,t5_4aoxhu
Zeezprahh,Bump,1664591471,iqkvgvj,t3_xsg6v0,t3_xsg6v0,2,False,t5_4aoxhu
Zeezprahh,OP can u msg me your other go-to's for nootropics since I also live in Aud?,1664591512,iqkvjo4,t3_xsg6v0,t3_xsg6v0,2,False,t5_4aoxhu
Fayiss_123,"Sorry, didn’t clarify this in post. I live in Australia.",1664585359,iqkjlv3,t3_xsg6v0,t3_xsg6v0,1,False,t5_4aoxhu
Fayiss_123,"Thanks Sir. Unfortunately, they don’t ship to Australia, which I’m following up with them. 

Will put a clarification about Aus location",1664585160,iqkj7ni,t3_xsg6v0,t1_iqkhznf,2,False,t5_4aoxhu
EzemezE,>Sarcosine. It's main metabolites are D-Serine (specifically the d isomer) and glycine,1664599716,iql9cig,t3_xsg6v0,t1_iqkvgvj,2,False,t5_4aoxhu
Fayiss_123,Done x,1664593771,iqkzmvr,t3_xsg6v0,t1_iqkvjo4,1,False,t5_4aoxhu
leafghost64,"They do, I'm Australian",1664662334,iqoeas9,t3_xsg6v0,t1_iqkj7ni,2,False,t5_4aoxhu
Fayiss_123,"I’ll keep an eye on my emails. It didn’t allow me in the shipping options, but they said to contact them to get it shipped.

Anyways, found a place that holds the prototype nutrition stock.",1664663440,iqogp0c,t3_xsg6v0,t1_iqoeas9,2,False,t5_4aoxhu
