author,body,created_utc,id,link_id,parent_id,score,stickied,subreddit_id
Friedrich_Ux,Do not combine 9-Me with amphs or any other substance that increases monoamines considerably. Its an MAOi and may amplify the neurotoxic effects of amph.,1649522824,i41xxko,t3_tzc69n,t3_tzc69n,1,False,t5_4aoxhu
The-Swiss-Chad,Why would you use uridine with amphetamine 🙃🤔,1650057525,i4vq4vh,t3_tzc69n,t3_tzc69n,1,False,t5_4aoxhu
Intrepid_Ratio_7405,"I meant not to take the vyvanse the days I take 9-mbc, but maybe its still dangerous considering the half life?",1649586442,i45cqws,t3_tzc69n,t1_i41xxko,1,False,t5_4aoxhu
Intrepid_Ratio_7405,"To counteract the downregulation that im scared of. Bc vyvanse is the only thing after years of different antidepressants that make me feel hedonic/not depressed.

So i try to at least prevent it from not working later on",1650396469,i5dt5fv,t3_tzc69n,t1_i4vq4vh,1,False,t5_4aoxhu
DownvoteMeYaCunt,is there evidence that uridine reduces amph efficacy?,1650224769,i54bm9b,t3_tzc69n,t1_i4vq4vh,1,False,t5_4aoxhu
defenestration01,You’d be right. Mixing MAOIs and releasers can turn bad very fast. Generally I’d recommend 24-48 hours after the half life before taking a releaser just to be sure.,1649687661,i4arc9i,t3_tzc69n,t1_i45cqws,1,False,t5_4aoxhu
The-Swiss-Chad,How long did you take antidepressants? And which one?,1650564389,i5na6v5,t3_tzc69n,t1_i5dt5fv,1,False,t5_4aoxhu
The-Swiss-Chad,If you build tolerance your still being downregulated,1650564422,i5na9sw,t3_tzc69n,t1_i5dt5fv,1,False,t5_4aoxhu
The-Swiss-Chad,"Nothing direct, but uridine blocks dopamine receptors. I dont see how they would be synergistic.",1650225587,i54di98,t3_tzc69n,t1_i54bm9b,1,False,t5_4aoxhu
Intrepid_Ratio_7405,"I did the 9-mbc for just one day(will try it for real soon when i take a couple weeks break from meds) but wow..  it added almost 2hrs on the 5hrs my vyvanse is effective for me..

It might be placebo but i dont usually get much placebo effect.. but, we will see how it affects my anhedonia after a 3weeks use later on:-)",1650396306,i5dsp56,t3_tzc69n,t1_i4arc9i,1,False,t5_4aoxhu
Intrepid_Ratio_7405,"Escitalopram, zoloft, cymbalta, quetiapine, mirtazapine, clonidine, lamotrigine, intuniv, and a couple more I don’t remember their names..

Been taking so many different meds since I was 15 and most of the illegal drugs as well, but sober now from that. I’m thinking of trying to replace vyvanse with bupropion",1651898658,i7n5obz,t3_tzc69n,t1_i5na6v5,1,False,t5_4aoxhu
defenestration01,"That great! Perhaps the only mild MAOI effects of 9-me-bc allow the amphetamine to stick around longer than normal but without elevating levels to uncomfortable/dangerous amounts. 

I’d be interested to see how this goes long term if you could make a post down the road. Still be careful though. MAOI effects can build up over time, so after only a few regular doses it may be fine, but after a longer period of time negative effects may come up.",1650396911,i5dudhn,t3_tzc69n,t1_i5dsp56,1,False,t5_4aoxhu
The-Swiss-Chad,"What is important is how long you have been using them, most anti-depressants don't start working until multiple months of consistent usage. Also most of the anti-depressants you mentioned are prone to lots of side effects, which among other things my favorite one is vortioxetine or in the US (trintellix), since it barely has any side effects except most commonly neausa. (Which also btw can be easily be circumvented through ginger supplementation). I obviously highly advise against using vyanse. Its at best a very temporary solution. You quickly build tolerance, dependance and often times addiction to it. So it's not sustainable in the long term. It also most likely also is neurotoxic, so I highly advise you if you want to quite, slowly tytrate down your dosage over time and opt for better alternatives. I recommend like I mentioned using 5mg of vortioxetine (at that dosages most people don't have any side effects at all!) or go up to 10mg and use something like ginger to manage neuasa (which is most common). Use it regularly and don't expect an effect until multiple months down the line. As it is hard to wait so long and you will probably be dealing with discontinuation symptoms from vyanse, I recommend talking to your doctor about Intranasal Ketamine for the time being until the vortioxetine starts working sort of to bridge the gap until effects fully kick in. This should work for you and will be much better in the longterm, I hope you will be able to slowly titrate down from vyvanse without having suvere discontinuation symptoms. Like I said using **prescribed** intransaal ketamine will be a good option to get through the time when you are titrating down and are concurrently taking vortioxetine. Hope this helps",1651958267,i7q17yt,t3_tzc69n,t1_i7n5obz,1,False,t5_4aoxhu
The-Swiss-Chad,Also there isn't a lot of safety data on 9-me-bc (it is mainly used in animal models) some prediction softwares predict it to be carcinogenic among other things. I don't necessarily recommend it.,1651958474,i7q1ora,t3_tzc69n,t1_i7n5obz,1,False,t5_4aoxhu
Intrepid_Ratio_7405,"Yes of course, i will! And these weeks i wont take much else and def no stims. Always been curious if i could get the same antidepressant effects from an mao-b inhibitor as i get from amphetamines.  I Guess not as strong but maybe a more natural happiness less forced. Or maybe none at all xD well see I will start in a week",1650397182,i5dv5ki,t3_tzc69n,t1_i5dudhn,1,False,t5_4aoxhu
Intrepid_Ratio_7405,Agree im gonna buy bromantane instead!,1657979222,ige7aa7,t3_tzc69n,t1_i7q1ora,1,False,t5_4aoxhu
