author,body,created_utc,id,link_id,parent_id,score,stickied,subreddit_id
Friedrich_Ux,It will enhance emotions both positive and negative. So if you are in a bad state or engaging in bad behaviors it will intensify and reinforce those bad habits.,1700927644,kapiss2,t3_18396sn,t3_18396sn,2,False,t5_4aoxhu
Alksfrench,"It gave me brain fog and worsened my visual snow when i started 2-3 weeks ago. I'm taking it IN, 2ml/7days when i started, less is better for me at the moment. I'd say better start low and take breaks.",1700911974,kaopbol,t3_18396sn,t3_18396sn,1,False,t5_4aoxhu
Mediocre_Art3895,"I did a cycle of cerebrolysin for 14 days at 2mL each night. 

I am 20 years old. 

My goal was to have some sort of general cognitive enhancement and “heal my brain.”


In my personal experience, I did not notice much positive or negative.",1701234199,kb827k6,t3_18396sn,t3_18396sn,1,False,t5_4aoxhu
Alksfrench,"I can confirm, this effect has intensified in recent days for me but it's more pleasant than nsi-189 in that aspect. It makes me nostalgic sometimes but in a nicer way",1700939596,kaqdmtm,t3_18396sn,t1_kapiss2,4,False,t5_4aoxhu
No_Register_9003,Have those side effects gone away now? How much were u taking for those effects to appear?,1700915655,kaouk9u,t3_18396sn,t1_kaopbol,1,False,t5_4aoxhu
Educational_Ad_5359,"From my two year experience with IM cerebrolysin you need to get up to a high starting dose at the jump, like 5ml daily for 1-2 weeks then a smaller maintenance dose like the 2 ml 

Something like a total of 60 ml in your first 2 weeks imo",1704250322,kg2no0x,t3_18396sn,t1_kb827k6,1,False,t5_4aoxhu
chachbagmcgraw,NSI makes you nostalgic in a not so nice way?,1700967993,kasdobs,t3_18396sn,t1_kaqdmtm,1,False,t5_4aoxhu
Alksfrench,I only have them when i take too much. Intranasaly i put 2ml cerebro and it lasted 1 week. (IN dose is much lower than IM). I'm taking 2x less and it feels much better.,1700938260,kaqa5vg,t3_18396sn,t1_kaouk9u,1,False,t5_4aoxhu
