author,body,created_utc,id,link_id,parent_id,score,stickied,subreddit_id
Rascalthewolf,"For me, a strategy might involve 0.5 mg of insufflated Noopept. This could be paired with a modest amount of caffeine, depending on my level of fatigue. However, if the exam is particularly lengthy and demands sustained energy and concentration, I might opt for Modafinil instead.",1703619171,kf0ur5k,t3_18qvdig,t3_18qvdig,2,False,t5_4aoxhu
Odd_Watercress_6968,"Coffein, gingko biloba, and phenylpiracetam are my favorites. L-theanine, 5-HTP if you feel anxiety",1703619315,kf0v4gp,t3_18qvdig,t3_18qvdig,2,False,t5_4aoxhu
wvkid101,"Theanine or taurine should be up there - anxiety reduction means more knowledgeable thoughts and a clearer intuition.

Practice exams if you can find them might be a good bet too. Your brain works best when it is automated to the format of what it has to do.",1703614727,kf0j7wm,t3_18qvdig,t3_18qvdig,1,False,t5_4aoxhu
DiegPosts,Trialing before hand might be a good idea. I would hate take a combination of something to find it harms me,1703620775,kf0yuxn,t3_18qvdig,t3_18qvdig,1,False,t5_4aoxhu
WizardOfTheDessert,Huperzine A is great for acute dosing IME. Stacks well with caffeine for energetic tunnel vision. Make sure to have a choline source with it if you stack with other noots though.,1703621215,kf0zyyo,t3_18qvdig,t3_18qvdig,1,False,t5_4aoxhu
flodereisen,State dependent memory is a thing - do not take anything for your exam you do not take regularly when studying. Easy way to mess up.,1703622545,kf13f36,t3_18qvdig,t3_18qvdig,1,False,t5_4aoxhu
lambjenkemead,"Phenylpiracetam+CDP Choline, Bromantane and Tropisetron",1703701340,kf5jv8o,t3_18qvdig,t3_18qvdig,1,False,t5_4aoxhu
Cinderellaman-98,"I still have around a week before the exam, which one of the nootropics can I routinely take until then?",1703637976,kf25k68,t3_18qvdig,t1_kf13f36,1,False,t5_4aoxhu
